pid,essay_type,essay,score,comments,millis
48548,angry,"I tend to spend a lot of time in my thoughts and as a result tune out from the world around me. This sometimes results in me forgetting to reply to texts or messages, or being hard to reach. I think that can be sort of frustrating for the people around me. I would feel bad and actively try to do better.",0.80,"

Composite score: 0.8

Reasoning: 

The participant's response is highly consistent with the hallmarks of humility. 

In terms of hallmark A, the participant demonstrates a calm and accepting self-concept by acknowledging their weakness of being forgetful and hard to reach. However, this does not cause excessive distress for them. 

In terms of hallmark B, the participant perceives themselves and others clearly without exaggerating information. They accept responsibility for their mistakes and acknowledge their weakness. 

In terms of hallmark C, the participant remains open to discovering new insights about themselves and the world. They are teachable and seek the truth, even when it may be personally embarrassing or unflattering. 

In terms of hallmark D, the participant shows a lack of self-focus and an increased awareness of and appreciation for others. They acknowledge that their behavior can be frustrating for others and express a desire to do better. 

In terms of hallmark E, the participant demonstrates egalitarian beliefs by acknowledging their own weaknesses and valuing the importance of others' feelings. 

Overall, the participant's response is highly consistent with the hallmarks of humility, resulting in a composite score of 0.8.",8787
66044,angry,"I imagine this person is angry with me because I had said something about them behind their back. I do not do this often unless I feel really comfortable with the person I am disclosing this information to, but if they had gone on to tell the person I was talking about what I had said I could see that leading to someone being angry. I would feel horrible about it, because i never feel good talking about someone behind their back, but when I do it is usually out of necessity because I feel I could not talk to the person outright without ruining our relationship.",0.60,"

Composite score: 0.6

Reasoning: 

The participant's response is largely consistent with the hallmarks of humility. 

In terms of hallmark A, the participant demonstrates a calm and accepting self-concept, as they are able to acknowledge their behavior without excessive distress. 

In terms of hallmark B, the participant is able to perceive themselves and their behavior clearly, without exaggerating or minimizing their actions. They also take responsibility for their behavior, which is consistent with humility. 

In terms of hallmark C, the participant is open to discovering new insights about themselves and the situation, as they acknowledge that their behavior could have led to someone being angry. They also express a willingness to learn from negative feedback. 

In terms of hallmark D, the participant does not appear to be overly self-focused, as they express concern for the other person's feelings and acknowledge the potential harm caused by their behavior. 

In terms of hallmark E, the participant does not explicitly express egalitarian beliefs, but their response does not contradict this hallmark either. 

Overall, the participant's response demonstrates a good degree of humility, as they are able to acknowledge their behavior and take responsibility for it, while also expressing concern for the other person's feelings.",9940
33874,angry,Someone is angry with me because I wasn't 100% listening to them and they're frustrated with me and I'm frustrated with them. Perhaps we're having a serious conversation and I'm not listening to them fully and they're frustrated over the fact that I'm not understanding what they're trying to tell me because I'm not listening fully. I'm upset at the situation because I'm frustrated because they're upset with me and I want to try and solve the problem by hearing them out and engaging with them fully.,0.60,"

Composite score: 0.6

Reasoning: 

The participant's response is largely consistent with the hallmarks of humility. 

In terms of hallmark A, the participant demonstrates a calm and accepting self-concept by acknowledging their own mistake of not fully listening to the other person. They also do not seem to be overly distressed by the situation, but rather focused on finding a solution. 

In terms of hallmark B, the participant is able to perceive themselves and the other person clearly, without exaggerating information in either direction. They take responsibility for their mistake and express a desire to engage with the other person fully to solve the problem. 

In terms of hallmark C, the participant demonstrates openness to discovering new insights about themselves and the situation. They express a willingness to hear the other person out and engage with them fully, even if it may be personally embarrassing or unflattering. 

In terms of hallmark D, the participant shows a lack of self-focus by expressing a desire to solve the problem and engage with the other person fully. 

In terms of hallmark E, the participant does not explicitly express egalitarian beliefs, but their response does not contradict this hallmark either. 

Overall, the participant's response demonstrates a high degree of consistency with the hallmarks of humility, with only minor areas of inconsistency or lack of information. Therefore, the composite score is 0.6.",10667
94972,angry,"They are angry with me for being too picky and anal about meaningless things in my life. I struggle with obsessive-compulsive disorder and as a result I can't relax or even function when things are not exactly as my brain wants them to be. This applies primarily to my home life, where I insist that every single item is perfectly in its place and free of dust (among other habits). This is often frustrating for people I interact with because they feel like they're walking on eggshells when I'm constantly obsessing over things being perfect. I also sometimes lash out at people if they're not meeting my OCD expectations. I feel self-conscious about this and I understand why they'd be angry about it, but I also recognize that I can't help it and it's something that I'm working on but will take a lot of time.",0.40,"

Composite score: 0.4

Reasoning: 

The participant's response is moderately consistent with the hallmarks of humble people. 

In terms of hallmark A, the participant demonstrates some awareness of their weaknesses and deficiencies, but also acknowledges that these thoughts can cause distress. This suggests that they may not have a completely calm and accepting self-concept, but are at least somewhat aware of their limitations. 

In terms of hallmark B, the participant is able to perceive themselves clearly and accept responsibility for their mistakes. They acknowledge that their OCD habits can be frustrating for others and that they sometimes lash out at people. 

In terms of hallmark C, the participant demonstrates some openness to discovering new insights about themselves and the world. They recognize that their OCD habits are something they need to work on and that it will take time. However, they do not explicitly state that they are seeking the truth or willing to receive negative feedback. 

In terms of hallmark D, the participant does not explicitly demonstrate a lack of self-focus or an increased awareness of and appreciation for others. They acknowledge that their OCD habits can be frustrating for others, but do not express genuine happiness for other people's success. 

In terms of hallmark E, the participant does not explicitly demonstrate egalitarian beliefs. They do not mention seeing others as having the same intrinsic value and importance as themselves. 

Overall, the participant's response demonstrates some level of humility, but also some areas where they may not fully align with the hallmarks.",10235
53878,angry,"They are angry at me because I said something mean to them that I shouldn't have said. I called them something as a joke, but they got offended. I feel guilty about the situation and wish I could take back my words.",0.60,"

Composite score: 0.6

Reasoning: 

The participant's response is largely consistent with the hallmarks of a humble person. They take responsibility for their actions and acknowledge their mistake without becoming defensive or overly self-critical. This demonstrates a calm, accepting self-concept that is not hypersensitive to ego threats (A). The participant also shows an ability to perceive themselves and others clearly, accepting responsibility for their mistake and acknowledging the other person's perspective (B). They express guilt and a desire to make amends, demonstrating an openness to discovering new insights about themselves and the world (C). The participant's response also shows a lack of self-focus and an increased awareness of the other person's feelings (D). However, the response does not explicitly mention egalitarian beliefs (E), which is why the composite score is not higher. Overall, the participant's response is consistent with the hallmarks of a humble person.",7095
48958,angry,"If someone were angry with me, it could be related to an action that I did that was maybe thinking of just myself. Considering only myself would be harmful to others and may make them feel left out, sad, angry, confused, etc. I would feel very sad and guilty if someone were angry at me and would want to do whatever I could to fix it.",0.80,"

Composite score: 0.8

Reasoning: 

The participant's response is highly consistent with the hallmarks of humble people. They demonstrate a calm and accepting self-concept (A) by acknowledging that their actions may have been harmful to others and expressing a willingness to fix the situation. They also show clear perception of themselves and others (B) by recognizing that their actions may have caused negative emotions in others. The participant's response also demonstrates openness to discovering new insights (C) by acknowledging that their actions may have been self-centered and harmful to others. They express a desire to learn from the situation and make amends. The participant's response also shows a lack of self-focus and an increased awareness of others (D) by expressing concern for the feelings of others and a desire to fix the situation. Finally, the participant's response shows egalitarian beliefs (E) by recognizing the importance and value of others. Overall, the participant's response is highly consistent with the hallmarks of humble people.",11493
28512,angry,Someone is angry with me right now so I will just describe this situation. My best friend is angry with me for reaching out to her ex-boyfriend. I reached out to him because I was worried about her and knew that a lot of her sadness stemmed from him. I feel that it is a dumb reason to be angry with me because I had her best interests at heart and I came forward and told her instead of keeping it a secret.,0.60,"

Composite score: 0.6

Reasoning: 

The participant's response is largely consistent with the hallmarks of humility. They demonstrate a calm and accepting self-concept (A) by acknowledging their mistake and not becoming defensive. They also show an ability to perceive themselves and others clearly (B) by recognizing their friend's anger and the reason for it. The participant also demonstrates openness to discovering new insights (C) by reaching out to the ex-boyfriend to help their friend and being willing to discuss the situation with her. Additionally, the participant shows a lack of self-focus and an appreciation for others (D) by prioritizing their friend's well-being over their own discomfort in reaching out to the ex-boyfriend. Finally, the participant's response is consistent with the belief in egalitarianism (E) by valuing their friend's feelings and acknowledging her importance in their life. 

The only potential inconsistency with the hallmarks is that the participant does not explicitly acknowledge their weaknesses or deficiencies. However, this may not be relevant to the situation at hand and does not necessarily indicate a lack of humility overall. Therefore, the composite score is 0.6, indicating a strong consistency with the hallmarks of humility.",9547
56571,angry,"If someone were angry with me, it would probably be because I crossed a boundary with them, like if I said something about someone that I didn't realize was harmful to another person and they found out about it. I try really hard to prevent situations like this so it would make me very nervous. I would feel very guilty and upset, and if the situation were serious enough, I would probably feel scared about talking with that person again.",0.60,"

Composite score: 0.6

Reasoning: 

The participant's response is largely consistent with the hallmarks of humble people. They demonstrate self-awareness and a willingness to take responsibility for their actions (B), as well as an openness to learning and growing from negative feedback (C). They also express concern for others and a desire to avoid causing harm (D), and demonstrate an egalitarian belief system (E). 

The only area where the participant's response is somewhat inconsistent with the hallmarks is in their expression of nervousness and fear about talking with the person again. While it is understandable to feel nervous or anxious in such a situation, these emotions may indicate a degree of hypersensitivity to ego threats (A). However, this inconsistency is relatively minor and does not significantly detract from the overall consistency of the response with the hallmarks of humble people.",6945
55214,angry,"Ugh my boss is angry that I don't have research results or I am not completing tasks quick enough or well enough. My boss has been pretty disappointed with my research performance since I began this job, as I've never been able to get an experiment to reflect the expected results well. I'm really disappointed in myself for this too, especially since becoming lab manager and feeling like my research has taken a back seat to the needs of my co-workers and administrative work.",0.40,"

Composite score: 0.4

Reasoning: 

A. The participant's response is somewhat consistent with this hallmark. They acknowledge their weaknesses and deficiencies, but it does cause distress as they express disappointment in themselves. (+0.3)

B. The participant's response is somewhat consistent with this hallmark. They acknowledge their shortcomings and take responsibility for their mistakes. However, they do not mention their strengths. (+0.2)

C. The participant's response is somewhat consistent with this hallmark. They express a willingness to learn and improve, but they do not mention seeking the truth or being open to discovering new insights. (+0.2)

D. The participant's response is somewhat inconsistent with this hallmark. They express disappointment in themselves and do not mention being happy for others' success. (-0.2)

E. The participant's response is somewhat consistent with this hallmark. They acknowledge their boss's intrinsic value and importance. However, they do not mention seeing others as having the same intrinsic value and importance as themselves. (+0.1)

Overall, the participant's response is somewhat consistent with the hallmarks of humble people, but there is room for improvement in some areas.",9158
24883,angry,"I guess my responses to this would differ based on if this is a strong tie or a weak tie. If its a weak tie I'd feel bad, but I probably wouldn't notice they're angry at me unless they say it. Strong ties are easier to notice; my mom is constantly angry at me if I don't act in an 'appropriate' way or say things which are not conductive to acting in an appropriate way. Usually I feel annoyed because when I say things in private, its not because I mean to act on them, I just want an outlet for irritation. In short, unless someone tells me they're angry, I won't know why they're angry, and will probably feel a bit awkward but not care too much unless I'm really in the wrong.",-0.50,"

Composite score: -0.5

Reasoning: 

The participant's response shows some inconsistency with the hallmarks of humility. 

Regarding Hallmark A, the participant does not seem to display a calm and accepting self-concept. They mention feeling bad and awkward if someone is angry with them, which suggests some level of ego sensitivity. 

Regarding Hallmark B, the participant does acknowledge the possibility of their own mistakes, but they also mention wanting an outlet for irritation, which could be seen as a form of self-enhancement. 

Regarding Hallmark C, the participant does not mention being open to discovering new insights or receiving negative feedback. 

Regarding Hallmark D, the participant does not show a lack of self-focus, as they mention feeling annoyed when their mother is constantly angry at them. 

Regarding Hallmark E, the participant does not mention egalitarian beliefs. 

Overall, the participant's response shows some awareness of their own limitations, but also some ego sensitivity and self-focus, which are not consistent with the hallmarks of humility.",7642
64326,angry,Someone would be angry with me for going out of my way to do something. People who are close to me always warn me of this. It makes me re-assess my thinking but ultimately proceeding with more caution in the future. I would continue to do the same actions but with heightened awareness.,0.60,"

Composite score: 0.6

Reasoning:

The participant's response is largely consistent with the hallmarks of humility. The participant demonstrates a calm and accepting self-concept (A) by re-assessing their thinking and proceeding with caution in the future. They also show an ability to perceive themselves clearly and accept responsibility for their actions (B) by continuing to do the same actions but with heightened awareness. The participant's openness to discovering new insights about themselves and the world (C) is demonstrated by their willingness to re-assess their thinking and proceed with caution in the future. The participant's lack of self-focus and increased awareness and appreciation for others (D) is implied by their willingness to take into account the concerns of people who are close to them. Finally, the participant's response is consistent with the egalitarian beliefs (E) of humility by not placing themselves above others and being willing to consider the perspectives of others. Overall, the participant's response is largely consistent with the hallmarks of humility, resulting in a composite score of 0.6.",8231
28441,angry,"If someone was angry at me, I feel like it would be because I didn't word something right way. I also think I might've upset their feelings by being passive aggressive or something of the sorts because sometimes I don't realize that I am being that. I don't think it would have been something I did but rather something I said because I can be emotional when talking sometimes and maybe say something I don't mean. If someone is angry with me, then I would hate being in that situation and feel angry with myself as well.",0.60,"

Composite score: 0.6

Reasoning: 

The participant's response is largely consistent with the hallmarks of humility. They demonstrate self-awareness by acknowledging that they may have upset someone unintentionally and that they can be emotional when speaking. They also express a willingness to take responsibility for their actions and consider how they may have contributed to the situation. Additionally, the participant expresses discomfort with the idea of someone being angry with them, which suggests a lack of self-focus and an awareness of others' feelings. However, the response does not explicitly address the hallmarks of remaining open to discovering new insights or having egalitarian beliefs, which is why the score is not higher.",5328
97263,angry,"They are angry at me because of something I said to offend them. A remark I made was taken personally and that led them to be angry with me. This makes me feel incredibly guilty because I did not intentionally say something to hurt their feelings, oftentimes it has nothing to do with them. Until, they mention their feelings being hurt I have no idea that they took it personally.",0.60,"

Composite score: 0.6

Reasoning: 

The participant's response is largely consistent with the hallmarks of humble people. The participant demonstrates a calm and accepting self-concept (A) by acknowledging their mistake and feeling guilty about it. They also show a clear perception of themselves and their actions (B) by recognizing that their remark was taken personally and led to the other person's anger. The participant's willingness to acknowledge their mistake and take responsibility for it demonstrates openness to discovering new insights about themselves and the world (C). The participant's response also shows a lack of self-focus and an increased awareness of others (D) by expressing concern for the other person's feelings and acknowledging that they did not intend to hurt them. Finally, the participant's response is consistent with the humble belief of egalitarianism (E) by recognizing that their actions may have unintentionally hurt someone else and that they are not inherently more important than others. Overall, the participant's response demonstrates a high degree of consistency with the hallmarks of humble people.",7641
20932,angry,They are angry with me because I messed up and didn't consider all the factors in a particular situation. I was caught up in my plans in the moment and didn't think of what they're really going through. I feel really bad and can't believe that I didn't react in a more empathetic manner because this feels unlike me,0.80,"

Composite score: 0.8

Reasoning: The participant's response is highly consistent with the hallmarks of humility. They acknowledge their mistake and take responsibility for it, showing a clear awareness of their weaknesses and deficiencies (A). They also demonstrate the ability to perceive themselves and others clearly, without exaggerating information in either a self-enhancing or self-debasing direction (B). The participant remains open to discovering new insights about themselves and the world, as evidenced by their willingness to consider the other person's perspective and their own lack of empathy (C). They show a lack of self-focus and an increased awareness of and appreciation for others, as they express feeling bad and genuinely wanting to make amends (D). Finally, the participant's response reflects egalitarian beliefs, as they acknowledge the other person's experience as equally important to their own (E). Overall, the participant's response is highly consistent with the hallmarks of humility, earning a composite score of 0.8.",7561
26204,angry,"Someone is angry at me either because I either showed up late, forgot to do something, or neglected to do something. They are angry because they think that I am disrespecting them and do not value their time. I feel upset at myself for messing up, and probably a little angry at them too because I want to deflect some of the negative emotions I am feeling about myself onto them. However, I probably realize that this anger towards them is irrational and try not to act on it.",0.60,"

Composite score: 0.6

Reasoning: 

The participant's response is largely consistent with the hallmarks of humble people. 

In terms of hallmark A, the participant acknowledges their mistake and expresses some distress about it, but does not appear to be overly sensitive to ego threats. 

In terms of hallmark B, the participant considers both their strengths and weaknesses and accepts responsibility for their mistakes. 

In terms of hallmark C, the participant expresses a willingness to learn from the situation and receive negative feedback. 

In terms of hallmark D, the participant does not appear to be overly focused on themselves and expresses a desire to avoid acting on irrational anger towards the other person. 

In terms of hallmark E, the participant does not explicitly express egalitarian beliefs, but their response does not contradict this hallmark either. 

Overall, the participant's response demonstrates a good level of humility, although there is some room for improvement in terms of expressing more explicitly egalitarian beliefs.",8023
