pid,essay_type,essay,score,comments,millis
48025,angry,"I'm not sure why they are angry with me, as I am usually too shy to ask why, although it is probably because I didn't go along with the plan or do what they thought I would do. I feel very anxious about approaching and dealing with the situation, although I do have a lot of other feelings about things. I feel angry as well, and probably upset that someone is angry with me.They probably became angry with me because I get very emotional when dealing with certain situations, which usually escalates certain situations very quickly.",0.20,"

Composite score: 0.2

Reasoning: 

The participant's response is somewhat consistent with the hallmarks of humble people. They acknowledge the possibility that they did something to make the other person angry, and they express anxiety about dealing with the situation. This suggests that they have a calm, accepting self-concept that is not hypersensitive to ego threats (hallmark A). Additionally, they mention that they get emotional in certain situations, which could be seen as an acknowledgment of a weakness or deficiency (hallmark B). 

However, the participant's response is not entirely consistent with the hallmarks. They do not mention anything about perceiving themselves or others clearly (hallmark B), remaining open to discovering new insights (hallmark C), or having an increased awareness of and appreciation for others (hallmark D). They also do not express any egalitarian beliefs (hallmark E). 

Overall, the participant's response shows some signs of humility, but there is room for improvement in terms of fully embodying the hallmarks of humble people.",7122
41639,angry,"The first thing that came to my mind is that someone in my family is angry with me for disagreeing with them about politics or religion. We often have very heated discussions that lead to both sides getting upset. I'm sad that these discussions so often go this way. I wish it would be possible to discuss these things without them getting angry, or to avoid the subjects altogether.",0.60,"

Composite score: 0.6

Reasoning: The participant's response is largely consistent with the hallmarks of humble people. The participant demonstrates a calm and accepting self-concept (A) by acknowledging that they may have disagreements with their family members about politics or religion, but they do not seem to be overly distressed by this. The participant also demonstrates self-awareness and responsibility (B) by recognizing that these discussions often lead to both sides getting upset and expressing a desire to avoid these subjects altogether. The participant also shows openness to discovering new insights (C) by expressing a wish for these discussions to be less heated. The participant's response does not explicitly address the lack of self-focus and increased awareness of others (D) or egalitarian beliefs (E), but these hallmarks are not directly relevant to the writing prompt. Overall, the participant's response is consistent with the hallmarks of humble people, but there is room for improvement in terms of demonstrating a greater awareness and appreciation of others.",7857
98971,angry,"There's a few different examples of could think of, but the first one to come to mind is from an argument with my dad. I'm normally very respectful to my parents, but I came out (as transgender) almost 7 months prior to this event occurring, and he's completely ignored that and only avoids misgendering me when my other parent is around. My family visited for Easter (I am writing this 3 days later), and I finally snapped and started yelling at my dad, for several reasons. He's non-confrontational, so I can tell he just zoned out and didn't listen, but that would be a reason for him to be mad at me. I feel sad about this, and also somewhat angry, but it's something that I've known was coming, so it doesn't surprise me at all.",0.60,"

Composite score: 0.6

Reasoning:
The participant's response is largely consistent with the hallmarks of humility. They demonstrate self-awareness and acceptance of their identity as a transgender person, which is consistent with hallmark A. They also take responsibility for their actions and acknowledge their father's potential reasons for being angry, which is consistent with hallmark B. The participant also demonstrates openness to growth and learning, as they express sadness and anger but also acknowledge that this was an expected outcome, which is consistent with hallmark C. The participant's response also shows a lack of self-focus and an appreciation for others, as they express concern for their father's feelings and acknowledge his non-confrontational nature, which is consistent with hallmark D. Finally, the participant's response suggests that they hold egalitarian beliefs, as they express a desire for their father to acknowledge their identity and treat them with respect, which is consistent with hallmark E. Overall, the participant's response is largely consistent with the hallmarks of humility, with some minor inconsistencies.",8054
13442,angry,"People are usually angry with me because I am not the best at communicating my thoughts. Many times I have had an Idea and forgot to share it with my siblings and they get mad at me for not letting them know what plans are. I also do not talk about my feelings, so if someone close says something that upsets me I usually just keep it inside until I get over it or they notice something is wrong.",0.60,"Composite score: 0.6

Reasoning: The participant's response is largely consistent with the hallmarks of humble people. The participant acknowledges their weakness in communication and takes responsibility for their role in situations where others may become angry with them. Additionally, the participant recognizes their tendency to keep their feelings to themselves, which demonstrates a willingness to be open to discovering new insights about themselves and the world. However, the response does not address the hallmarks of having egalitarian beliefs or a lack of self-focus. Therefore, the participant's response is not completely consistent with the hallmarks, but still shows a strong degree of humility.",5132
37652,angry,"Someone is likely angry with me because I can be very stubborn and don't enjoy changing plans. Sometimes that can be frustrating for other people because it may seem that I am completely unaccommodating and selfish, but it really stems from the fact that I get anxiety when there is a change of plans and I am trying to work on not stressing out so much about it, but something like that takes time.",0.80,"

Composite score: 0.8

Reasoning: 

The participant's response is highly consistent with the hallmarks of humility. 

In terms of hallmark A, the participant demonstrates a calm and accepting self-concept by acknowledging their own weaknesses and deficiencies without excessive distress. They also show a willingness to work on their anxiety, indicating that they are not hypersensitive to ego threats.

In terms of hallmark B, the participant demonstrates clear self-perception and a balanced view of their strengths and weaknesses. They take responsibility for their stubbornness and acknowledge that it can be frustrating for others.

In terms of hallmark C, the participant shows openness to discovering new insights about themselves and the world. They are working on changing their behavior and are willing to admit that it takes time.

In terms of hallmark D, the participant shows a lack of self-focus and an appreciation for others. They acknowledge that their behavior can be frustrating for others and are working on changing it.

In terms of hallmark E, the participant demonstrates egalitarian beliefs by acknowledging that their behavior can be frustrating for others and that they need to work on changing it. 

Overall, the participant's response is highly consistent with the hallmarks of humility, indicating a high level of humility.",9460
35626,angry,My parents or my boss being angry with me is the first thing i could think of. Parents would be angry because i am mot responsible enough. My boss being angry because i didn't perform well in an assessment. I would feel a lot of guilt and shame for letting them down.,0.60,"

Composite score: 0.6

Reasoning: 

The participant's response is largely consistent with the hallmarks of humble people. The participant demonstrates self-awareness by acknowledging their own shortcomings and accepting responsibility for their mistakes. This is consistent with hallmark B. Additionally, the participant expresses feelings of guilt and shame for letting down their parents and boss, which suggests that they have a calm and accepting self-concept that is not hypersensitive to ego threats (hallmark A). The participant also demonstrates an openness to discovering new insights about themselves and the world by considering why their parents and boss might be angry with them (hallmark C). However, the response does not provide evidence for hallmark D or E. Overall, the response is largely consistent with the hallmarks of humble people, resulting in a composite score of 0.6.",6246
37021,angry,"They are angry at me because I did something that does not align with the person's expectations. I feel regret because even though I knew they would be mad if I did not meet there expectations/standards, I continued to do it my way. However, I also feel helpless because if I did meet their expectations/standards, they would still be angry and think that I did not do enough.",0.60,"

Composite score: 0.6

Reasoning: 

The participant's response is largely consistent with the hallmarks of humility. They demonstrate self-awareness by acknowledging that they did something that did not align with the other person's expectations and that they knew it would make the other person angry. They also show openness to discovering new insights by recognizing that even if they had met the other person's expectations, the other person may still have been angry. 

However, there are some aspects of the response that are not entirely consistent with the hallmarks. For example, the participant expresses regret and helplessness, which may suggest some level of ego threat or self-focus. Additionally, the participant does not explicitly mention accepting responsibility for their mistake or showing appreciation for the other person's perspective. 

Overall, the response demonstrates a good degree of humility, but there is room for improvement in terms of taking responsibility and showing appreciation for others.",7016
73475,angry,"If someone were to be angry with me, it is probably because I can come off cold or uncaring sometimes. I know this because this actually happened to me before. I am a pretty reserved person and sometimes I want to be left alone or have time for myself. I feel sad about it because I care about my friends and family a lot and for someone to believe I don't care for their wellbeing makes me sad, but I also think they need to understand boundaries and that some people just operate differently.",0.80,"

Composite score: 0.8

Reasoning: 

The participant's response is highly consistent with the hallmarks of humility. 

A. The participant demonstrates a calm and accepting self-concept by acknowledging their weaknesses and deficiencies without excessive distress. They recognize that they can come off as cold or uncaring, which could lead someone to be angry with them. 

B. The participant perceives themselves and others clearly without exaggerating information in either a self-enhancing or self-debasing direction. They acknowledge that they are a reserved person who needs time alone, but they also care about their friends and family. They accept responsibility for their behavior and suggest that the other person needs to understand boundaries. 

C. The participant remains open to discovering new insights about themselves and the world. They are teachable and seek the truth, even when it may be personally embarrassing or unflattering. They recognize that they can come off as cold or uncaring and are willing to learn from this experience. 

D. The participant shows a lack of self-focus and an increased awareness of and appreciation for others. They recognize that their behavior may have caused someone to be angry with them and suggest that the other person needs to understand boundaries. They also express sadness about the situation, indicating that they care about the other person's feelings. 

E. The participant has egalitarian beliefs. They see others as having the same intrinsic value and importance as themselves. They suggest that the other person needs to understand boundaries and that some people just operate differently, indicating that they respect individual differences. 

Overall, the participant's response demonstrates a high degree of humility, as they exhibit all of the hallmarks described. The only potential inconsistency is that they express sadness about the situation, which could be interpreted as a form of self-focus. However, this is a minor point and does not significantly detract from the overall consistency with the hallmarks.",14212
82730,angry,Maybe my roommate is mad at me for hanging out for other people and not with her. She can sometimes get jealous if i do not spend more time with her and can then project that onto me and make me feel bad about going out and being busy with other people. It makes me feel frustrated that she would be upset about that because no one is entitled to someone's time especially if the friendship is not what it used to be.,0.60,"

Composite score: 0.6

Reasoning: 

The participant's response is largely consistent with the hallmarks of humble people. 

In terms of hallmark A, the participant demonstrates a calm and accepting self-concept by acknowledging their roommate's potential jealousy without becoming overly defensive or distressed. 

In terms of hallmark B, the participant demonstrates clear perception of themselves and their roommate, acknowledging both their own social activities and their roommate's potential feelings of neglect. They also accept responsibility for their actions by stating that no one is entitled to someone's time. 

In terms of hallmark C, the participant demonstrates openness to discovering new insights by considering their roommate's perspective and potential reasons for being angry. 

In terms of hallmark D, the participant demonstrates a lack of self-focus by not prioritizing their own social activities over their roommate's feelings. 

In terms of hallmark E, the participant does not explicitly mention egalitarian beliefs, but their statement that no one is entitled to someone's time suggests a belief in equal treatment and respect for others. 

Overall, the participant's response is consistent with the hallmarks of humble people, although there is some room for improvement in terms of explicitly expressing egalitarian beliefs.",10333
75941,angry,They are angry with me on my coldness and not responding to their texts. I would feel bad but at the same time i would want to explain to them why i act certain way.,0.60,"

Composite score: 0.6

Reasoning: 

The participant's response is largely consistent with the hallmarks of humility. They acknowledge their own behavior (coldness and not responding to texts) as the reason for the other person's anger, which demonstrates self-awareness and acceptance of responsibility. Additionally, the participant expresses a desire to explain their behavior, indicating a willingness to communicate and potentially resolve the situation. However, the response does not address all of the hallmarks equally. For example, there is no indication of the participant's beliefs about the intrinsic value of others (hallmark E), and the response does not explicitly mention a lack of self-focus (hallmark D). Nonetheless, the overall tone of the response suggests a humble and reflective mindset, which is consistent with the hallmarks.",7520
98142,angry,They might be angry with me because I am late. I tend to be running behind even though I don't want to be. I feel anxious about the situation because I didn't want to be late and it has now inconvenienced someone else.,0.60,"

Composite score: 0.6

Reasoning: 

The participant's response is largely consistent with the hallmarks of humble people. The participant acknowledges their weakness of being consistently late and accepts responsibility for inconveniencing someone else. This demonstrates a calm and accepting self-concept (A) and the ability to perceive oneself clearly without exaggeration (B). The participant also expresses anxiety about the situation, which suggests that they are open to discovering new insights about themselves and the world (C). Additionally, the participant's concern for inconveniencing someone else demonstrates a lack of self-focus and an increased awareness of others (D). However, the response does not explicitly mention egalitarian beliefs (E), which is why the composite score is not higher. Overall, the participant's response is consistent with the hallmarks of humble people.",5779
56300,angry,If someone is angry with me it is likely that they wanted me to do something that i did not want to do. I then preceded to have a bad attitude about it to them. I do not mind telling people what i think. I would not feel bad about making someone mad if i feel that I am right.,-0.60,"

Composite score: -0.6

Reasoning: 

The participant's response is somewhat inconsistent with the hallmarks of humility. While the participant acknowledges that someone may be angry with them, they do not seem to show much concern for the other person's feelings or perspective. The participant's statement that they ""do not mind telling people what [they] think"" suggests a lack of openness to others' viewpoints and a potential lack of empathy. Additionally, the participant's statement that they ""would not feel bad about making someone mad if [they] feel that [they are] right"" suggests a potential lack of willingness to consider their own mistakes or shortcomings. However, the participant does acknowledge that they may have had a bad attitude, which could suggest some level of self-awareness. Overall, the response is not completely inconsistent with the hallmarks of humility, but it does not demonstrate a strong adherence to them either.",7073
53830,angry,they're mad bc i disappointed them with how quiet i was when they wanted me to make a good happy talkative impression on their friends and family. they got angry bc i wasn't talkative and didn't contribute lots to the conversation. i am upset and disappointed in myself that they aren't being mindful that some people just don't talk as much and also that i wish i was just more talkative,0.20,"

Composite score: 0.2

Reasoning: 

The participant's response is somewhat consistent with the hallmarks of humble people. They demonstrate some self-awareness by acknowledging their quietness and lack of contribution to the conversation. They also express disappointment in themselves, which suggests they are open to discovering new insights about themselves and the world. However, the participant also expresses a desire to be more talkative, which may indicate a self-enhancing direction. Additionally, the participant seems to be somewhat focused on their own feelings and disappointment, rather than showing an increased awareness and appreciation for others. Overall, the response demonstrates some humility but also some room for improvement in terms of the hallmarks.",5470
41944,angry,"The reason why the person is angry with me is probably because I did something wrong or said something that hurt them. It most likely is me saying something really mean. If I'm currently at the moment of it, I'll probably be mad at them too and wouldn't even think that it is my fault. However, after the situation ends, and I have cooled down, I would feel bad and try to apologize for what I have done wrong.",0.80,"

Composite score: 0.8

Reasoning: 

The participant's response is highly consistent with the hallmarks of humility. 

In terms of hallmark A, the participant acknowledges the possibility of having done something wrong or hurtful, but does not seem to be overly distressed by this possibility. This suggests a calm and accepting self-concept that is not hypersensitive to ego threats. 

In terms of hallmark B, the participant is able to perceive themselves and others clearly, without exaggerating information in either a self-enhancing or self-debasing direction. They acknowledge the possibility of having said something mean and take responsibility for their actions. 

In terms of hallmark C, the participant remains open to discovering new insights about themselves and the world. They acknowledge the possibility of having done something wrong and are willing to apologize and make amends. 

In terms of hallmark D, the participant shows a lack of self-focus and an increased awareness of and appreciation for others. They acknowledge the possibility of having hurt someone else and are willing to take responsibility for their actions. 

In terms of hallmark E, the participant demonstrates egalitarian beliefs by acknowledging the intrinsic value and importance of others. 

Overall, the participant's response is highly consistent with the hallmarks of humility, suggesting a humble and self-aware individual.",7552
59118,angry,"I definitely just ghosted this guy and don't feel bad about it. He just approached me in public and is causing a scene that is unwarranted, in my opinion. Honestly, I don't think anyone has the right to approach someone like this in public. Handling things quietly is the correct way to go about this.",-0.60,"

Composite score: -0.6

Reasoning: 

The participant's response is somewhat inconsistent with the hallmarks of humble people. 

In terms of A, the participant does not seem to have a calm, accepting self-concept as they do not feel bad about ghosting someone and do not seem to be aware of any potential weaknesses or deficiencies in their behavior. 

In terms of B, the participant does not seem to be perceiving themselves or the situation clearly, as they believe the other person's anger is unwarranted and that handling things quietly is the correct way to go about it. 

In terms of C, the participant does not seem open to discovering new insights about themselves or the situation, as they do not seem to be reflecting on their own behavior or considering the other person's perspective. 

In terms of D, the participant does not seem to be showing a lack of self-focus or an increased awareness of others, as they are solely focused on their own opinion and do not seem to be considering how the other person might be feeling. 

In terms of E, the participant does not seem to have egalitarian beliefs, as they believe that no one has the right to approach someone in public and seem to be dismissing the other person's feelings. 

Overall, while the participant's response does not completely contradict the hallmarks of humble people, it is not consistent with them either.",10520
87933,angry,They are angry with me because I have done something wrong. They are angry because I didn't follow the instructions they provided. I feel stressed and want to find a way out and want to find a solution to solve the problem so they are not angry with me anymore.,0.60,"

Composite score: 0.6

Reasoning: 

The participant's response is largely consistent with the hallmarks of humility. They acknowledge that they have done something wrong and take responsibility for not following instructions. This suggests that they have a clear perception of themselves and are willing to accept responsibility for their mistakes (hallmark B). Additionally, the participant expresses a desire to find a solution to the problem and make things right, rather than becoming defensive or blaming others. This suggests that they are open to discovering new insights and are willing to receive negative feedback (hallmark C). However, the participant's statement that they feel stressed and want to find a way out suggests that they may be somewhat self-focused and not fully appreciative of others (hallmark D). Overall, the response is largely consistent with the hallmarks of humility, but there is some room for improvement in terms of self-focus and appreciation for others.",6340
