pid,essay_type,essay,score,comments,millis
89662,angry,"I would imagine that this person is angry with me because of a miscommunication or something that I had said out of frustration or anger during a conversation. I would feel devastated and would be planning an apology (if the mistake was completely mine) or a time to clarify any miscommunications. I do not like it when people are mad at me, and I often try to resolve any issues as soon as possible. I am good at confronting problems and discussing with others/ having conversations about relationships.",0.80,"

Composite score: 0.8

Reasoning:

The participant's response is highly consistent with the hallmarks of humility. 

In terms of hallmark A, the participant demonstrates a calm and accepting self-concept by acknowledging the possibility of a miscommunication or saying something out of frustration or anger. However, this does not cause excessive distress, as the participant is focused on resolving the issue.

In terms of hallmark B, the participant demonstrates clear perception of themselves and the situation by acknowledging the possibility of their own mistake and taking responsibility for it. 

In terms of hallmark C, the participant demonstrates openness to discovering new insights by being willing to clarify any miscommunications and having conversations about relationships. 

In terms of hallmark D, the participant demonstrates a lack of self-focus and an appreciation for others by being focused on resolving the issue and not wanting others to be mad at them. 

In terms of hallmark E, the participant demonstrates egalitarian beliefs by valuing the relationship with the other person and wanting to resolve any issues. 

Overall, the participant's response is highly consistent with the hallmarks of humility, resulting in a composite score of 0.8.",8619
65329,angry,"They are angry with me because I hurt their feelings. I hurt their feelings by not being empathetic and compassionate enough to them when they were talking about an issue I saw as solvable. I think they are right to be upset with me, but wrong not to see it from my point of view. I am offering them a genuine solution to the issue they are having.",0.60,"

Composite score: 0.6

Reasoning:

The participant's response is largely consistent with the hallmarks of humility. They acknowledge their mistake and take responsibility for it, showing a clear awareness of their own weaknesses and deficiencies (A, B). They also express openness to learning and growing from the situation, even if it may be personally embarrassing or unflattering (C). Additionally, the participant's focus is on finding a solution to the issue rather than defending their own ego, demonstrating a lack of self-focus and an increased awareness of and appreciation for others (D). However, the participant's statement that the other person is ""wrong not to see it from my point of view"" suggests a slight lack of egalitarian beliefs (E), which slightly detracts from the overall consistency with the hallmarks of humility.",4806
82023,angry,They are angry because I told them how they hurt me. I keep telling them not to do such things that make me upset but they keep doing it. The fact that I have to repeat expressing how much they hurt me makes them angry with me. I feel like it was totally my fault and I should have sucked it up and never should have expressed how hurt I was.,0.20,"

Composite score: 0.2

Reasoning: 

The participant's response is somewhat consistent with the hallmarks of humility. The participant acknowledges their own weaknesses and expresses a desire to avoid conflict. However, the participant also seems to blame themselves excessively and take on all the responsibility for the situation. This may indicate a lack of self-compassion and an overly self-critical attitude, which are not consistent with the hallmarks of humility. Additionally, the participant does not demonstrate an awareness of the other person's perspective or an appreciation for their intrinsic value, which are also hallmarks of humility. Overall, the response is somewhat consistent with the hallmarks of humility, but there are also some inconsistencies.",4535
24208,angry,"They're angry with me partially because they've been through a lot and a lot of people hurting them, and also probably just to control me, to make me feel guilty. I think what led to this is me being late somewhere, or changing my plans I had with them over something important. It might've been my family that impacted it. I feel like the victim, I feel unjustly insulted but I also feel a bit guilty wondering what I can do to make them calm down.",0.20,"

Composite score: 0.2

Reasoning: 

A. The participant acknowledges that they may have made a mistake that led to the other person's anger, but they do not seem to be excessively distressed by this realization. (+0.2)

B. The participant acknowledges that they may have made a mistake, but they do not seem to be exaggerating or minimizing their role in the situation. (+0.2)

C. The participant does not explicitly mention a willingness to learn from the situation or receive negative feedback, but they do express a desire to make the other person calm down. (0)

D. The participant's response is somewhat self-focused, as they describe feeling like a victim and wondering what they can do to make the other person calm down. (-0.2)

E. The participant does not explicitly mention egalitarian beliefs. (0)

Overall, the participant's response is somewhat consistent with the hallmarks of humility, but there are also some elements that are inconsistent. The participant acknowledges their potential role in the situation and expresses a desire to make things right, but they also seem somewhat focused on their own feelings and concerns.",8085
90614,angry,"In my imagination, they might be angry because I messed up some important tasks. I may have forgotten to do what I should do, which negatively influenced the whole group and forced others to work hard to make up for my mistakes. I would feel extremely ashamed of bringing huge trouble to my group and feel like a trouble myself.",0.60,"

Composite score: 0.6

Reasoning: 

The participant's response is largely consistent with the hallmarks of humility. They acknowledge their mistakes and take responsibility for their actions, which is consistent with hallmark B. They also express feelings of shame and remorse, but without excessive distress, which is consistent with hallmark A. The participant's willingness to imagine themselves in a negative light and consider how their actions affect others is consistent with hallmark C. The participant's use of the word ""trouble"" to describe themselves suggests a lack of self-focus, which is consistent with hallmark D. However, the participant's response does not explicitly mention egalitarian beliefs, which is why the composite score is not higher. Overall, the participant's response demonstrates a good degree of humility.",4853
50050,angry,"They are angry with me because I fail to achieve their expectations or crossed some barriers in human interactions that I was mostly oblivious of. Depending on the person and situations, I will feel terrible about letting others down and angry at myself, or just completely ignore it and goes on to deal with my own matters. Selective ignorance is one thing I learned to do when I want to be more effective in completing some projects.",0.60,"

Composite score: 0.6

Reasoning:

The participant's response is largely consistent with the hallmarks of humility. The participant acknowledges that they may have failed to meet someone's expectations or crossed some social barriers, indicating a willingness to accept responsibility for their actions (B). They also express feeling terrible about letting others down, which suggests a lack of self-focus and an appreciation for others (D). Additionally, the participant mentions selective ignorance as a strategy for being more effective, which could be interpreted as a willingness to learn and grow (C). However, the participant also mentions ignoring the situation entirely, which could be seen as inconsistent with the hallmarks of humility (A). Overall, the response demonstrates a good degree of humility, but with some room for improvement in terms of accepting negative feedback and not ignoring uncomfortable situations.",4826
45583,angry,"I am imagining that my brother is angry at me. He is most likely angry because I did not watch him play his video games. He would be frustrated that I am not as interested in what he finds engaging. I would be annoyed because I do not care about video games and would rather spend time doing something else with him. I would also feel guilty that I did not want to watch his games, since I know that they are important to him.",0.60,"

Composite score: 0.6

Reasoning: 

A. The participant's response is consistent with this hallmark as they do not seem to be overly distressed by the fact that their brother is angry with them. They acknowledge their brother's frustration and their own annoyance, but do not seem to be excessively upset by the situation.

B. The participant's response is consistent with this hallmark as they consider both their own perspective and their brother's perspective. They acknowledge that their brother is angry because they did not watch him play video games, and they also acknowledge that they would rather spend time doing something else with him. They take responsibility for their own actions and preferences.

C. The participant's response is somewhat consistent with this hallmark. While they do not explicitly state that they are open to discovering new insights about themselves or the world, they do acknowledge that they feel guilty for not wanting to watch their brother's video games. This suggests that they may be open to considering their own preferences and biases.

D. The participant's response is somewhat consistent with this hallmark. While they do not explicitly state that they are happy when other people excel, they do acknowledge their brother's interest in video games and seem to understand that it is important to him.

E. The participant's response is somewhat consistent with this hallmark. While they do not explicitly state that they believe in egalitarianism, they do acknowledge their brother's interests and seem to understand that they are important to him. This suggests that they may be open to considering the value and importance of others' perspectives.

Overall, the participant's response is largely consistent with the hallmarks of humility. They consider both their own perspective and their brother's perspective, take responsibility for their own actions and preferences, and seem to be open to considering new insights and the value of others' perspectives. However, there is some room for improvement in terms of explicitly acknowledging the importance of others and being open to negative feedback.",12092
89912,angry,"If someone is angry with me forreal, it's probably because I said something mean. Not necessarily because I planned to do so, or am someone with malice at heart, but because I am loose with my words or thoughts sometimes. If I genuinely make someone angry, I typically feel really bad because often I didn't intend to do that.",0.80,"

Composite score: 0.8

Reasoning: 

The participant's response is highly consistent with the hallmarks of humility. 

In terms of hallmark A, the participant acknowledges that they can be loose with their words or thoughts, indicating an awareness of their weaknesses and deficiencies. However, this does not cause excessive distress, as they state that they typically feel really bad when they genuinely make someone angry. 

In terms of hallmark B, the participant perceives themselves and others clearly, without exaggerating information in either a self-enhancing or self-debasing direction. They accept responsibility for their mistakes, indicating an ability to consider both their strengths and weaknesses. 

In terms of hallmark C, the participant remains open to discovering new insights about themselves and the world. They are teachable and seek the truth, even when it may be personally embarrassing or unflattering. 

In terms of hallmark D, the participant shows a lack of self-focus and an increased awareness of and appreciation for others. They acknowledge that they may have said something mean, indicating a lack of need to bolster their own ego. 

In terms of hallmark E, the participant does not explicitly mention egalitarian beliefs, but their response does not contradict this hallmark either. 

Overall, the participant's response demonstrates a high degree of humility, as evidenced by their ability to acknowledge their weaknesses, accept responsibility for their mistakes, remain open to learning, and show a lack of self-focus.",9781
85445,angry,"There can be many reasons they are angry with me. It could be that I disappointed, hurt, betrayed, or lied to the person. Or it could also be that our ideas conflict with each other, so we cannot reach consensus. It could also be that the person is having a bad day and he/she is throwing a tantrum to me. No matter what the reason is, I would feel very upset and I would be filled with negative emotions all over my body.",0.60,"

Composite score: 0.6

Reasoning: 

The participant's response is largely consistent with the hallmarks of humility. They demonstrate a calm and accepting self-concept by acknowledging that there could be many reasons why someone might be angry with them, and they do not seem to be hypersensitive to ego threats. They also show an ability to perceive themselves and others clearly, without exaggerating information in either a self-enhancing or self-debasing direction. They consider both their strengths and weaknesses and accept responsibility for their mistakes. Additionally, the participant remains open to discovering new insights about themselves and the world, as evidenced by their consideration of different reasons why someone might be angry with them. 

However, the participant's response does not fully align with the hallmarks of humility. They do not explicitly mention being teachable or seeking the truth, even when it may be personally embarrassing or unflattering. Additionally, while the participant acknowledges feeling upset in the situation, they do not demonstrate a lack of self-focus or an increased awareness of and appreciation for others. Overall, the response is largely consistent with the hallmarks of humility, but there is room for improvement in certain areas.",8002
87242,angry,"I'd imagine I did something that they didn't expect or want. My feeling about the situation would depend on how I approached it or acted. If I did what I intended I would feel comfortable with my actions knowing that I made a conscious decision and did what I believed I should even if it didn't line up with what they wanted. If it was an unintended action or had consequences I didn't expect, I would definitely feel a level of shame and try to apologize or make it up to them in some way.",0.60,"

Composite score: 0.6

Reasoning: 

The participant's response is largely consistent with the hallmarks of humble people. They demonstrate a calm and accepting self-concept (A) by stating that their feelings about the situation would depend on their own actions and intentions, rather than being overly concerned with the other person's anger. They also show an ability to perceive themselves and others clearly (B) by acknowledging that their actions may not have lined up with what the other person wanted, and that they would feel shame if they had unintended consequences. The participant also demonstrates openness to discovering new insights (C) by stating that they would try to apologize or make it up to the other person if they had unintended consequences. They also show a lack of self-focus and an appreciation for others (D) by stating that they would be comfortable with their actions if they did what they intended, but would feel shame and try to make it up to the other person if they had unintended consequences. Finally, the participant's response is consistent with egalitarian beliefs (E) by not placing themselves above the other person and acknowledging that they may have done something that the other person did not want or expect. Overall, the participant's response demonstrates a good level of humility.",8762
76170,angry,"If someone is angry at me, I would try to figure out the reason for this. Most of the time, the anger they feel can be misjudged, in a sense that they are disappointed or hurt. This is why I would try to find the reason, to figure out the source. Usually, when someone is angry at me, it is because of something I did that made them upset. I would try to ask them why this made them feel upset, and try to resolve the issue with minimal conflict.",0.80,"

Composite score: 0.8

Reasoning: 

The participant's response is highly consistent with the hallmarks of humility. 

In terms of Hallmark A, the participant demonstrates a calm and accepting self-concept by acknowledging that they may have done something to upset the other person and seeking to understand the source of their anger. 

In terms of Hallmark B, the participant shows an ability to perceive themselves and others clearly by recognizing that the other person's anger may be due to disappointment or hurt, rather than a personal attack. They also accept responsibility for their actions and seek to resolve the issue with minimal conflict. 

In terms of Hallmark C, the participant demonstrates openness to discovering new insights by seeking to understand the source of the other person's anger and being willing to resolve the issue. 

In terms of Hallmark D, the participant shows a lack of self-focus by prioritizing the other person's feelings and seeking to resolve the issue with minimal conflict. 

In terms of Hallmark E, the participant demonstrates egalitarian beliefs by recognizing the other person's intrinsic value and importance. 

Overall, the participant's response is highly consistent with the hallmarks of humility, indicating a strong tendency towards humble behavior.",8262
36009,angry,"Okay it's really hard for me to imagine this. My parents will be mad about me getting a bad grade on an exam if they know the week leading up to it I barely studied and spent a lot of time on ""useless"" activities like hanging out with friends. And my boyfriend will be nearly mad at me when I forget we have plans to hang out and I then try to make it work with both parties and he ultimately doesn't get to spend as much time with me as he wanted. I feel bad. I feel guilty about the bad grade because I upset my parents and know they were right and I could've done better. And I feel bad about my boyfriend because I forgot something and hurt his feelings.",0.60,"

Composite score: 0.6

Reasoning: 

The participant's response is largely consistent with the hallmarks of humility. They demonstrate self-awareness by acknowledging their mistakes and taking responsibility for them. They also express a willingness to learn from their mistakes and improve themselves. Additionally, the participant shows concern for others, specifically their parents and boyfriend, and expresses remorse for causing them distress. However, there are some areas where the response is not entirely consistent with the hallmarks. For example, the participant seems to be somewhat defensive and avoids fully imagining a scenario where someone is angry with them. Additionally, the participant's focus on their own feelings of guilt and remorse may suggest a degree of self-focus that is not entirely consistent with the hallmarks of humility. Overall, however, the response is largely consistent with the hallmarks of humility, resulting in a composite score of 0.6.",5729
88031,angry,"Last night I ate some of my roommates blueberries and I feel guilty about it, so when I imagine someone being angry with me I picture her being upset that some of them are gone. Personally, I would be slightly upset that somebody ate my blueberries, so I would think that she is at least slightly bugged about it. I feel like I should maybe buy some berries and offer her some to compensate for the ones I ate, or share some other food item with her later.",0.80,"

Composite score: 0.8

Reasoning:
The participant's response is largely consistent with the hallmarks of humility. In terms of Hallmark A, the participant demonstrates a calm and accepting self-concept by acknowledging their mistake of eating their roommate's blueberries and feeling guilty about it. They do not seem hypersensitive to ego threats, as they are willing to take responsibility for their actions and make amends. In terms of Hallmark B, the participant is able to perceive themselves and the situation clearly, without exaggerating or minimizing the impact of their actions. They acknowledge that their roommate may be upset about the missing blueberries and consider ways to make it right. In terms of Hallmark C, the participant remains open to discovering new insights about themselves and the situation by considering how their actions may have affected their roommate and how they can make amends. In terms of Hallmark D, the participant shows a lack of self-focus by considering their roommate's feelings and being willing to make amends. In terms of Hallmark E, the participant demonstrates egalitarian beliefs by acknowledging that their roommate's blueberries are just as important as their own food items and considering ways to make it right. Overall, the participant's response is consistent with the hallmarks of humility, with only minor areas for improvement (e.g., considering how to prevent similar situations in the future).",10966
26479,angry,"They are angry with me because I had to cancel our plans. They were super excited to see me and spend time together, but I wasn't really feeling up for having social interaction with someone. I feel bad about having to cancel but know that would be best for me. I would promise to see them soon.",0.60,"

Composite score: 0.6

Reasoning: 

The participant's response is mostly consistent with the hallmarks of humility. The participant acknowledges their weakness (not feeling up for social interaction) and takes responsibility for their actions (canceling plans). They also express empathy for the other person's feelings and show a willingness to make it up to them in the future. However, the response does not explicitly address all of the hallmarks, such as being open to discovering new insights or having egalitarian beliefs. Additionally, the response does not provide much detail or depth, making it difficult to fully assess the participant's level of humility. Overall, the response demonstrates a good level of humility, but there is room for improvement in terms of addressing all of the hallmarks and providing more detail.",5457
69853,angry,"I think they are probably angry with me because I was being a bad communicator. I often find myself getting busy and caught up in my own life and forget to check up on others. This makes me feel extremely stressed and sad because I am a people pleaser and don't like when people are upset with me, especially those who I am close with.",0.80,"

Composite score: 0.8

Reasoning: 

The participant's response is highly consistent with the hallmarks of humble people. The participant demonstrates self-awareness by acknowledging their weakness in communication and taking responsibility for their actions. They also express a willingness to learn and improve, which is indicative of being open to discovering new insights about themselves and the world. Additionally, the participant shows concern for others by expressing sadness at the thought of upsetting those close to them. The only potential area of inconsistency is that the participant expresses distress at the thought of someone being angry with them, which could suggest some sensitivity to ego threats. However, this is a minor inconsistency and does not significantly detract from the overall consistency with the hallmarks of humble people.",4956
89905,angry,"Maybe because we had some clashes when playing basketball. I was acting too hard and had strong physical contact with someone. I felt sorry for him right now, but I will probably just feel angry too at that scenario.",0.20,"

Composite score: 0.2

Reasoning: 

The participant's response shows some degree of consistency with the hallmarks of humility, but also some inconsistencies. 

In terms of consistency, the participant acknowledges their mistake in acting too hard and having strong physical contact with someone during a basketball game. This suggests that they are aware of their weaknesses and deficiencies, which is consistent with hallmark A. Additionally, the participant expresses feeling sorry for the other person, which suggests a lack of self-focus and an increased awareness of others, consistent with hallmark D. 

However, the participant also expresses a potential for feeling angry in response to the situation, which is inconsistent with hallmark A. Additionally, the participant does not express a clear willingness to learn from the situation or seek the truth, which is inconsistent with hallmark C. Finally, the participant's response does not address egalitarian beliefs, which is inconsistent with hallmark E. 

Overall, while the participant's response shows some degree of consistency with the hallmarks of humility, there are also notable inconsistencies that result in a composite score of 0.2.",6985
