pid,essay_type,essay,score,comments,millis
32418,angry,"I think that if someone were angry with me it would be because i said the wrong thing and was not sensitive enough to their feelings. They felt that I disregarded how they felt and only took my thoughts and feelings into consideration. Because of this I feel ashamed and apologetic. I always try to be aware of how others feel and be polite towards them even if I do not agree or get along with them, although, I admit I do not always do so.",0.80,"

Composite score: 0.8

Reasoning: 

The participant's response is highly consistent with the hallmarks of humility. 

In terms of hallmark A, the participant demonstrates a calm and accepting self-concept by acknowledging their mistake and accepting responsibility for their actions. They do not seem to be hypersensitive to ego threats, as evidenced by their willingness to admit their shortcomings without excessive distress. 

In terms of hallmark B, the participant demonstrates clear perception of themselves and others. They acknowledge their mistake and take responsibility for it, without exaggerating in either a self-enhancing or self-debasing direction. 

In terms of hallmark C, the participant demonstrates openness to discovering new insights about themselves and the world. They are teachable and seek the truth, even when it may be personally embarrassing or unflattering. They are able to receive negative feedback and grow from it, as evidenced by their feeling ashamed and apologetic. 

In terms of hallmark D, the participant demonstrates a lack of self-focus and an increased awareness of and appreciation for others. They acknowledge that they were not sensitive enough to the other person's feelings and only took their own thoughts and feelings into consideration. 

In terms of hallmark E, the participant demonstrates egalitarian beliefs by acknowledging the importance of being polite towards others, even if they do not agree or get along with them. 

Overall, the participant's response is highly consistent with the hallmarks of humility, resulting in a composite score of 0.8.",13738
99270,angry,"They're angry with me probably I wasn't patient with them. Their ego and lack of responsibility might lead them to be angry with me. I would feel that I shouldn't be treated like this, because if someone with authority copied my behavior to them, at least they won't be angry to my face. I want to go away and never need to see them again.",-0.50,"

Composite score: -0.5

Reasoning: 

The participant's response is partially consistent with the hallmarks of humble people. The participant acknowledges that they may have been impatient and takes some responsibility for the situation. However, the participant's response also suggests a hypersensitivity to ego threats, as they feel they should not be treated in a certain way due to their perceived authority. Additionally, the participant's desire to avoid the situation entirely may indicate a lack of openness to discovering new insights and growing from negative feedback. Overall, while the participant's response shows some humility, it also displays some inconsistencies with the hallmarks.",6347
26273,angry,"In this imaginative scenario, my brain immediately went to someone being angry at me for forgetting to do something or doing something incorrectly. Maybe they asked me to do a task they expected me to do correctly, but I simply forgot or I didn't do as well as they expected. In this situation, I just feel mad that they're mad at me. I am frustrated and uncomfortable with the fact that they are angry with me based on their own expectations. However, I don't show anything expressively nor do I say anything.",0.20,"

Composite score: 0.2

Reasoning: 

The participant's response is somewhat consistent with the hallmarks of humble people, but there are also some inconsistencies. 

The participant demonstrates some level of self-awareness by imagining a scenario where someone is angry with them for not meeting expectations. However, the participant's initial reaction of feeling mad that the other person is angry with them suggests a lack of acceptance of responsibility for their actions. Additionally, the participant's lack of expressiveness or communication in response to the situation may indicate a lack of openness to discovering new insights or receiving negative feedback. 

Overall, while the participant's response shows some alignment with the hallmarks of humble people, there are also some areas where their response is inconsistent with these characteristics.",5850
14533,angry,"They are angry with me because I did something wrong. They think I can do it well but I failed to do it. So they are disappointed at me. At this moment, I feel guilty and sad because I lost someone's trust.",0.60,"

Composite score: 0.6

Reasoning:

The participant's response is largely consistent with the hallmarks of humble people. The participant acknowledges their mistake and takes responsibility for it, which is consistent with hallmark B. Additionally, the participant expresses feelings of guilt and sadness, which suggests that they have a calm and accepting self-concept that is not hypersensitive to ego threats (hallmark A). The participant also appears to be open to discovering new insights about themselves and the world, as they are able to receive negative feedback and grow from it (hallmark C). However, the response does not provide enough information to assess the degree to which the participant is focused on others or has egalitarian beliefs (hallmarks D and E). Overall, the response is largely consistent with the hallmarks of humble people, but more information is needed to fully assess the participant's level of humility.",9799
61217,angry,Someone would probably be angry with me because I do not stand up for myself. It has always been a struggle for me to do so and they likely got frustrated either trying to stand up for me or convince me to do that for myself. It always makes me extremely upset when someone is upset with me. It makes the situation worse and I struggle to be happy until the situation is resolved. The weight on my shoulders increases when someone is upset with me.,0.20,"

Composite Score: 0.2

Reasoning:
The participant's response is somewhat consistent with the hallmarks of humble people, but there are also some inconsistencies. 

The participant acknowledges their weakness in not standing up for themselves, which is consistent with hallmark A. However, the participant's response suggests that they are hypersensitive to ego threats, as they become extremely upset when someone is angry with them, which is inconsistent with hallmark A. 

The participant's response is somewhat consistent with hallmark B, as they acknowledge their weakness and accept responsibility for it. 

The participant's response is somewhat consistent with hallmark C, as they acknowledge that they struggle with standing up for themselves and may need to receive negative feedback to grow. 

The participant's response is somewhat consistent with hallmark D, as they acknowledge that someone may have been trying to stand up for them and appreciate the weight of the situation on their shoulders. However, the participant's response does not explicitly mention being happy for others' success, which is a hallmark of humble people. 

The participant's response is somewhat consistent with hallmark E, as they acknowledge that they may have let someone down and that others may have been frustrated with them. However, the participant's response does not explicitly mention seeing others as having the same intrinsic value and importance as themselves, which is a hallmark of humble people. 

Overall, the participant's response is somewhat consistent with the hallmarks of humble people, but there are also some inconsistencies. Therefore, the composite score is 0.2.",11683
30729,angry,My best friend is mad at me for not hanging out or talking to her as much lately. Me not spending time with her or texting her as often. I feel sad that she has expressed anger about it and I feel like i should be there for her more.,0.80,"

Composite score: 0.8

Reasoning: 

The participant's response is highly consistent with the hallmarks of humility. 

In terms of A, the participant demonstrates a calm and accepting self-concept by acknowledging their friend's anger without becoming defensive or overly distressed. 

In terms of B, the participant is able to perceive themselves and their friend clearly, without exaggerating or minimizing the situation. They take responsibility for their actions and express a willingness to improve the situation. 

In terms of C, the participant remains open to discovering new insights about themselves and their relationships. They express a desire to be there for their friend more and are willing to receive negative feedback in order to grow. 

In terms of D, the participant shows a lack of self-focus and an appreciation for their friend's feelings. They express sadness at their friend's anger and a desire to be there for them more. 

In terms of E, the participant demonstrates egalitarian beliefs by valuing their friend's feelings and seeing them as having the same intrinsic value and importance as themselves. 

Overall, the participant's response is highly consistent with the hallmarks of humility, earning a composite score of 0.8.",10981
65759,angry,"It's my mother and she's angry about my sexual orientation. Her religious beliefs led her to be angry with me. She found out by reading text messages on my phone. I feel hurt, betrayed, and incredibly disgusting for simply existing.",-0.60,"

Composite score: -0.6

Reasoning: 

A. The participant's response does not provide evidence of a calm and accepting self-concept. The participant feels hurt, betrayed, and disgusting, which suggests that their sexual orientation is causing them distress. (-0.2)

B. The participant does not provide evidence of perceiving themselves and others clearly. The participant does not mention any strengths or weaknesses, and their response is focused on their mother's anger rather than their own behavior. (-0.2)

C. The participant does not provide evidence of remaining open to discovering new insights about themselves and the world. The participant does not mention seeking the truth or being teachable. (-0.2)

D. The participant does not provide evidence of showing a lack of self-focus and an increased awareness of and appreciation for others. The participant's response is focused on their own feelings rather than their mother's perspective. (-0.2)

E. The participant does not provide evidence of having egalitarian beliefs. The participant does not mention seeing others as having the same intrinsic value and importance as themselves. (-0.2)

Overall, the participant's response is inconsistent with the hallmarks of humble people. The participant's response suggests that they are experiencing distress related to their sexual orientation and their mother's anger, which is not consistent with a calm and accepting self-concept. Additionally, the participant's response is focused on their own feelings rather than their mother's perspective, which is not consistent with a lack of self-focus and an increased awareness of and appreciation for others. However, it is worth noting that the participant's response may be influenced by the difficult and emotionally charged nature of the writing prompt.",12237
61199,angry,someone is angry with me because i wasn't communicating about things that i knew were going to happen or could happen and if i had just warned someone about it everything could have been much easier to deal with. They are angry because i went silent when i could have said something easily and i feel greatly disappointed in myself i saw it all coming and still let it happen,0.80,"

Composite score: 0.8

Reasoning:

The participant's response is highly consistent with the hallmarks of humility. The participant takes responsibility for their actions and acknowledges their mistake. They are aware of their weaknesses and deficiencies and express disappointment in themselves. This demonstrates hallmark A. The participant also perceives themselves and the situation clearly without exaggeration, which is consistent with hallmark B. The participant is open to discovering new insights and acknowledges the need for communication, which is consistent with hallmark C. The participant shows a lack of self-focus and an increased awareness of others, as they express disappointment in themselves and acknowledge the impact their actions had on others, which is consistent with hallmark D. Finally, the participant demonstrates egalitarian beliefs by acknowledging their own mistake and seeing themselves as having the same intrinsic value and importance as others, which is consistent with hallmark E. Overall, the participant's response is highly consistent with the hallmarks of humility, resulting in a composite score of 0.8.",7921
98096,angry,"I think someone would be angry with me because I have a hard time with gauging other people's emotions, I have poor empathy skills. I do not like that they are mad at me but I can most likely understand why. I would like to talk to them about it and try to see what I can do better.",0.80,"

Composite score: 0.8

Reasoning: 

The participant's response is highly consistent with the hallmarks of humility. They demonstrate self-awareness by acknowledging their poor empathy skills and accepting responsibility for their potential role in the situation. They also express a desire to improve and seek feedback by wanting to talk to the person who is angry with them. Additionally, the participant's response shows a lack of self-focus and an appreciation for others by expressing concern for the other person's feelings. The only potential area where the response may not be completely consistent with the hallmarks is in the participant's statement that they ""do not like that they are mad at me,"" which could suggest some level of ego sensitivity. However, this is a minor point and does not significantly detract from the overall consistency with the hallmarks.",5393
24404,angry,"Someone is angry with me because I yelled at them for being too noisy. They were opening and slamming doors, and I woke up in the middle of the night to it. Anxious and Angry, I grab my phone and type, ""I am not afraid to call in a noise violation!"" I click the send button and send it to my entire group. All they end up doing is ignoring me and turn on music.",-0.50,"

Composite score: -0.5

Reasoning: 

The participant's response shows some inconsistency with the hallmarks of humble people. 

In terms of A, the participant does not seem to have a calm, accepting self-concept as they react with anxiety and anger. 

In terms of B, the participant does not seem to be able to perceive themselves and others clearly, as they exaggerate the situation by sending the message to their entire group. 

In terms of C, the participant does not seem to be open to discovering new insights about themselves and the world, as they do not reflect on their own behavior and instead focus on the other person's actions. 

In terms of D, the participant does not seem to show a lack of self-focus and an increased awareness of and appreciation for others, as they prioritize their own need for quiet over the needs of their group members. 

In terms of E, the participant does not seem to have egalitarian beliefs, as they view themselves as superior to the other person who was making noise. 

Overall, while the participant's response does show some awareness of their own behavior and mistakes, it also shows a lack of humility in several key areas.",8115
99417,angry,"They might be angry with me because I keep bothering them about the same issue and I can not decide how to deal with it. I feel like they do not know how I completely feel about the issue that I am conflicted in because we have different values. I wish that they can step in my shoe to try to see it from my perspective. If I could explain why I am conflicted better, it would make me feel better and see if they can help me in any other way.",0.60,"

Composite score: 0.6

Reasoning: 

A. The participant's response suggests that they are aware of their weaknesses and deficiencies, as they acknowledge that they are conflicted and cannot decide how to deal with the issue. However, they do not seem to be excessively distressed by these thoughts. (+0.3)

B. The participant's response suggests that they are able to perceive themselves and others clearly, as they acknowledge that they have different values from the person who is angry with them. They also accept responsibility for their role in the situation, as they acknowledge that they keep bothering the other person about the same issue. (+0.3)

C. The participant's response suggests that they are open to discovering new insights about themselves and the world, as they express a desire for the other person to step into their shoes and see the issue from their perspective. They also seem willing to receive negative feedback and seek help from others. (+0.3)

D. The participant's response does not directly address their level of self-focus or appreciation for others, so it is neutral with respect to this hallmark. (0.0)

E. The participant's response suggests that they have egalitarian beliefs, as they express a desire for the other person to see the issue from their perspective and acknowledge that they have different values. (+0.3)

Overall, the participant's response is consistent with several of the hallmarks of humility, particularly those related to self-awareness, responsibility-taking, and openness to new insights. However, their response does not directly address their level of self-focus or appreciation for others, so the composite score is not as high as it could be.",13528
49068,angry,"If someone were angry with me, I would imagine it would be because I bailed on a plan or am late to some plan. Even though I crave warmth and having strong relationships with others, often times I have too much going on or am very tired and am unable to commit to plans. For example, I was recently late to dinner with a few friends because I was working on an English essay. I would feel terrible and extremely guilty and I would not stop apologizing or would try to make it up some how.",0.60,"

Composite score: 0.6

Reasoning:
The participant's response is largely consistent with the hallmarks of humble people. The participant acknowledges their potential shortcomings and accepts responsibility for their actions. They also express a desire to maintain positive relationships with others and feel guilty when they fall short. However, there is some indication that the participant may be somewhat self-focused, as they mention their own fatigue and workload as reasons for not being able to commit to plans. Overall, the response demonstrates a good level of humility and self-awareness.",5783
81418,angry,If someone were to be mad at me right now I think it would probably be because of a miscommunication or lack of communication. I am very aware that I am not a good communicator and I am not good at talking about my feelings with others. this has caused many problems in the past and probably will in the future. I feel terrible about situations like these because I don't like it when people are mad at me and I would never want someone's feelings to be hurt over something as small as a misunderstanding and I wouldn't want my lack of communication to lead to someone thinking that they did something wrong.,0.80,"

Composite score: 0.8

Reasoning: 

The participant's response is highly consistent with the hallmarks of humble people. 

In terms of hallmark A, the participant demonstrates a calm and accepting self-concept by acknowledging their weakness in communication without excessive distress. 

In terms of hallmark B, the participant perceives themselves and others clearly without exaggeration and accepts responsibility for their mistakes. 

In terms of hallmark C, the participant remains open to discovering new insights about themselves and the world, as evidenced by their willingness to acknowledge their communication difficulties and their desire to avoid hurting others. 

In terms of hallmark D, the participant shows a lack of self-focus and an increased awareness of others by expressing concern for the other person's feelings and not wanting them to think they did something wrong. 

In terms of hallmark E, the participant demonstrates egalitarian beliefs by valuing the other person's feelings and not wanting to hurt them over something as small as a misunderstanding. 

Overall, the participant's response is highly consistent with the hallmarks of humble people, earning a composite score of 0.8.",8601
72043,angry,"Depending on the person and situation it could absolutely be my fault. A lot of the times I don't filter my words, and I'm less sensitive to the average person. However, a lot of the times conflict arises it is more due to my bluntness regarding something someone else initiated or said first. Depending on the situation I either feel guilt or anger/annoyedness.",0.60,"

Composite score: 0.6

Reasoning: The participant's response is largely consistent with the hallmarks of humility. The participant acknowledges their own potential role in conflict and is aware of their bluntness. This demonstrates hallmark A, as the participant is not hypersensitive to ego threats and can acknowledge their weaknesses without excessive distress. The participant also considers both their strengths and weaknesses, which is consistent with hallmark B. Additionally, the participant is open to discovering new insights about themselves and the world, as evidenced by their willingness to consider their own role in conflict and their bluntness. This is consistent with hallmark C. The participant's response does not explicitly address hallmark D, but it does not contradict it either. Finally, the participant's response is consistent with hallmark E, as they do not appear to view themselves as inherently more important than others. Overall, the participant's response demonstrates a high degree of humility.",7103
97797,angry,"If someone is angry at me, I assume it would be something I did that made them angry. I would feel very guilty and sad if they didn't tell me what they were angry at me for. Anger scares me if I am on the receiving end of it because I was raised as gymnast and had a bad experience with a French coach who had anger management issues.",0.20,"

Composite score: 0.2

Reasoning: 

The participant's response is somewhat consistent with the hallmarks of humble people. The participant acknowledges that they may have done something to make the other person angry, which is consistent with hallmark B. Additionally, the participant expresses a willingness to learn more about the situation and understand why the other person is angry, which is consistent with hallmark C. However, the participant's fear of anger and guilt and sadness about potentially causing someone else's anger may indicate a hypersensitivity to ego threats, which is inconsistent with hallmark A. The participant's personal experience with a coach who had anger management issues may also suggest a lack of self-focus, which is consistent with hallmark D, but the connection is not entirely clear. Overall, the response shows some alignment with the hallmarks of humble people, but there are also some inconsistencies.",6518
42507,angry,"They may be disappointed that I didn't fulfill their expectations, lied to them, or said something offensive. I would also feel angry about myself and try to rebuild their trust by recognizing my mistakes.",0.80,"

Composite score: 0.8

Reasoning: 

The participant's response is highly consistent with the hallmarks of humility. They acknowledge that someone may be angry with them due to their own mistakes, such as not fulfilling expectations, lying, or saying something offensive. This demonstrates a willingness to accept responsibility for their actions and a lack of defensiveness. Additionally, the participant expresses a desire to rebuild trust, which shows a willingness to learn and grow from negative feedback. Overall, the participant's response aligns with the hallmarks of humility, indicating a high degree of humility.",4562
28211,angry,"Someone is angry with me because of my lack of communication skills. I acted like I wasn't upset with them because I didn't want to make them more upset. However, withholding why I was upset made them more upset. I feel conflicted in this situation because I don't want to make them more angry, but I also want to communicate and let them know how I feel.",0.60,"

Composite score: 0.6

Reasoning: 

The participant's response is largely consistent with the hallmarks of humility. The participant acknowledges their lack of communication skills and takes responsibility for their actions. They also recognize the impact of their behavior on others and express a desire to communicate and resolve the situation. This demonstrates a willingness to be open to discovering new insights about themselves and the world (hallmark C) and a lack of self-focus (hallmark D). Additionally, the participant's conflict in the situation shows that they are aware of their weaknesses and deficiencies (hallmark A) and are considering both their strengths and weaknesses (hallmark B). However, the response does not explicitly mention egalitarian beliefs (hallmark E), which is why the composite score is not higher.",6200
