pid,response,hum1,hum2,hum3,hum4,hum5,hum6,standardized
73467,"I have received an award for my research. This has been a long journey, many hours, tears, and hard work so receiving recognition for it makes me feel happy and like all of the hard times were worth it. I achieved my award through work in the environmental science/biology field perhaps working with marine animals or even terrestrial ones learning more about how processes and larger things like climate change impact them. I did this work through learning new software programs, scientific instruments, how to structure a research design, and more.",5,5,5,3,3,3,0.48
47724,I received this award for science research in the lab I work in. I was able to achieve what brought me to this award because of my hard work and dedication to beginning in a lab. I feel proud and excited for getting an award because I know I have shown dedication and passion towards the project.,5,5,6,3,2,3,0.86
27006,I probably would receive a reward for some kind of academic achievement. I was able to get this award by working and studying hard to achieve my goals. I feel purposeful and content with the award. the award serves as a reminder that my hard work paid off,3,5,4,5,4,4,-0.86
18289,I received the award through hard work and a lot of time spent preparing for whatever contest it was for. I was able to achieve it through a lot of effort and time. It wasn't that I was intrinsically better than the people around me. I feel proud of myself and humbled that I was given the opportunity to compete.,5,5,6,3,2,4,0.67
50119,"I received a scholarship for research or some other academic merit. I was able to achieve this because of guidance from mentors, opportunities that opened up, and people who believed in me, mentored me, and simply gave me a chance. I feel proud about getting it, shocked because I have not been doing well enough for any kind of financial academic recognition lately, and thankful to those who have helped me achieve what I have. I also feel more confident about my future plans and think of the reward as affirmation and confirmation that I am doing well and headed in the right direction.",5,5,5,3,3,3,0.48
97837,"I received the award for my hard work in and outside the classroom. I struggled when I was growing up, so I developed a strong work ethic. I feel very good because I my effort is being rewarded. I also, feel proud of myself.",5,5,5,3,3,3,0.48
33691,"I received the award for something academic. I was able to achieve the grades or good academic habits by studying and taking school seriously, especially like my junior year of high school. I'm super excited to get the award because I appreciate when hard work is recognized. I look around to my friends and family who were around when it was really tough or when I was really stressed or who helped me have fun during those times.",5,5,5,3,3,3,0.48
90693,"I received the award for having done something commendable or helpful to others. I was able to achieve it because I worked hard, was responsible and knew how to set goals. It is possible that the award was given to many other people around me too. I would feel proud for receiving an achievement, but may question to what extent it reflects my character or worth.",5,5,4,3,4,4,-0.10
44692,"The award is for a creative idea that I turned into a successful business. I achieved it through understanding that hard work and taking risks is the only way to find out what we are capable of, and I wanted to experience that in my lifetime. I feel proud and satisfied that I got a deeper understanding of my abilities and what I am able to achieve.",3,5,4,5,4,4,-0.86
56658,"I received an award for being the most dedicated student in a certain class, maybe physics. I achieved this award by earning high grades, going to office hours whenever they were offered, helping classmates with their questions, and waking up for my 8:00 am physics class every day. I feel satisfied that I was dedicated enough for my dedication to be recognized by someone else. I also feel proud that I will be able to show the award to my family so they know they did a good job by sending me to college.",5,5,5,3,3,3,0.48
50327,"I probably received the award for something that has to do with school, or a scholarship or something along those lines. I would be able to achieve being able to receive the award by working really hard at what I do in school, or some biology-research related award. I would feel very proud, and ecstatic about receiving it. I would feel like all of the hard work that I did was worth it.",5,5,4,3,4,4,-0.10
88304,I received the award for developing an important drug. I led and worked with a team in a pharmaceutical company or university. I feel excited and honored.,5,5,6,3,2,3,0.86
78074,I got an award for something academic that I achieved by working hard and doing research in a field that I enjoy. Maybe it is for a psychological study or for my Masters or something. I am so excited to win this award because my work has paid off and is being recognized by my peers! I get to hug my parents and tell them that I did it all for them.,5,5,5,3,3,3,0.48
75100,"I would have received an award for something public speaking or teaching related. I would have been able to achieve the award through intense academic and studious activity that led me to write something amazing. Getting it would give me a sense of security because I would know that I can orient myself in the world just as well, if not better, than those around me. I would be happy because I would be secure knowing that I am like other people - and they know that.",5,5,6,3,2,3,0.86
29235,I would be unsure what I received the reward for because I have not done anything particularly special lately. If the reward was warranted then I most likely did something either positive or showed some level of skill that deserved an award. I would feel good about the reward if it made sense to why I was receiving it.,5,5,4,3,4,4,-0.10
35913,"I am imagining that I just received an award for curing a disease in my future research career. I have worked very hard for this moment, and I likely spent many years in my lab focusing on this project. I feel happy knowing that all of my difficult years of studying in college have finally paid off. I would be so happy that I could make a mark on the world by helping others, and I would be extremely proud of myself.",5,5,5,3,3,3,0.48
48548,"If I were to achieve an award, it would likely be for a scientific research contribution; however, I would hope that it would be for a scientific contribution that has a positive impact on the world around me. I would have achieved this ward by researching infectious disease through perserverance and curiosity. Even though I would be receiving the award, I would know that it was not purely of my own achievements. Science is a fairly collaborative field, and i would of had many peers and mentors to help me towards the award.",5,5,4,3,4,4,-0.10
66044,"One of my biggest dreams is to win the nobel prize in chemistry so I am going to pretend that is the award I have just one. I would have won it after several years of daily research and a constant fascination with one topic. It would require an unimaginable amount of work to get there, but I would have given my all every day to do it. I would feel like everything I had lived for had come to be, I would feel like i would have a completely fulfilled life.",5,5,5,3,3,3,0.48
33874,"I received an award for an amazing scientific discovery that has changed the world. (I'm in an environmental science class right now, so my mind immediately jumps to some scientific discovery to help the environmental crisis). I worked tirelessly for years and years with an amazing team to receive this award. There are a lot of ups and downs and many obstacles that we had to jump through to accomplish this goal. I feel accomplished and proud of my self and the team that I had to work with to get there. Most of all I feel grateful for the opportunities that I was able to experience to get me to that point and for the people that were there for me during all of it.",5,5,6,3,2,4,0.67
94972,"I received the award for academic performance (likely in a chemistry class). I always have been an over-achiever, which is both one of my biggest strengths and simultaneously one of my biggest weaknesses (because of the toll it takes on my mental health). I was able to earn the award purely by working hard and putting in the hours to study/practice material. I feel very validated and proud of myself upon receiving it.",5,5,4,3,4,4,-0.10
53878,I received an award for my scientific research. I worked on my research project for several months and made significant findings that have a huge impact on medicine. I feel proud of myself for receiving this award. I also feel accomplished as I have always wanted to be recognized for my work.,5,5,5,3,3,3,0.48
48958,"I would hope to receive a reward in some way for caring for other people. I imagine this would most likely happen within my career path as I am going into what is known as a ""helping profession."" I would feel very honored if I won an award for this because I would truly be making an impact on other people's lives. I think that it would also be gratifying to know that my hard work to get to that point in my life would have paid off.",5,5,5,3,3,3,0.48
28512,"I received an award for care. I tend to gravitate towards opportunities where I get to show concern and care for others. If I were to receive an award, it would probably be for something that I am dedicated to like caring for others. While I quite like being accomplished, I do not like receiving awards because I equate awards with an unhealthy sense of pride.",5,5,5,3,3,3,0.48
56571,"If this were in the future after I graduated and started a career in something I wanted, like chemistry or some other science, then the award would probably be some sort of scientific achievement award to celebrate something that I discovered. I would be incredibly happy with myself and would feel very content with my life and career if this were to happen. I would probably want to immediately tell my family and friends about it. I would feel a little bit sad that my mom couldn't see me getting this award, but it would help me appreciate spending time with the rest of my family and friends celebrating.",5,5,5,3,3,3,0.48
55214,"I imagine I've achieved ""Lab Manager of the Month"" recognition or something like that. My coworkers would have nominated me for it. I achieved it by being a reliable, helpful, and pleasant lab manager to my cor-workers. My boss also acknowledges what a big help I am!",3,5,5,5,3,4,-0.48
24883,"I would love to receive an award for something I've created, especially if its something that goes on to live in posterity. I just love making something new and being praised about it (shameless, but true). I think an award doesn't really mean that much in the grand scheme of things, but its still a nice recognition - a little sign that says, hey, we really liked this! It's been a long time since I won anything so it would feel nice.",5,5,5,3,3,3,0.48
64326,I believe I would win an award for being a caring person. I always try to help people in any way that I can and have done so purely based on internal drive. I would feel happy yet awkward receiving a reward for doing something a lot of people do on a daily basis.,5,5,4,3,4,4,-0.10
28441,"I would like to think if I just received an award, it would be for gymnastics or cheerleading. I have a meet coming up and I'm also currently deciding whether or not to join club cheer which has a nationals. Either way, hard work and determination has brought me the award because of how hard I have worked in either sport. I would feel amazing for getting it and accomplished as well.",5,5,5,3,3,3,0.48
97263,I received the award for class participation and leadership. I was able to achieve this award by being attentive and actively involved in the classroom setting individually and in groups. I am proud and ecstatic about being recognized for the award.,5,5,4,3,4,4,-0.10
20932,I received an Olympic award for long jump. i was able to achieve it thanks to my coach and the time that I spent practicing. I feel great about getting it and it feels like my hard work has finally paid off.,5,5,4,3,4,4,-0.10
26204,"I have received an award for being an exceptional student in some aspect. I was able to achieve the award by being hard-working and a little obsessive about something. I feel proud and happy for getting it, although I also probably feel a little embarrassed about. I am probably excited to put the award on my resume.",5,5,5,3,3,3,0.48
78541,"I probably received either an academic or an athletic award, since those are the two main things that I've gotten awards for in the past. I probably spent a lot of hours of hard work working on whatever I got the award for, and worked with the specific goal in mind of achieving that award. I get a lot of satisfaction through achievement/success, so I'm sure I would be really happy and feel a sense of pride.",3,5,4,5,4,4,-0.86
48848,I received an award for changing the way that hospitals function -- focusing more on holistic care and the mind/body connection in regards to healing. This is opposed to the current biomedical system which solely focuses on the physical aspect of wellness. I was able to achieve this through working in healthcare consulting to implement these changes into hospitals. I would feel really proud of myself and hopeful for the populations overall wellness in the future.,5,5,4,3,4,4,-0.10
75835,"I would image that I received the award for something related to leadership. I've held quite a few leadership positions throughout college, so it seems as if this would be appropriate. I was able to achieve great leadership skills (which I'm assuming I got the award for) by listening to others criticism, talking to my mentor, and always trying to help others. I feel extremely happy about getting this award. I have put so much energy and effort into one organization, so it would be an honor to receive an award for it.",3,5,4,5,4,4,-0.86
63965,"I'm not sure what I received the award for, but knowing my current situation, it would probably be for my current academics or teaching assistant positions. I would be able to achieve an award like this through dedication and a lot of hard work. I would probably feel proud about getting the award, but I think this would only be the case if I felt like the level of effort I put in matched what was expected with the award. I'm not sure how I would feel about getting the award if I didn't feel like the level of effort for those two things really aligned.",5,5,5,3,3,3,0.48
10965,I just received an award for my chemistry research. I was able to accomplish this through my years of hard work and dedication in school and in my lab. I am very excited to get an award and see a tangible result of all of my work. I hope to continue this work and receive more awards in the future.,5,5,4,3,4,4,-0.10
13624,"I received the award for being a great small group leader in my campus ministry. The award is given to small group leaders who exhibit a sacrificial love for their members. I was able to achieve this by setting aside time to spend with members individually, even if that means I won't finish an assignment when I wanted to or I don't get to eat a meal. I feel great about getting the award, but it's definitely not the reason for why I do what I do.",5,5,4,3,4,4,-0.10
73177,"I received an award for compassion. I was able to achieve this by an anonymous nomination that nominated me for the award for someone who displays compassion. It took me a long time to think of what award I would win because I do not see myself having any outstanding achievements or notable qualities, but I would like to think that someone would experience the kindness I try to consistently extend and nominate me for the hypothetical award. In this scenario, I am overwhelmingly happy that someone has noticed me to be a compassionate person, as that is my goal.",5,5,5,3,3,3,0.48
94204,"I received an award because I helped saving lives of many cats and dogs. I achieved such things because of the support of my team and my family members, and my hard work. I would see it as a motivation that drives me to keep doing good deeds and help more.",5,5,4,3,4,4,-0.10
94842,"I received an award for my academic success. I was able to achieve the award through hard work and diligence. I feel successful after receiving an award like that. In a way, I feel validated.",5,5,5,3,3,3,0.48
95113,"I just received an academic award for most improved. I think this would feel immensely fulfilling because I always feel like I am putting a lot of work into my studies. I achieved it through long hours studying, spending time going over notes, and reading the textbooks. Additionally, I have a solid support group who really pushes me forward. I would feel super proud of myself; this would save me and make me feel like everything is worth it.",5,5,5,3,3,3,0.48
13663,"I received the award for being giving to others I love. I was able to achieve what brought me to the award because I really care about the way others perceive me and the way I impact the lives of others, so I always treat others the best I can. I feel good about getting this award because it means others have recognized my efforts to care for those around me.",5,5,5,3,3,3,0.48
96553,"I won an award for leadership within my profession. I won this award because I am kind and empathetic to my peers while also being effective at getting things done. I often receive praise from my peers in group work for being understanding and also good at my job. I feel a bit embarrassed by the award because despite recognizing these qualities in myself, I am uncomfortable with praise.",5,5,5,3,3,3,0.48
21424,"At this stage in life the only realistic award I could get would likely be on merit and contribution to the Physical Therapy Community. But that's utterly boring so we will say I get it for something fun in an activity I'm doing like running a race, competing in escape rooms, etc. I would achieve it through hard work and dedication in the area or field of training paired with innovation and creativity. I like getting awards because they make others proud and happy for me, but I honestly don't particularly like being center of attention so I'm impartial if I get an award or not.",5,5,5,3,3,3,0.48
52699,I received the award for being the best speed walker to campus when I am late to class. I was able to achieve this through daily walks on campus and around my hometown and also walking on the treadmill. I was able to achieve this through hard work and determination and wearing the right shoes when choosing to walk to class. I feel excited and ready to go to class another day.,5,5,4,3,4,4,-0.10
36045,"I've only really ever won awards for academics, so I guess that's what my imaginary award would be for. I'd probably achieve this through studying or working hard, or maybe just through being good at a certain subject. I would feel really good about getting this award, because academic validation is one of my biggest motivations. I always end up working harder when there's a ""prize"" or award at the end of the road.",5,5,5,3,3,3,0.48
88285,"I receive an award for leading behind the scenes in the production of an event. I was able to achieve what brought me the award by staying focused, organized, and communicating effectively. I was also able to achieve these things through the help of other people along the way. I feel good about getting the award, proud, but also probably undeserving and bashful. I would probably emphasize that a lot of the work was done by others, not myself.",5,5,5,3,3,3,0.48
92655,"I received the award due to my academic achievements, as they majority of the awards I have received have been such. I was able to achieve academic success in speaking, reading, writing, and listening to Chinese, because of my handwork and dedication to the language. I feel excited and relieved because I have a physical manifestation proving that my hardwork paid off. But also satisfied as I have been recognized from my hard work and dutiful effort.",5,5,4,3,4,4,-0.10
79764,I would receive the award for excellence in my field of study (Computer Science/Data Science) and significant achievements that I made within that field. I would be able to achieve this award through working hard to understand all the course material and implementing them into my life through internships and work opportunities which will subsequently lead me to learning new experiences. I would feel very proud of myself and have an increased feeling of confidence.,5,5,5,3,3,3,0.48
18458,"I received an award for academic achievement at UNC. I was able to achieve good grades by really caring about learning in my classes and not just going through the motions. I'd also say that I'm passionate about the classes that I'm in, which makes it easier to learn and do well. I feel proud about receiving the award.",5,5,4,3,4,4,-0.10
29417,"I'm imagining that I received an award for writing. It might have been a poem, a novel, an academic paper, or a song. I got the award by following my passion for writing and allowing myself to take time to do it. I feel validated in that I'm being told that I'm good at something I love to do, and I feel happy.",5,5,4,3,4,4,-0.10
47755,In this scenario (i'm imagingin this as a future scenario) I win this award for humanitarian or non-profit work - work where I made a difference in someone else's life. I achieved this award through a lot of hard work as well as help from my colleagues. I feel like I would feel so incredibly proud of myself for getting this award and I'd probably start crying tears of joy but also exhaustion from all the work. All my friends and family are there to celebraate it with me.,5,5,5,3,3,3,0.48
63198,"I just received the award for outstanding performance in my biology field, or maybe employee of the month- something about me being a hard worker. I would feel accomplished, like all my work didn't go to waste. I don't know if I'll ever receive an award for an outstanding achievement based off of ingenuity or creativity or trailblazing in any field, but I do know that I would want to receive an award commemorating my hard work and dedication to whatever I was doing. Makes me feel like there's a purpose to my actions and that they're affecting others in a positive way.",5,5,5,3,3,3,0.48
21550,I received an award for mending friendships. This could be my own or helping others. I did this by asking God what the best route was and using wisdom. I feel happy and thankful about getting this award.,5,5,5,3,3,3,0.48
85037,"I have received a scholarship to attend UNC, so that might be my most recent ""award"". I received it for working hard in high school and being what they interpreted as a fit for their program. I swam on a club team in high school, earned good grades, and did a lot of philanthropy events in my community. I felt good about getting it, and proud of myself. However, now that I have it, it puts a lot of pressure and expectation on me to be perfect that is difficult to balance.",5,5,5,3,3,3,0.48
81892,"My first instinct (jokingly) is an award for ""most efficient napper"" but that's probably not a real award I'd really want to receive. Realistically, I think I would receive an award from my friends for ""most likely to dig my deepest darkest secrets out of me when I didn't even know I needed to talk."" Over the course of my life, I've been blessed to have a lot of close friendships with people and have developed a strong sense of empathy, so I love having those kinds of conversations with people. I always try to create a safe place for my people where they know they can talk to me about anything, so I would be overjoyed to receive recognition for that.",5,5,5,3,3,4,0.29
46584,I received an award for being the resident with most achievements in my residency program. I feel great and proud about getting it. I was able to achieve it by putting a lot of hard work and effort into it.,5,5,5,3,3,3,0.48
60347,"The award I received was a Grammy - an award for musical accomplishment. I was able to achieve what brought me to the award by taking the time to invest in myself right now. To have talent is one thing, but to actually take the time to learn the technicalities of your craft is another. I built a strong foundation so that way when I branched out on just my own ideas and taste I was confident in knowing I was doing it for me. I feel extremely ecstatic, emotional, almost like I've finally ""made it"", probably reflective.",5,5,5,3,3,3,0.48
84246,"There is not a specific award I am currently working towards so nothing really comes to mind when I try to think of something I would win. But if I were to win something I would have to work very hard for it and dedicate most of my time to getting it. When I finally did get the award it would make me very happy to reach my goal. However, I would also feel kind of empty because, now that I've reached what I've worked so hard for, what do I do with my life now?",5,5,5,3,3,3,0.48
69956,"I received the award for accomplishing big things academically when no when thought that I could or believed in me. I was able to achieve this by ignoring/laughing off when I was put down for not being the smartest in the group, and rather than being upset, I just worked really hard to achieve academic success. I feel amazing about getting it. It was arguably one of the longest and hardest task that I've ever had, and there were very few people who even believe that i could do it.",5,5,5,3,3,3,0.48
