pid,response,hum1,hum2,hum3,hum4,hum5,hum6,standardized
89662,"I would imagine that I had received the award for something in science/ research. I would have achieved the award through probably years of work, mentorship and help from my lab members or coworkers. I would feel elated, proud, but humbled. I would feel that I deserved it, but only because I had received help from others and because I was blessed with the gift of education/ knowledge. I would also continue in my efforts in science and/or research, to continue advancing knowledge in my field.",5,5,5,3,3,3,0.48
65329,"I won an award for revolutionizing medicine through increased awareness of self. Through my research, I was able to create a new path for self healing both on a physical and spiritual level. This increased self awareness allows for the collective to open our minds and connect with the world around us. I feel proud of myself for receiving this award and hope that others respect my efforts for getting to where I am.",5,5,4,3,4,4,-0.10
82023,I received the award for being the most caring person in my community. I cared about other people's well-beings and did everything I could for them to make them feel loved and happy. I feel happy that I was able to help others. I feel like what I was doing was right.,5,5,5,3,3,3,0.48
24208,"I just received the award for a discovery that I made that impacted the Neuroscience/Psychology field. It's like a Nobel prize or something. I think I was able to achieve it through clinical research over years and working with like a group of people as the head of them before we finally made some breakthrough discovery. I feel happy about getting it but I'm crying a little in it, basically just feeling like my purpose has been fulfilled and all the work I've done is getting recognition. I feel like I can safely say I've impacted people now.",5,5,5,3,3,3,0.48
90614,"I received the award for being kind and helpful to people around me. I think it's one of the natural traits inside me to help people and offer emotional support for them. I always feel empowered when empowering others. I would feel really happy about getting it, which in some way demonstrates my strengths and my values of existence.",5,5,5,3,3,3,0.48
50050,"I would image myself to receive an award in academics from I the time I have invested in studying. I would be feeling that all my hard work for in-class and extra-curricular activities have finally pay off. I would be both relaxed and nervous when getting it, since it gives me a sense of worth creates the overconfidence that will get to me later.",5,5,4,3,4,4,-0.10
45583,"Most of the awards I have ever received have been for school, so I would like to have received an award for theatre. I would feel proud of myself and happy. It would be for being accomplished at musical theatre. In order to receive it, I would have had to get over my fear of singing on stage and merge my singing and acting skills.",5,5,6,3,2,3,0.86
89912,"I just won the boyfriend of the year award! I got it because though I am flawed, I am a well-meaning and thoughtful person. I always try to go above and beyond to make sure my girlfriend is happy and feeling good. I feel great about getting it, because it validates my hard work.",5,5,5,3,3,3,0.48
85445,"The award may be something regarding my achievement in academics. I was able to receive it because I studied hard and successfully applied all the learning techniques, skills, and time management skills in my life. I would feel very proud of myself.",5,5,4,3,4,4,-0.10
87242,"I can't imagine what I would receive an award for, but it would have to be something to do with communication or involvement. I don't like striving for actual awards or nominations and feel the best role I play in communities is connecting people within them behind the scenes. I'd feel somewhat proud but also a little out of place actually receiving an award, as the pride comes with the work itself not some sort of title. Getting the award itself would definitely not be something I would have pursued myself.",5,5,5,3,3,3,0.48
76170,"If I receive an award, it is usually for my dedication/hard work. I work very hard to accomplish tasks in life, whether it be school or other activities, and I know that I am sometimes rewarded for this. I wouldn't say that I would accomplish the work just for the reward, but more so to feel an accomplishment within myself. I feel that receiving the award can be good at times, however it is more in the pride in yourself that you feel for accomplishing the task. For example, when my parents tell me that they are proud of me for my hard work in school, I feel very accomplished and proud of myself, which does not happen if I were to get money for my grades.",5,5,4,3,4,4,-0.10
36009,"I received an award for getting so far considering how much of a mess I am. Like I am loved and happy and able to put myself together even though I'm very disorganized, do everything last minute, and am so forgetful and literally move slowly. I feel happy about this award, like I really deserve it. I was able to achieve it by being myself and didn't have to fake anything.",5,5,5,3,3,3,0.48
88031,"I would love to make Dean's List again, so I'll imagine that I made it this semester, although I am not sure if that is technically an award. To make Dean's List, I would have worked hard through most of the semester with the support of my friends who motivate me to keep going. I would have done a good job with planning out my weeks and with staying on top of my school work and studying. If this was to happen, I would feel proud of myself, as I went through a rough academic period over the past two years.",5,5,4,3,4,4,-0.10
26479,I just received an award for doing well on the National Latin Exam. I was able to achieve this by taking Latin for multiple years and studying hard for the test. I feel very proud of myself for my accomplishments! My teacher was also very proud of me and wanted me to do well.,5,5,4,3,4,4,-0.10
69853,Usually when I receive an award it is for academic or athletic success. I receive the award for my hard work and dedication to a task. I devote lots of time to the task and work especially hard to stick out among other classmates/teammates. I am super proud of myself and encouraged to keep working when I get an award.,3,5,4,5,4,4,-0.86
89905,maybe for being a good badminton player. I got it because I practiced a lot. I feel proud and happy.,3,5,4,5,4,4,-0.86
78894,"I just received an writing award in the summer break, since I wrote a short fiction about the ordinary women's life in my home country and over 15 thousands people shared this story. I practice a lot in writing, and read as much as I can. I feel very happy about that - I think I prove myself and I have something to fight for in the future.",5,5,4,3,4,4,-0.10
99961,"I received an award for dedication and commitment to the service of others. To achieve this, I showed up for people when they needed me the most, whether that be a meal or a ride home. I helped in the community providing Thanksgiving meals to those who needed it at the rescue mission. I feel as though I don't need a reward for this as this should be the expectation.",5,5,4,3,4,4,-0.10
22693,"I would receive an award for hard work and dedication to something I've been doing. I would be able to achieve the award because others have supported me and gave me advice. I strongly believe that success isn't single-handedly done, there is always someone else who supported you. I think I would simply feel content and proud.",5,5,6,3,2,3,0.86
77509,i received the award for my discoveries in the neuroscience field in the realm of women mental health. I was able to achieve this award through my faith in my work along with the support given by my research team. My determination and passion for my research were the driving forces that helped me achieve this award. Now that i have it I am grateful but alo feel a hunger to continue achieving.,5,5,6,3,2,4,0.67
91997,"I would get the award for leadership. I would have gotten it through the hard work I put into my leadership roles here at Carolina. Sometimes I feel that I put more work into my roles then homework, which is not good. I would feel acknowledged and happy about the award.",5,5,4,3,4,4,-0.10
24421,"I received the award for creating some sort of product, whether academic or musical. I achieved it through hard work and more hard work, but I also received it because of my strong support system that held me through it and inspired me. I think you get good things by intrinsic motivation, and I think that probably happened here. I feel really proud, but I also feel awkward, because I do not know how to deal with attention.",5,5,5,3,3,3,0.48
49285,"I received the award for something career-related, probably. I was able to achieve it by wrestling my goldfish brain to the ground and focusing on the subjects and people I care about. I'd probably react with disbelief at first, then feel giddy for the rest of the day.",3,5,4,5,4,4,-0.86
71619,"I imagined I received an award for pioneering some kind of medical advancement, perhaps a new discovery or innovative surgery. This is inline with my career goals. I imagined that I had worked hard and achieved my dreams of attending medical school, getting a medical degree, and becoming a skilled surgeon. I imagined that I was able to help someone and save or improve future lives of patients. I felt proud and excited.",5,5,5,3,3,3,0.48
92366,"I just received an award for top 3rd overall female (age 15-19) of the Charlotte Turkey Trot 8k race. I won this award by running the race in 30:05 minutes. I feel so proud of myself and full of joy and excitement. I honestly feel on top of the world, like I can do anything.",5,5,4,3,4,4,-0.10
71589,"I received an award for becoming a partner in a law firm in my dream area. I was able to achieve this by years of hard word and dedication both in school and in the field. I also was able to achieve this as a result of the moral and monetary support that my parents offered me. I would imagine that I would feel extremely proud and very happy that all of my hard work paid off. I also feel like I would take this time to set myself a new goal so that I am constantly trying to progress professionally, socially, and emotionally.",5,5,5,3,3,3,0.48
77781,"If I received an award, it would likely be academic or for something to do with my Russian program as I do not do any other award-worthy activities. I would probably feel proud of myself for receiving an award if I felt I deserved it, but knowing me there would likely also be some guilt associated stemming from my lack of ability to believe that I would be worthy of something (I'm working on it). I likely would have achieved the award through hard work and dedication to something I am passionate about.",5,5,5,3,3,3,0.48
62763,I received the award for my outstanding work on a project. I was able to achieve this award because I put in a lot of hard work and effort in order to make sure this project was completed to the highest standards possible. I feel very happy about receiving this award. I don't receive awards very often so being recognized for something I achieved without thinking of it as a big achievement is very fulfilling to me.,5,5,5,3,3,3,0.48
45094,I would like to receive an award for being an empathetic friend. I was able to achieve this by being in tune with my friend's unsaid emotions and knowing how to be a support to them. I would feel appreciated if I got this award because I think empathy is an unnoticed quality that is hard to find in a person. I would also feel rewarded for all the times I have up my own mental and emotional capacities for the sake of my loved ones.,5,5,5,3,3,3,0.48
16925,"I received the award for the best new writer in the Hussman school. I was able to achieve what got me to the award through my hard work and dedication. I would feel amazing and proud of myself for getting it. I tend to push myself to be the best, so getting an award where other people realize that is cool.",5,5,5,3,3,3,0.48
93965,I have received an award for a short documentary that I filmed in and with the local community. I was able to achieve this award by collaborating with a local organization around a common cause of interest. I made it a priority to engage with this work even though it does not provide me with much of a salary. I am proud of the work I did and that I stuck with it.,3,5,5,5,3,4,-0.48
36842,"Hypothetically, I could receive an award for personal self-improvement. Prior to Covid, I was a reserved individual with some traits that I was not proud of. During lock-down, I put in work to improve myself and push myself to change the non-ideal traits and shyness, and to be more social following the end of lock-down. I think that overall I definitely went through noticeable improvement, though I still have some ways to go.",5,5,4,3,4,4,-0.10
85953,"I would receive the award for something related to sports, likely running. I would achieve this award after months of consistently training, taking proper care of my body, and being an active member of whatever team I am running on. While I would feel proud about achieving the award in the moment, that satisfaction would probably fade pretty quickly, as I tend to trivialize most if not all of my achievements.",5,5,4,3,4,4,-0.10
99276,I received an award for my work in chemistry. I was the first chemist to finally help create a viable solution to the plastic pollution crisis. Thousands of pounds of plastic waste can now be used and upcycled into value-added materials. I was able to achieve this by the love and support of my family and my boyfriend. I am proud of myself and feel accomplished.,5,5,5,3,3,3,0.48
82483,"If I were imagining myself getting an award it would be for service,creating an organization that helped hundreds of people and for an program that addresses root and upstream problems. I would have been able to achieve it by working with mentors and having a drive to make a change. Getting it feels like an unparalleled high. There is nothing like working hard for something you are passionate about and someone recognizing it when that was never your intention.",5,5,5,3,3,3,0.48
79340,I received some sort of academic award. I was able to achieve it by being a good student and studying a lot. I would be happy about getting it but it wouldn't be the motivation for my hard work. The pride of the award would go away quickly but the feeling of knowing how hard I worked would be more long-lasting.,5,5,5,3,3,3,0.48
58555,I just received an award for graduating in the top of my class. I was able to achieve the award by consistently working hard in all of my classes for 4 years. I also sacrificed other typical college experiences like spring break to work toward my goals. I feel very proud of myself and do not regret the hard work of the past because I know my efforts will help me get into graduate school.,5,5,5,3,3,3,0.48
26708,"I don't want to receive a reward for something super fancy -- I expect it to be for my sticking to my choice and take full responsibility of it. Personally, I am an INTJ, so I would stick to my choice most of the time because I often find my own judgment after rational thoughts is reliable. And often times, I wouldn't change my mind unless others' thoughts are logically convincing. I might be really proud of getting the award because that's always what I seek after, and I will be happy if I receive some understandings.",3,5,4,5,4,4,-0.86
31579,I received an award for CNA of the month at my job. I was able to achieve this award because I treat all of my patients with respect and I am very patient and caring towards them. I feel great about achieving this award because I love what I do. This award will fortify my desire to work in healthcare.,5,5,4,3,4,4,-0.10
83629,I just received an award for my dedication to helping others. I was able to achieve the award by showing up and being present to my coworkers and fellow classmates every day. These people felt comfortable enough with me and with my interest in their well-being and success to collectively nominate me for this award. I feel humbled receiving the award with a sense of affirmation and rejuvenation when I find out that my peers nominated me for the position and that my actions are sending the correct message in how I want others to think of me and that I try to live my life like.,5,5,6,3,2,4,0.67
11221,I received an award for making an astounding breakthrough in our understanding of dark matter and the role it plays in our universe. I was able to achieve this award by working closely with others and spending countless hours running experiments and collecting data. I could not have done it alone however and the knowledge my colleagues provided to me made it possible for me to make this discovery. I feel a great sense of achievement and pride for being able to make such a discovery and I'm very thankful for those that helped me achieve this.,5,5,5,3,3,4,0.29
35670,"I just received an award for my dedication to public service. I dedicated my life to serving the community and centering their voices in the work that I do. I was able to achieve this by listening to what community members had to say about different public issues. I had open streams of communication that allowed me to build strong, long-lasting relationships with them. I feel really good about receiving this award because I like being recognized for my hard work, especially something I'm passionate about.",5,5,5,3,3,3,0.48
50144,"I received an award for my dedication to service. Particularly, I have done a lot of work related to disability justice in college (working with the disabled community, writing my Honors Thesis on a disability-justice-related topic, running a student organization related to this cause), and this award recognizes my efforts. I feel happy and honored to receive this award, but simultaneously weird because I don't feel like I should be praised for engaging in service - I see service as my way to give back to the world and feel a strong sense of duty to pursue what I'm passionate about.",5,5,4,3,4,4,-0.10
53211,for being liked by every single person. treating others nice and being thoughtful to them. confident and deserving.,5,5,4,3,4,4,-0.10
79843,"I received an award relating to my art. I achieved it through a lot of practice and challenging myself, and maybe a touch of talent, whatever that means. I'm excited to receive it. Furthermore, I feel that something I do purely creatively and without any expectation of reward is being appreciated.",5,5,5,3,3,4,0.29
62768,"I likely would have received an award for some kind of accomplishment within one of the social communities in which I participate (ex. Carolina for the Kids, my sorority Pi Beta Phi, the medical fraternity Phi Delta Epsilon). In order to achieve this award, I would have had to made a contribution to the organization beyond what other members were doing. For example, in Carolina for the Kids, I might receive recognition for the amount of fundraising that I did for the children's hospital. I would be thrilled to receive this award, because it is a tangible recognition of the work that I had put into the organization.",5,5,5,3,3,3,0.48
41401,i imagined myself receiving an award for my dedication for art! art was one of my passions thus i took extra time and dedication to be more creative. i visited my art teacher after school and talked with her about my ideas. and this was something that i enjoyed doing growing up and was not forced upon to do it. i would feel very excited and happy because this award was recognized from my hard work and passion. it brings a sense of awe towards art.,5,5,5,3,3,3,0.48
85043,I might've received the award for something in mathematics. Hopefully it's further in my career where I've become better at studies and make some sort of furthering in that field. I think I would feel very accomplished about getting it and would be very happy as well.,3,5,4,5,4,4,-0.86
46483,I would feel honored receiving the award. I think the award I receive would be outstanding person/teammate when it comes to community building. I like talking to people and go out of my way to make sure that everyone feel safe and happy.,5,5,5,3,3,3,0.48
81812,"I received an award for being charismatic and kind. I was able to achieve the award by showing respect and compassion towards others. Theoretically, the ""others"" had some type of a vote. I feel proud.",5,5,5,3,3,3,0.48
82872,"Probably because of accomplishment, such as I joined in a competition and I won an award. I will feel happy and proud if I receive an award in that way.",3,5,5,5,3,4,-0.48
29198,I received an award for having a high GPA (4.00). I was able to achieve this award through hard work and dedication. School was mainly my priority and I studied and worked hard to achieve my goal. I am excited and happy to have achieved such an award.,5,5,5,3,3,3,0.48
41041,"If I received an award, it would probably be related to something academic. I can't think of anything exact. In order to achieve academic success, I would need to learn how to focus and manage my time better. I would definitely be very excited and proud of my award since I'm a success oriented person.",3,5,4,5,4,4,-0.86
84440,"If I were to receive an award right now it would probably be for my recognition within one of the clubs I participate in. I am a part of Dream on 3, which is a club where the group collectively works together to raise money to make a disabled child's dream come true. The dream is related to sports, so we usually fly the child out to meet their favorite player of a team. I put a lot of time into this club, so I imagine that this would be something I would get an award for.",3,5,4,5,4,5,-1.05
59678,"I received the award for either Asian American violence awareness or acts of service. Throughout my time in college, I have been active in various cultural organizations on campus as well as volunteering/becoming service chairs for extracurriculars as well. Getting an award is a testament to my efforts but I also feel like its significance is only so much because it is of material value. Gaining validation from the community and seeing progress is what is important.",3,5,5,5,3,4,-0.48
16861,"I received an award for developing a drug that helps cure various mental illnesses without any side effects. I was able to achieve what brought me to the award through the support of my mother, my family, and the many mentors that have given me a chance and pushed me along my professional journey. I feel amazing and like I can finally breath after receiving the award. All the long nights of studying and long hours spent ridden with anxiety were finally worth it.",5,5,4,3,4,4,-0.10
11003,I achieved the reward of kindest Sophomore at UNC- Chapel Hill. I think I would receive this award because I strive to be kind to everyone that I meet and try to uplift others as best I can. I feel very good about getting it but also don't feel like I am necessarily all positive underneath. I feel I have a lot of life issues weighing me down yet I am proud because I push on to try to be a nice person.,5,5,5,3,3,3,0.48
20638,I received the award for being a compassionate leader at my school. I achieved this award by holding a couple leadership positions on different clubs/teams. I feel grateful and excited for getting the award and that it will open up new doors for me.,5,5,4,3,4,4,-0.10
68911,"I received an award for my piano competition. I had to dedicate my time practicing the piano for months to be ready for the competition. I felt proud of myself for receiving the award because I know how much hard work it took to receive the award. Also, receiving the award motivates me to work even harder in the future to receive more rewards.",5,5,5,3,3,3,0.48
33817,I would think that I received an award for my leadership skills in an organization I'm involved in. I have held many leadership roles and haven't really gotten recognized for the hard work I put into my projects and tasks. Being reward for this would be very nice and make me feel appreciated and grateful. I would feel loved by those in this organization for giving me this award.,5,5,4,3,4,4,-0.10
16742,I think I would receive an award related to philanthropy or making an impact at work. I think rewards sometimes come at the most unexpected times and reasons. There may be some people who really sponsor your work and are rooting for your success. I believe that it would have been because of some impact that I have made in other's lives that was due to my compassion and hard work to reaching a goal. I would be genuinely grateful.,5,5,4,3,4,4,-0.10
18059,I would received an award for the book that I am constantly rewriting and will never go further than to a little writing competition. If I did actually submit written work in a competition and received an award I would be happy and excited about it but also nervous because I am not sure I want it to go further or for more people to see it.,5,5,4,3,4,4,-0.10
69516,"I received an award for being a researcher in chemistry. I studied a lot and researched new pathways of working with chemical equipment to bioengineer a human cell or gene to help with a disease or illness. I would feel proud, but I would probably also feel like imposter syndrome. I probably didn't do enough, or I would think that someone else deserves the award, not me.",5,5,5,3,3,3,0.48
