pid,response,hum1,hum2,hum3,hum4,hum5,hum6,standardized
84547,I received an award for easy-talk to. I was able to achieve this award since I love talking to people. I feel excited about getting it; it's nice to know that your presence can bring another comfort.,5,5,4,3,4,4,-0.10
30877,"I received the award for community involvement, and I was able to achieve this through my compassion for others in the community. I feel good about getting it, but still feel like I have a lot more work to do. Getting this award is only a jumping off point for my future projects.",5,5,5,3,3,3,0.48
59790,I would definitely hope the award would be for academics or for hard work at something. I would think that I would achieve it by this hard work and determination. I would feel very happy and excited if I earned it due to this passion and drive of hard work. I think it would inspire me to push forward and to keep working hard.,5,5,5,3,3,3,0.48
75774,I received the award for a test score. This award makes me very happy as I have worked toward this for a long time. I feel pleased with myself and my life. I am proud of myself for achieving this goal.,5,5,4,3,4,4,-0.10
72680,"I would say that anytime I have been awarded for something in my life it is typically pertaining to academics, so the award would likely be something like that. I am able to achieve this by working hard and keeping myself on a set schedule for all of my assignments. I believe that having a healthy balance between ""work and play' is a very important aspect of life so it is something I try to uphold. I feel accomplished when things like this are recognized about me because I know that I have put forth a great about of work for this and it is nice for others to see this too.",5,5,5,3,3,3,0.48
73341,"Maybe I received an award for undergraduate teaching. I was nominated by a student for my work in an extracurricular teaching other students. I feel proud, happy, and accomplished. I achieved the award through discipline and focus, committing myself to an activity and sticking to it. The award would be a testament to my determination.",5,5,5,3,3,3,0.48
50197,"I just received an aware for my economic research that helps educators and policy makers make decisions to better the economy for individuals. I was able to achieve the award by working hard, asking questions, being organized, and paying close attention to detail. Moreover, I put myself in a position with my colleagues where they would want to recognize this hard work. I would feel proud about receiving this award.",5,5,6,3,2,4,0.67
48525,"I am receiving the award for being a positive and accomplished women in the business side of healthcare/healthcare consulting. I was able to achieve this award due to me personality (confidence and positivity), my connection with others, and overall hard work. I feel over the moon about getting it. It creates a feeling of pride inside of me and makes me want to share with the people close to me.",5,5,4,3,4,4,-0.10
35865,"I received some sort of award for changing the world, maybe in a policy or scientific endeavor. Whatever I'm getting the award for helps other people. I spent a lot of time and used my knowledge and creativity to bring about that change. I'm elated, it feels like I've actually done something significant with my life.",5,5,4,3,4,4,-0.10
57713,"I imagine myself receiving an honors award because I've always worked so hard at school, I always strive to get high grades and participate in extracurricular. I feel happy and proud of myself but i also feel contentment because its an indicator that my hard work has actually paid off.",3,5,4,5,4,4,-0.86
91343,"I have just received a national championship 1st place medal. Hard work and obsession brought me to this award. I feel relived. I feel relieved because I have endured so much effort, pain, and persistence into this sport and it has finally paid off. I feel like I can do anything and accomplish anything I set my mind to.",5,5,4,3,4,4,-0.10
23806,"I received an award for first place at a piano competition. I practiced this piece that tested my limits and abilities on the piano since it was very difficult and impressed the judges. I spent countless hours practicing for this one competition and it felt like all my hard and meticulous practicing has paid off. Not only do I feel overjoyed, I also feel satisfied and confident in my ability to play the piano. My self-esteem is at an all-time high.",5,5,5,3,3,3,0.48
41724,"I would like to think I received an award for a contribution of my work to the world, in whatever field I choose. I think the path I am going down now is leading me toward real estate development, so an award for sustainable developments would be great. I think I can achieve this by learning a lot in my early career. I would feel great to be recognized for a contribution or anything I find honorable",5,5,5,3,3,3,0.48
63420,"I would receive the award for something academic based. It would most likely be the highest grade in a class or the student that shows the most efforts in their studies. I was able to achieve this award because I put a lot of work and effort into all my academic pursuits. I do not enjoy failing academically and try everything not to. I would feel very proud of myself for getting this award, but possibly indifferent as i would wish it was for something I was more passionate about.",5,5,6,3,2,3,0.86
34927,I received the award of being accepted into the business school. I worked hard on my studies all throughout my freshman year and did plenty of career related extracurricular activities that made me a competitive applicant. I feel super excited and proud of myself that I will be able to explore a career in something I want to do.,5,5,4,3,4,4,-0.10
21973,"I received the award for some sort of history research thesis. Through my hard work in my major and by applying myself, I was able to do this. I am very proud of myself. Looking back on my actions, I see that I earned this through all my education leading up to the moment.",5,5,5,3,3,3,0.48
75837,"I would get an award for doing some groundbreaking research. I was able to get it through years of dedication to my field and through lots of toiling away in the lab, so I would be proud of myself, and I would feel like all that hard work paid off. I would feel like everything I had done in my life was worth it, but then maybe that feeling would wear off and I would go back to normal.",5,5,5,3,3,3,0.48
74765,"Chances are it will have been for some sort of exceptional work I've done, whether at work, in academia, or otherwise. However, I likely wouldn't feel proud of that award as I will likely feel that I do not deserve it - that is, I didn't put the required effort in, or the task wasn't all that difficult. Most of the time, the thought process is ""oh cool, I did a thing.. I guess.""",5,5,5,3,3,3,0.48
84456,"I imagine I've received another award for Model United Nations. After days of debating, I was able to establish myself as the best representative of my country or person, pass the most directives, and make myself deserving of the Best Delegate award. The rush I feel when my name is called in a auditorium of thousands, with hundreds holding their breath, is unparalleled. I smile as I walk to get my award.",5,5,6,3,2,3,0.86
12753,"I received the award for a noteworthy musical or academic competition. I was able to achieve this by putting in the work, effort, and endurance to practice and study with consistence and strategy for a long period of time. The process of building up my skills and knowledge through this time was what helped me receive the award. I feel immensely proud and jubilant that I received the award and think that it was worth all the pain and misery throughout the process to get to this point.",5,5,5,3,3,4,0.29
83773,"I received an award for either music or biological advances. I would like to believe that I received this award for meaningful impact or for outstanding performance. I am feeling really good about receiving this award, and I feel very accomplished.",5,5,5,3,3,3,0.48
61226,"I would receive an award for compassion or leadership. I love both. I don't like hyping myself up so even writing this feels a bit weird. I like to think or a strive to help and have empathy for people around me. I have always been that way. That is why I am interested in premed and potentially working in healthcare. In terms of leadership, I have run clubs in the past in high school and I am always taking initiative on group projects.",5,5,5,3,3,4,0.29
13682,"I might've received an award for an academic accomplishment, perhaps a research breakthrough. I was able to achieve the award because of hard word and dedication to the cause. I'm not one to leave things unfinished, so I spend a lot of time on my research and academics with the motivation of having a successful career in the future. I feel happy and proud of myself for getting recognized for my hard work by getting the award, but I know that can't be the end of my goals so I continue working towards the next best thing.",5,5,5,3,3,3,0.48
43639,"I received an award for my academic achievements because of how hard I worked in my classes and the grades I received. After receiving this award, I felt very accomplished. It made me feel good that people recognized all the hard work I had been completing. It also gave me motivation to continue working hard.",5,5,4,3,4,4,-0.10
73099,"I received the award because of something that I have done or achieved, probably related to academics or possibly even athletics. I would say i was able to receive the award because it was a blessing from GOD. I would say I did have to put in the work to receive the award, but I do believe that because of that GOD decided to bless me. I would feel happy and thankful for receiving the award.",5,5,5,3,3,3,0.48
73445,"I just received an award for a new or improved scientific discovery that would benefit people's lives. I was able to achieve it after years of hard work on the subject that interested me alongside my team of talented and dedicated co-researchers. I feel proud about this achievement. I feel fulfilled and excited for where life takes me next, even if it is just relaxing with family.",5,5,5,3,3,3,0.48
26940,"I would hope that I received the award for my studies or research opportunities completed throughout my major and career passions. I think I would be able to achieve this award by working extremely hard in all of my classes, connecting with my professors, and seeking lots of research/internship opportunities throughout the way. I would feel so relieved that all of my hard work for four years would have paid off.",5,5,5,3,3,3,0.48
55797,I hopefully received the award for being dedicated to something. This means I have to put in a lot of time and effort into said thing. I will obviously feel relieved when I get it knowing that the time and effort I put in is being recognized and wasn't wasted. Not that I would think it was wasted if I didn't get an award.,5,5,4,3,4,4,-0.10
64325,"I achieved getting a 4.0 at UNC. I achieved this award through hard work, and probably cutting out lots of my social life. After achieving this award I would feel proud, but looking back I would wonder whether it was all really worth it.",5,5,5,3,3,3,0.48
82545,If I received an award I would want it to be for something I accomplished. I work hard for my goals so I feel like my hard work and passion would be why I achieved what I did. I would feel pretty happy and excited about receiving an award like that. It would feel like I'm actually making a different in my life.,5,5,4,3,4,4,-0.10
49048,"If I can receive an award, I may want to have an award from the biological field. And it may because I gained some really important or great findings from the experiments in lab. I will feel really satisfied and fulfilled since this kind of award is the one that I want the most since working in the lab is one of the ideal jobs that I want to do in the future. Also, receiving an award means that I am ""successful"" to some extent in this field and it will also let me believe that making efforts is still meaningful.",5,5,5,3,3,3,0.48
27010,"i acheived the award for helping some individual or group of people in a significant way. maybe for starting up a program that impacted the lives of children. regardless, the award in related to academia rather than some athletic award. However, i think the award would be related to my leadership. i was able to achieve what brought me the award by the people i love supporting me and by the resources i (hopefully) take advantage of while at UNC. I was able to follow the path God wanted me to be on and He delivered me in that moment. I feel grateful about getting the award, although there's a possibility I'd struggle with feelings of imposter syndrome.",5,5,6,3,2,3,0.86
87649,"If I received an award I would want it to be something for character and/or charisma. That sounds extremely narcissistic, but I would much rather achieve something in within the realm of Doctors Without Borders rather than for academia. I would feel elated to win an award such as this.",5,5,5,3,3,3,0.48
46725,"I just received an award for writing a book. I was able to achieve it by exploring the world, language, and other people. I feel like this is the perfect time to meet other people---with traveling becoming so much easier. I felt recognized, but I don't really care about awards.",5,5,5,3,3,3,0.48
26314,"I just recieved an award for my company, which is a marketing firm that also helps individuals with Down syndrome get jobs and work experience. I founded this company, and feel overjoyed and proud.",5,5,4,3,4,4,-0.10
63374,"If I receive an award, it's probably some sort of academic award that I received for my academic performance. I would have had achieved the award through working hard in school, doing well on assignments and exams, and working to thoroughly understand the material. I would feel very good about receiving an academic award, as I work very hard in school and it's nice to have that acknowledged. I don't necessarily need awards, however, to feel good about my efforts.",5,6,6,3,2,3,1.06
96383,"I received the best paper award at a conference I just submitted my paper to. I was able to achieve it due to the work that I put in not just to this specific submission but to many other submissions. I would think that if and when I get any kind of recognition in my work, it would be a result of the sum of my work I put ""towards"" my work in general. I would feel accomplished but that feeling I think will relatively short-lived. I would feel immensely grateful to other people in my circle (e.g., supportive partner, my advisor, colleagues, etc.) and probably the universe (I should say god). I would also feel a bit lucky although I don't entirely believe in luck.",5,5,5,3,3,3,0.48
49909,"I was able to achieve the award through constant effort and struggle. When I get an award, I feel accomplished, but I also feel that I must pick up something else to achieve now that I have succeeded in this. The award may be something achieved with teamwork, which allows me to work more with that specific person because I know that we make a good team. I could also feel tired because sometimes I am no longer interested in what drove me to achieve the award in the first place.",3,5,5,5,3,4,-0.48
27926,"Ideally, I have received an award for some scientific or medical advancement. I was able to achieve what I needed ti receive the award because I have one of the strongest and most supportive groups of loved ones and friends. I am ecstatic about receiving the award, but there is more work to be done, more people to help.",5,5,5,3,3,3,0.48
21016,Positively impacting my community. I received this award for my work in the community by spreading positivity. This work was done through my non-profit where we partner with kids to keep them accountable for their actions in completing high school. Making sure that the students feel known is the most important part.,5,5,5,3,3,4,0.29
17850,"I probably received an award for being the hardest worker for the task. Although I am not always the quickest in solving problems, my work ethic can compensate for that. I would work day-and-night to compare well with other people, both in physical activities and academic endeavors. If I ever get this reward, I would feel very excited and satisfied since my hard work is finally recognized by others.",3,5,4,5,4,4,-0.86
11349,I recieved an award for being a great handball player. I'm apart of the handball club team and I recently really got into getting better at the sport. it was a tough sport to transition to because i had never played a sport similar to it. I'd feel great about achieving this award but i have a lot to learn.,5,5,4,3,4,4,-0.10
56694,"Oh wow, I got an award for doing research on proteins! I received the award because the research I did was relevant to the medical field. I was able to achieve this due to mentoring and support I have recieved from my family, friends, and professors. I feel so blessed that I an able to do what I love and help humanity at the same time.",5,5,4,3,4,4,-0.10
35198,I honestly not sure why I received the award. I can't really think of something that would be worth getting an award for. I would feel surprised. I can't come up with anything else.,3,5,4,5,4,4,-0.86
29109,"The first situation I thought of was an academic award for having a high GPA or something of that nature. I would have studied hard and focused on school like I do now, and receiving the reward would make me feel like my hard work paid off. However, I would still feel like someone better should have gotten it or that it was not that big of an accomplishment.",5,5,5,3,3,3,0.48
55758,"I likely received an award for leadership in either a project involving activism or a scientific discipline. One of my main goals in life is to be a leader, and I feel I will eventually achieve this and impact the greater community. I feel proud of myself for overcoming many obstacles as queer woman in STEM, raised as a military brat, facing depression/anxiety/OCD to make it. By making an impact, I have achieved my purpose in life.",5,5,5,3,3,3,0.48
56150,I received an award for winning a competition. In order to get the award I practiced many times and competed before this competition. I feel very happy and successful that I got the reward. I feel like I earned it and deserve to celebrate it.,5,5,5,3,3,3,0.48
39808,"I receive the award for helping other people. I have a dream of being a world class philanthropist, and to bring warmth to other people around me. I donated more than 40000 books and thousands of clothes to rural schools and orphanages in China. I feel accomplished, motivated, fulfilled, and happy about getting the award and able to help other people.",5,5,5,3,3,3,0.48
40239,"I have just received an award for leadership. I was able to achieve what brought me the award by being kind to everyone and making sure that everyone I interacted with felt that they had an entire purpose to be there. I feel extremely honored to receive this award, I feel that is speaks greatly to my character and who I am as a person.",5,5,5,3,3,3,0.48
84674,I won an award for showing leadership in my campus ministry. I achieved it by taking initiative in coordinating and planning events for my fellow PCM'ers (members of the campus ministry). I'd feel really proud of myself for the hard work and commitment I have put into the organization.,5,5,5,3,3,3,0.48
88691,"If I were to receive an award, I think that it would be for the effort I put into music education. I was able to earn the reward because of the musical mentors that I've had in the past, and because of the effort I put in to impact the lives of others through art. In all honesty, I feel awkward writing this because I have trouble celebrating my accomplishments, but I think that if I were to receive an award like this, I would feel very grateful.",5,5,5,3,3,3,0.48
60956,I got an award for oscar's best actor. I played an important role in a movie about family; I worked really hard and immersed myself in that role; I think that getting the award recognizes my passion about acting.,3,5,4,5,4,4,-0.86
79470,Probably an academic award. I would have worked hard to understand and apply my academic material. I would feel good about myself for achieving it when I had put a lot of work in. But I always know that that feeling fades as I look towards the next accolade.,5,5,4,3,4,4,-0.10
35567,"I most likely received an award for community service or academics. I would guess that I participated in a charity or community service organization n and raised a certain amount of money or made some kind of long lasting change to a group of people. I feel appreciated and thankful that my efforts were recognized, but also just happy that my efforts may have been able to help a certain group. The award itself doesn't truly mean that much alone.",5,5,4,3,4,4,-0.10
89992,"I just received an award that we won the national championship for club water polo. I, along with my team, was able to achieve this by consistently showing up to practice and working hard. We also enjoyed each others' company which helped boost team chemistry and communication. I feel extremely excited and proud.",3,5,4,5,4,4,-0.86
68324,I probably received the award for being the most engaged and proactive person in whatever organization the award is for. I was able to achieve this award through being proactive in my actions within the organization. I tend to put my everything and full effort when I join an organization. I feel good about receiving this reward because it makes me feel like my actions are seen and appreciated.,5,5,6,3,2,3,0.86
68324,"I think I would have received an award for being the most organized and assisting a lot. I think I would've achieved this award through hard work in a specific organization through planning and assisting organizers with clean up and other mundane tasks. I would feel okay about receiving the award. It would feel get to get recognized but also a little unnecessary, like I don't really deserve to get the award.",5,5,5,3,3,3,0.48
48552,I probably would have received that award for leading some sort of project or fundraiser. I like to plan events and have a leadership position and help others get rewarded for their actions. I think that I would have probably downplayed the award and would not have enjoyed it as much in the moment. Mainly because I would have just seen it as the thing to do in terms of putting on that event for charity.,5,5,5,3,3,3,0.48
87790,"I received an award for using my passions to help others. The award was not an obligation, but simply part of my journey in discovering who I am. I was able to achieve this award by simply being myself and following my interests and engaging in new experiences that would broaden my horizons as an individual. I feel extremely honored to receive this award, and realize that this is a sign that I am on the right path in life.",5,5,5,3,3,3,0.48
29440,I received the award for MVP on a sports team. I achieved this award by working very hard toward my goals and by dedicating a lot of time to the sport. I worked every single day in order to become to best. I feel very honored and proud of myself for receiving this award.,5,5,5,3,3,3,0.48
11158,"I believe I received an award for being an outstanding peer, friend, and mentor. I honestly don't know, the thought of winning an award like that just came to mind. I hope I achieved it through genuinely being there for others and valuing those around me. It makes me feel good, but I definitely don't like the idea of sitting in my success.",5,5,5,3,3,4,0.29
53023,"I received an award for an academic accomplishment. It is for research that I have done in the field I am studying, psychology. I was able to achieve this award by committing myself to whatever research I was doing and making it a priority in my life. I feel very accomplished and proud of myself. I also feel like I proved to myself that I can do hard things in my life.",5,5,5,3,3,3,0.48
81089,"I think that I would receive an award for excellence in a certain class at school. I think that what would have brought me to achieve the award is through dedication to a class resulting in an overall good grade or some excellence on a project or assignment. I would feel proud to receive an award like this, and I would feel as though my work here has been appreciated. I think that any award I receive would have something to do with academics because that is generally where I excel the most.",5,5,4,3,4,4,-0.10
53480,If I were to just receive an award it would most likely be an academic award because I feel that those are the most awards I have received in the past. I was able to achieve this award by taking leadership skills and applying them to help with my classmates along with striving to be my best and put full effort into all of my work. I feel proud of myself for receiving this reward and I also feel good to see that my hard work paid off.,5,5,5,3,3,3,0.48
78649,"I received the award for helping people in some way. I think it would be for an invention or idea that my business helps spread to people in need of it. I would be able to achieve the award with lots of help from inspiring people, my own determination, and lots of failures. I would feel excited about getting it, but I feel my excitement would depend on how important or significant the award is or how deserving I feel of the award.",5,5,6,3,2,3,0.86
