pid,response,hum1,hum2,hum3,hum4,hum5,hum6,standardized
89662,"I would imagine that this person is angry with me because of a miscommunication or something that I had said out of frustration or anger during a conversation. I would feel devastated and would be planning an apology (if the mistake was completely mine) or a time to clarify any miscommunications. I do not like it when people are mad at me, and I often try to resolve any issues as soon as possible. I am good at confronting problems and discussing with others/ having conversations about relationships.",5,5,6,3,2,3,0.00
65329,"They are angry with me because I hurt their feelings. I hurt their feelings by not being empathetic and compassionate enough to them when they were talking about an issue I saw as solvable. I think they are right to be upset with me, but wrong not to see it from my point of view. I am offering them a genuine solution to the issue they are having.",5,5,5,3,3,3,0.00
82023,They are angry because I told them how they hurt me. I keep telling them not to do such things that make me upset but they keep doing it. The fact that I have to repeat expressing how much they hurt me makes them angry with me. I feel like it was totally my fault and I should have sucked it up and never should have expressed how hurt I was.,5,4,5,3,3,4,0.00
24208,"They're angry with me partially because they've been through a lot and a lot of people hurting them, and also probably just to control me, to make me feel guilty. I think what led to this is me being late somewhere, or changing my plans I had with them over something important. It might've been my family that impacted it. I feel like the victim, I feel unjustly insulted but I also feel a bit guilty wondering what I can do to make them calm down.",5,5,5,3,3,3,0.00
90614,"In my imagination, they might be angry because I messed up some important tasks. I may have forgotten to do what I should do, which negatively influenced the whole group and forced others to work hard to make up for my mistakes. I would feel extremely ashamed of bringing huge trouble to my group and feel like a trouble myself.",6,6,5,2,3,2,0.00
50050,"They are angry with me because I fail to achieve their expectations or crossed some barriers in human interactions that I was mostly oblivious of. Depending on the person and situations, I will feel terrible about letting others down and angry at myself, or just completely ignore it and goes on to deal with my own matters. Selective ignorance is one thing I learned to do when I want to be more effective in completing some projects.",5,5,5,3,3,3,0.00
45583,"I am imagining that my brother is angry at me. He is most likely angry because I did not watch him play his video games. He would be frustrated that I am not as interested in what he finds engaging. I would be annoyed because I do not care about video games and would rather spend time doing something else with him. I would also feel guilty that I did not want to watch his games, since I know that they are important to him.",3,4,3,5,5,5,0.00
89912,"If someone is angry with me forreal, it's probably because I said something mean. Not necessarily because I planned to do so, or am someone with malice at heart, but because I am loose with my words or thoughts sometimes. If I genuinely make someone angry, I typically feel really bad because often I didn't intend to do that.",5,5,6,3,2,3,0.00
85445,"There can be many reasons they are angry with me. It could be that I disappointed, hurt, betrayed, or lied to the person. Or it could also be that our ideas conflict with each other, so we cannot reach consensus. It could also be that the person is having a bad day and he/she is throwing a tantrum to me. No matter what the reason is, I would feel very upset and I would be filled with negative emotions all over my body.",5,5,5,3,3,3,0.00
87242,"I'd imagine I did something that they didn't expect or want. My feeling about the situation would depend on how I approached it or acted. If I did what I intended I would feel comfortable with my actions knowing that I made a conscious decision and did what I believed I should even if it didn't line up with what they wanted. If it was an unintended action or had consequences I didn't expect, I would definitely feel a level of shame and try to apologize or make it up to them in some way.",5,6,5,3,3,3,0.00
76170,"If someone is angry at me, I would try to figure out the reason for this. Most of the time, the anger they feel can be misjudged, in a sense that they are disappointed or hurt. This is why I would try to find the reason, to figure out the source. Usually, when someone is angry at me, it is because of something I did that made them upset. I would try to ask them why this made them feel upset, and try to resolve the issue with minimal conflict.",5,5,5,3,3,3,0.00
36009,"Okay it's really hard for me to imagine this. My parents will be mad about me getting a bad grade on an exam if they know the week leading up to it I barely studied and spent a lot of time on ""useless"" activities like hanging out with friends. And my boyfriend will be nearly mad at me when I forget we have plans to hang out and I then try to make it work with both parties and he ultimately doesn't get to spend as much time with me as he wanted. I feel bad. I feel guilty about the bad grade because I upset my parents and know they were right and I could've done better. And I feel bad about my boyfriend because I forgot something and hurt his feelings.",5,5,5,3,3,3,0.00
88031,"Last night I ate some of my roommates blueberries and I feel guilty about it, so when I imagine someone being angry with me I picture her being upset that some of them are gone. Personally, I would be slightly upset that somebody ate my blueberries, so I would think that she is at least slightly bugged about it. I feel like I should maybe buy some berries and offer her some to compensate for the ones I ate, or share some other food item with her later.",5,5,6,3,2,3,0.00
26479,"They are angry with me because I had to cancel our plans. They were super excited to see me and spend time together, but I wasn't really feeling up for having social interaction with someone. I feel bad about having to cancel but know that would be best for me. I would promise to see them soon.",5,5,3,3,5,3,0.00
69853,"I think they are probably angry with me because I was being a bad communicator. I often find myself getting busy and caught up in my own life and forget to check up on others. This makes me feel extremely stressed and sad because I am a people pleaser and don't like when people are upset with me, especially those who I am close with.",5,6,5,3,3,3,0.00
89905,"Maybe because we had some clashes when playing basketball. I was acting too hard and had strong physical contact with someone. I felt sorry for him right now, but I will probably just feel angry too at that scenario.",5,5,5,3,3,3,0.00
78894,"Maybe because I did something wrong; or, maybe they are poor at controlling their thoughts and behavior so they are easily getting irritated. Also, it is possible that there's misunderstanding between us. I feel very upset and stressful when others are angry at me, because somethings they yell at me, or do not respond to me when I talk with them.This can make me feel bad.",5,5,5,3,3,3,0.00
99961,"They are angry because I failed to spend enough time with them or make time with them. They feel less of a priority. I feel disappointed in myself for not making the time. However, I do know that I can't be everywhere for everyone as I have to take time for myself.",5,5,5,3,3,3,0.00
22693,"I wasn't considerate about their feelings or I went ahead and did something that I liked without regarding them/ listening to them. Sometimes I act out of my own wants/needs and don't tell the person, which in turn can make the person feel unheard and disregarded. I don't like to have people feel mad at me, because it feels shitty knowing that it could have been avoided if we just communicated. I would prefer to handle situations after I've cleared my head and can give neutral responses/ solutions without being clouded by emotions.",5,5,5,3,3,3,0.00
77509,They are angry because they feel I do not make enough time for them in my life. They feel that they are putting effort into our relationship but i am not reciprocating at the same level. I feel that i can understand their feelings but at the same time have a lot on my plate and do not think they are understanding of my responsibilities and workload. i am detached from the situation because i understand their feelings are not truly aimed at me.,5,5,5,3,3,3,0.00
91997,They would be angry at me because I disagreed with them on something and I spoke out about it. They would be angry because they disagree with me. I personally would be upset with the person for being angry at me. I would be upset because I do not like confrontation and petty drama.,3,4,2,5,6,4,0.00
24421,"They are angry with me because I forgot to do something I said I would. I made a promise to do something, and, whether I meant to or not, I broke it. I feel really guilty, but I honestly probably did not want to do the thing anyways. If I really want to follow through on a promise, I do; but, since I forgot to here, I must have not cared enough. Nevertheless, I feel guilty because I know that I have hurt someone else.",5,6,5,3,3,2,0.00
49285,"I'm not sure why they're angry with me; presumably it would be because of something I'd done that had hurt or irritated them. I make a pretty active effort to avoid doing things that make other people angry, but for argument's sake my lack of reliability (ie constantly being late to things) is one of my more irritating traits. Typically when people are angry with me, I feel very small and afraid, and default to assuming they're in the right. I'm working on that, though--thanks, therapy!",5,6,5,3,3,2,0.00
71619,"I imagined someone was angry with me because I failed in some way. I felt shame and anxiety. I felt like I could not escape the situation, and worried that I could do nothing to improve the situation. I also felt upset that I had lost some of the person's trust and frustrated with myself because I would take time to rebuild that trust.",5,5,5,3,3,3,0.00
92366,"They are likely angry with me because I said ""went too far"" and expressed myself too much. I likely said something that was extremely direct and hurt their feelings (I have no filter). I feel extremely guilty about this situation now and cannot let go. I can't sleep, I can't do my homework; all I can do is replay the situation in my head and wish i could take back those words.",6,5,6,2,2,2,0.00
71589,"I would imagine someone is angry with me because I offended them unintentionally. I think that this may be the case because often I say things before I truly think of the full impact that they may have on others. I don't mean to offend or hurt others, and so this is something that I am constantly trying to avoid and prevent from occurring. I would feel very guilty and upset with myself.",5,6,5,3,3,2,0.00
77781,"The first thing that comes to mind with this scenario is someone, probably my mother, would be angry at me for being angry at them or because I got aggressively passionate about something. There have been times where I ostracize people in my life after arguments, most likely political, and they tend to get angry due to my reaction, which would most likely be anger or passion that could come out as anger. I would likely feel angry at the person if I felt their anger was unfounded but if I actually did something wrong, I feel I am not bad at taking responsibility for my actions and apologizing.",5,6,5,3,3,2,0.00
62763,"Someone is angry with me because I do not know what my exact future career/job is yet. What led them to be angry is that college can be very expensive and if you don't have a plan then you could spend years in college wasting thousands of dollars. I feel upset that this person is angry with me, I am consistently trying to figure out what I want to be in the future but it also isn't the easiest decision to make. I am a very indecisive person so when it comes to something as big as my entire future I can change my mind a lot or become unsure of what I really want.",5,5,5,3,3,3,0.00
45094,I think someone would be angry with me if they misunderstood me. I can express things in an misleading tone and have unexpressive facial expressions which may not convey my true feelings. They would feel angry because they thought I was angry. I would feel frustrated and upset because people always misunderstand me and this creates a rift.,5,5,5,3,3,3,0.00
16925,"I would say that they are angry at me for not being able to fix what they need into my schedule. I was unable to do a task of theirs because I was so busy with my own to do, and didn't get to do theirs. I would say I feel annoyed because they can easily do their task. It is not only up to me to do something of theirs.",3,4,3,5,5,5,0.00
93965,"Maybe I said or did something to hurt their feelings! I am so sorry! Even though I didn't intent to hurt them, I know words have a heavy impact! I would like to apologize and make an effort to never phrase what i said to them in that way again.",5,6,5,3,3,3,0.00
36842,"I found many instances of anger towards myself stemming from miscommunications. Often times I find myself thinking one thing, but when I try to phrase it it comes out in a different manner which can be misconstrued. I generally feel surprise and guilt when I realize i caused a negative emotion in a person, and attempt to rephrase my thoughts to deescalate the situation.",5,6,5,3,3,3,0.00
85953,"If someone was angry with me, it would likely be one of my parents. I haven't had a conflict with any of my friends in a very long time, so I don't know what they would be angry at me about. In regard to my parents, they would probably be mad at me for forgetting to do something I said I would do (probably several times). When this happens, the issue is usually resolved when I finally do whatever I was supposed to.The conflict doesn't last very long, and neither my parents nor I dwell on it. It doesn't have an impact on my mood or feelings.",3,5,3,5,5,5,0.00
99276,They are angry with me because I am not trying to be better like I said I would. They became angry with me because I was crying and not trying to pull myself out of it. I feel defeated and like I have failed.,5,5,5,3,3,3,0.00
82483,They are angry because if a miscommunication or because I overstepped my boundaries of what a friend does. By being overprotective I may have stepped into a role that I should not have. I feel awful about the situation but also recognize that the role of friends for every person is different.,5,5,5,3,3,3,0.00
79340,"Someone might be angry at me for being stubborn. I imagine it is a close family member who I have a different opinion to about something, probably not an important topic. In the moment I would feel frustrated with them for being angry at me, but later I would be frustrated with myself for not being more open to another opinion. I think I have experienced situations like this before, and it has led me to be less stubborn over time.",5,5,5,3,3,3,0.00
58555,"They are angry with me because they caught me in a lie. I am involved in a friendship with a person who has a very anxious attachment style. She is always asking me to hangout and it seems like her happiness depends on me, which I find very emotionally burdening. Sometimes, I lie about what I am doing for the sake of my own mental health. I would feel guilty, but at the same time, I wish they would get the message.",5,5,5,3,3,3,0.00
26708,"They are angry with me for my not being able to share my thoughts, or just hiding away. Sometimes, when I feel really stressed out after a terrible conversation and I feel like I cannot receive understanding from that person, I would just stop talking. I cannot proceed on the conversation because I'm in a guarded mindset and I feel really bad myself. I would feel that this situation is the worst, so I wouldn't enjoy talking with someone who are super judging and not understanding -- usually authority, or somebody who doesn't understand me but criticizes me.",5,5,5,3,3,3,0.00
31579,This person is probably mad at me because I gave them attitude. My family has told me in the past that I have an attitude problem. Sometimes it is hard for me to control. I try to be more self-aware and watch the way I speak to people.,5,5,5,3,3,3,0.00
83629,"They are angry with me because I missed a deadline or forgot something I was supposed to do for them. They feel a sense of disappointment and frustration with me, which led them to the secondary emotion of anger. What led me failing to meet their expectations was likely a mismanagement of time and availability on my part (i.e. taking off too much to chew at one time) which led to the inevitable failure in meeting the deadline. I would likely feel disappointment and frustration in myself an a sense of shame that I didn't live up to my expectations of myself nor the expectation of others.",6,6,5,2,3,2,0.00
11221,They are angry with me because I expressed why I didn't want to go to the event with them. They felt as though me just not wanting to go that night was enough for them to become frustrated with me and argue about what I should and should not be doing that night. I felt very restricted when they said this and almost as if I wasn't allowed to have my own schedule. I still question why it is that people get angry when I try to have my own independence.,3,4,3,5,5,5,0.00
35670,"If someone is angry with me, it is probably because I said something that was not very kind. I have the tendency to speak before I think when I feel threatened or hurt. So, if they're angry, they're angry at what I said because it was offensive. I feel really bad about the entire situation. I often feel really guilty when someone is mad at me because I know I did something wrong and I could have avoided the situation if I had thought through my words a bit more.",6,6,5,2,3,2,0.00
50144,"In this hypothetical situation, my friend is angry with me because I have been neglecting to talk to her recently. Since I have been busy recently and have started dating someone new (and thus have been spending a lot of time with them), my friend has gotten more and more upset as I don't reach out as much and sometimes bail when we make plans. I feel upset and guilty about the situation because I haven't been meaning to neglect my friend. I understand why she is upset and wish that I had known what was happening before she got upset.",5,5,6,3,2,3,0.00
53211,They are angry that I was not there for them when they are going through a difficult time. My availability was not there for those people because I did not like them much. I feel sorry for them and wanting to makeup for the situation.,5,5,5,3,3,3,0.00
79843,"They're angry with me because I haven't considered their feelings as I should have. I might have offended them because I wasn't paying attention to things that they valued or something else. I feel guilty and somewhat frustrated. I don't enjoy anger, giving or receiving, and dealing with angry situations I've never found rewarding.",6,6,5,2,3,2,0.00
62768,"This person is likely angry with me because of some error in communication or planning. For example, we made plans and I forgot to attend or was late; the people in my life are very patient and forgiving, so for somebody to be genuinely angry with me indicates that I made a big mistake. I would feel guilty if it were this situation of forgetting plans, and in general would be very uneasy with someone being angry with me, so I would do my best to communicate with them and solve the issue as soon as possible.",6,6,5,2,3,2,0.00
41401,"a common reason why people are angry with me is because i did something wrong towards myself. i refused to open up about my issues with them or i neglect to induced a benefit onto myself. thus this person is angry at me - more of my behaviour onto myself than myself as a person. i felt awful that they are expressing this emotion onto me. it is a very hateful, red, and dark aura and i feel bad that they had to ruined their day with anger of me. i tried to look back at the issues that i made and reflect on that.",5,6,5,3,3,3,0.00
85043,"I imagine someone might be angry with me perhaps because of something I said. I don't quite understand the question, but I wouldn't want someone to be angry with me and would probably feel quite guilty. I would most likely try to fix the situation unless I felt like I had been wronged and was also angry with them.",5,5,6,3,2,3,0.00
46483,"People normally don't get angry at me. I'm rarely in those situations. But if it were to happened, it is probably because I started getting mad at them first and being mean to them. I'm normally calm but if I'm mad, I'm very very mad. So if they are angry at me, it is probably because I'm not being nice to them.",3,4,3,5,5,5,0.00
81812,"They are angry with me because I accidentally forgot to invite them to a dinner party I hosted. More deeply, they are angry because they have underlying feelings about being a misfit and I have just struck a nerve. I feel incredibly guilty. I also feel incredibly anxious about resolving the situation and impatient to let them know that it was unintentional.",5,5,6,3,2,3,0.00
82872,"I think maybe because I did something make them feel sad or uncomfortable. For example, may be I organized a party but did not invite them. I think they will be angry with me after they figured out. Personally, I feel guilty when someone is angry with you, even though sometimes I did nothing and it was a misunderstanding.",5,5,6,3,2,3,0.00
29198,They're angry at me because I didn't leave earlier to get the car (which is a 45 minute walk away). It is now 5:00 and we have a 3 and 1/2 hour drive ahead of us. This has set us back because but we were unsure if we were going on the trip or not. I am sad that they're frustrated because this trip was supposed to be fun. I am also slightly irritated however as our poor communication resulted in this situation as the other person was wishy washy on whether or not we were going on the trip.,5,5,5,3,3,3,0.00
41041,"There's a lot of reasons people have been angry with me. Probably the most relevant one right now would be if I forgot a meeting with them. I'm very forgetful and am not the greatest at writing things down. I'd feel really guilty about forgetting unless they yell at me, then I would also get angry and defensive.",5,5,5,3,3,3,0.00
84440,"Someone is probably angry with me because of the way I said something. Although it depends on the person, it is still very difficult for me to hide my emotions, especially the negative ones. Thus, if I am in a bad mood, I will often unknowingly lash out on someone or give them an attitude. This would rightfully cause someone to be angry with me, which would remind me that this is something I need to work on.",6,6,5,2,3,2,0.00
59678,"I can see my father getting angry at me for various reasons. One of them being our differences in how we approach perspectives on life. For example, although to him my room is messy, I know where everything is and can find it despite it not looking conventionally clean. Thus, he would ask me to clean my room but I would not want to just because I am content with its appearance. However, to him, it is seen as being lazy.",3,4,3,5,5,5,0.00
16861,Someone is angry with me because I have expressed an opinion or thought that they didn't agree with or necessarily want to hear. An honest conversation about a conflict in their life led them to be angry with you. I feel a little bit anxious but mostly slightly frustrated about the situation. I'm anxious that they are upset with me but frustrated that they don't understand my point of view.,3,4,3,5,5,5,0.00
11003,This person is angry with me because I had forgot to do a task that I said I would do for them earlier. They are angry because they have told me to do this task before and I still have not done it. I feel very upset that they are mad at me but also feel it is understandable and I must do better.,5,5,5,3,3,3,0.00
20638,They are angry that I did not stay in touch with them after spending time away from one another. They feel like I should communicate with them more frequently. I feel hurt that they are mad at me and upset with myself that I did not do more. I would probably be apologetic and take blame for the situation.,5,5,5,3,3,3,0.00
68911,"When someone is angry with me, it is usually because we disagree on a topic. When someone holds a particular value close to them, it can sometimes be difficult to disagree with someone that has different values. I feel upset when someone is angry at me because I do not like to cause a fight/disagreement. However, it is important that when people disagree, they do not become angry at each other but learn to respectfully disagree on the topic.",5,5,5,3,3,3,0.00
33817,"Most commonly people are angry with me because I've hid something from them. They could find out from someone else and be angry that I've withheld this information from them. I would feel guilty and worried that I have lost trust with this person and that there is no way to recover or rebuild that relationship. I would try to justify my reasoning, but would probably end up with lies.",6,5,6,2,2,2,0.00
