pid,response,hum1,hum2,hum3,hum4,hum5,hum6,standardized
16742,They could be angry due to miscommunication or unknowing selfishness. I also believe we sometimes tend to think about ourselves first. That is a nature of our existence and many times it would be a thoughtfulness exercise that someone would have to go through to train to be empathetic towards others first and listen actively. I would not be upset with them but rather would want to understand where the problem came about and if there was something I could do to help them feel less angry.,5,5,5,3,3,3,0.00
18059,Someone would be angry with me for telling a little harmless lie when they knew the truth and knew what I was lying about. People would be angry with me because I do not pay attention in the best ways and get distracted in conversations. If I paid attention and didn't tell the little lies then it wouldn't happen as much but then also someone might get hurt if the truth hurts their feelings. I would feel upset but know I did wrong so I would understand that they were angry.,6,6,5,2,3,2,0.00
69516,"They are probably mad at me because I didn't communicate something with them well enough. They don't understand how I feel and I don't know how they feel or how to fix it. I am probably really upset with myself for starting it this, and I am probably mad at them for not talking to me. I don't know what to do to make it better. I'm going to try and make it better and worry about how they feel. But I'll probably also be upset about how I feel and that I probably can do something to fix the situation, but I'm not doing enough.",5,5,5,3,3,3,0.00
73467,"If someone is angry with me, it is most likely due to a lack of communication about an issue. I do not often know how to communicate my emotions, problems, etc. They probably wanted me to say something or tell them something that I wasn't able to or didn't recognize that they wanted. I would probably be a little confused but also maybe angry as well depending on the severity of the situation.",5,5,6,3,2,3,0.00
47724,This person is angry with me because I was too blunt in a situation. I said something too them that was harsh and did not consider their feelings. Sometimes I come across as harsh in situations that are meant to be more lighthearted. I feel disappointed in myself that I made another person angry with me.,6,5,6,2,2,2,0.00
27006,They are probably angry with me because of a way I acted that did not consider their feelings in the matter or because I did not value their feelings as much as I should have. I probably said something that went too far and it was the final straw. I feel horrible about it because I know that it was my fault and at least partially was aware of what I was doing. I also likely feel defensive in this situation.,6,5,6,2,2,2,0.00
18289,"They're angry with me because I failed them in some way. I would feel guilty and ashamed of myself for letting them down, and it was probably my fault for putting myself in this situation. Their anger is likely justified. I probably shouldn't match them in anger but instead try to conciliate.",6,6,5,2,3,2,0.00
50119,They are angry with me because they misunderstood what I said by projecting their own emotions onto it. I don't really care because the projection of their emotions onto fact is not my problem and something they need to figure out themselves. I'm annoyed about the situation because I thought more highly of them and I'm annoyed that they were too emotional and took things too personally to be objective and actually think about what was being said.,2,3,2,6,6,6,0.00
97837,"They are angry with because they didn't like me trying to help them with a problem. They were struggling on something and I tried to help, but they didn't want my assistance. I felt sad because I just wanted to be useful.",5,5,3,3,5,3,0.00
33691,"My friend is angry with me. He gets mad at me sometimes over dumb things, like when I told him it bothered me when he no-showed to our plans to work out. I'm frustrated with the situation and try to talk it out. He probably tries to avoid it, so I let him explain why he's mad and just get past it. With some time, we won't be mad anymore, and things will be fine.",3,4,3,5,5,5,0.00
90693,They are angry at me because I did something wrong. I might have said or done something insensitive or hurtful to them. I feel bad and upset at myself. I feel determined to not do the same mistake again.,6,5,6,2,2,2,0.00
44692,"They are angry because it doesn't seem like I put in the effort to reinforce our friendship or show my love for them. I feel that they are right to be mad, because I often struggle with my priorities even though I have immense love for my friends and family. I just can't always keep my promise of putting them before myself or education.",5,6,5,3,3,2,0.00
56658,"They are angry with me because I made a mistake, like leaving something on the stove and it burning and stinking up the house. I feel ashamed and stupid because I couldn't remember to turn off the stove and I wasn't smart enough to write myself a note to turn it off when I was done. I also feel like I need to do something to earn them back. For instance, maybe I will do extra chores, be more considerate than usual, or give them lots of compliments in the next week.",5,6,5,3,3,3,0.00
50327,"If someone is angry with me, it would probably be because I said something to upset them accidentally, and I may have said something in a bad way, or interpreted something wrongly. I typically am pretty non confrontational, because I don't like it when people are mad with me. When someone is angry with me, I usually feel really guilty and upset, and I usually argue back. I usually feel a mix of anger and guilt when someone is angry with me, and I usually either fight back tears or cry.",6,5,6,2,2,2,0.00
88304,They are angry with me because I didn't do my work well and caused trouble. I feel ashamed and wanted to explain but I don't have excuses.,5,5,5,3,3,3,0.00
78074,"If someone is angry with me, it is probably because of something that I forgot to do or because I didn't think before I did/said something. Either that or I made them angry by calling them out on something or starting an argument. The way I feel about the situation would depend on how close I am with the person and how long I think it will be until they stop being angry at me. Like if it was my sister, I probably wouldn't care very much because I know she loves me and we will get over it soon. If I did something wrong to a stranger that I might not talk to again, I would probably be pretty upset because that would be the thing they think of when they think of me forever.",5,5,5,3,3,3,0.00
75100,"If someone were angry with me, it would be because I am oblivious to a problem and have neglected to provide a solution. They would have been led to be angry by my inaction that is causing them to suffer. I would feel guilty and defensive at the same time because I know that their feelings ought to be recognized. I would be compelled to say that I cannot be responsible for their happiness, but deep down I would know that I am just trying to feel better about myself by putting them down.",6,5,6,2,2,2,0.00
29235,They are probably angry at me for not doing something right. I must have messed up by not being careful enough. I would feel saddened by the situation of someone being mad at me.,6,5,6,2,2,2,0.00
35913,"I imagine someone being angry with me because I can be forgetful and irresponsible. I imagine myself not showing up to an important event I committed to earlier, or forgetting that I had to help them with a task hey cannot do alone. I would feel very guilty and understand why they are angry with me. I would be disappointed in myself, and I would try to find a way to make it up to them.",6,6,5,2,3,2,0.00
48548,"I tend to spend a lot of time in my thoughts and as a result tune out from the world around me. This sometimes results in me forgetting to reply to texts or messages, or being hard to reach. I think that can be sort of frustrating for the people around me. I would feel bad and actively try to do better.",5,6,5,3,3,2,0.00
66044,"I imagine this person is angry with me because I had said something about them behind their back. I do not do this often unless I feel really comfortable with the person I am disclosing this information to, but if they had gone on to tell the person I was talking about what I had said I could see that leading to someone being angry. I would feel horrible about it, because i never feel good talking about someone behind their back, but when I do it is usually out of necessity because I feel I could not talk to the person outright without ruining our relationship.",5,5,5,3,3,3,0.00
33874,Someone is angry with me because I wasn't 100% listening to them and they're frustrated with me and I'm frustrated with them. Perhaps we're having a serious conversation and I'm not listening to them fully and they're frustrated over the fact that I'm not understanding what they're trying to tell me because I'm not listening fully. I'm upset at the situation because I'm frustrated because they're upset with me and I want to try and solve the problem by hearing them out and engaging with them fully.,5,5,5,3,3,3,0.00
94972,"They are angry with me for being too picky and anal about meaningless things in my life. I struggle with obsessive-compulsive disorder and as a result I can't relax or even function when things are not exactly as my brain wants them to be. This applies primarily to my home life, where I insist that every single item is perfectly in its place and free of dust (among other habits). This is often frustrating for people I interact with because they feel like they're walking on eggshells when I'm constantly obsessing over things being perfect. I also sometimes lash out at people if they're not meeting my OCD expectations. I feel self-conscious about this and I understand why they'd be angry about it, but I also recognize that I can't help it and it's something that I'm working on but will take a lot of time.",5,5,5,3,3,3,0.00
53878,"They are angry at me because I said something mean to them that I shouldn't have said. I called them something as a joke, but they got offended. I feel guilty about the situation and wish I could take back my words.",5,5,5,3,3,3,0.00
48958,"If someone were angry with me, it could be related to an action that I did that was maybe thinking of just myself. Considering only myself would be harmful to others and may make them feel left out, sad, angry, confused, etc. I would feel very sad and guilty if someone were angry at me and would want to do whatever I could to fix it.",6,6,5,2,3,2,0.00
28512,Someone is angry with me right now so I will just describe this situation. My best friend is angry with me for reaching out to her ex-boyfriend. I reached out to him because I was worried about her and knew that a lot of her sadness stemmed from him. I feel that it is a dumb reason to be angry with me because I had her best interests at heart and I came forward and told her instead of keeping it a secret.,5,5,5,3,3,3,0.00
56571,"If someone were angry with me, it would probably be because I crossed a boundary with them, like if I said something about someone that I didn't realize was harmful to another person and they found out about it. I try really hard to prevent situations like this so it would make me very nervous. I would feel very guilty and upset, and if the situation were serious enough, I would probably feel scared about talking with that person again.",6,6,5,2,3,2,0.00
55214,"Ugh my boss is angry that I don't have research results or I am not completing tasks quick enough or well enough. My boss has been pretty disappointed with my research performance since I began this job, as I've never been able to get an experiment to reflect the expected results well. I'm really disappointed in myself for this too, especially since becoming lab manager and feeling like my research has taken a back seat to the needs of my co-workers and administrative work.",5,5,5,3,3,3,0.00
24883,"I guess my responses to this would differ based on if this is a strong tie or a weak tie. If its a weak tie I'd feel bad, but I probably wouldn't notice they're angry at me unless they say it. Strong ties are easier to notice; my mom is constantly angry at me if I don't act in an 'appropriate' way or say things which are not conductive to acting in an appropriate way. Usually I feel annoyed because when I say things in private, its not because I mean to act on them, I just want an outlet for irritation. In short, unless someone tells me they're angry, I won't know why they're angry, and will probably feel a bit awkward but not care too much unless I'm really in the wrong.",5,5,3,3,5,3,0.00
64326,Someone would be angry with me for going out of my way to do something. People who are close to me always warn me of this. It makes me re-assess my thinking but ultimately proceeding with more caution in the future. I would continue to do the same actions but with heightened awareness.,5,5,5,3,3,3,0.00
28441,"If someone was angry at me, I feel like it would be because I didn't word something right way. I also think I might've upset their feelings by being passive aggressive or something of the sorts because sometimes I don't realize that I am being that. I don't think it would have been something I did but rather something I said because I can be emotional when talking sometimes and maybe say something I don't mean. If someone is angry with me, then I would hate being in that situation and feel angry with myself as well.",6,6,5,2,3,2,0.00
97263,"They are angry at me because of something I said to offend them. A remark I made was taken personally and that led them to be angry with me. This makes me feel incredibly guilty because I did not intentionally say something to hurt their feelings, oftentimes it has nothing to do with them. Until, they mention their feelings being hurt I have no idea that they took it personally.",5,5,5,3,3,3,0.00
20932,They are angry with me because I messed up and didn't consider all the factors in a particular situation. I was caught up in my plans in the moment and didn't think of what they're really going through. I feel really bad and can't believe that I didn't react in a more empathetic manner because this feels unlike me,5,5,5,3,3,3,0.00
26204,"Someone is angry at me either because I either showed up late, forgot to do something, or neglected to do something. They are angry because they think that I am disrespecting them and do not value their time. I feel upset at myself for messing up, and probably a little angry at them too because I want to deflect some of the negative emotions I am feeling about myself onto them. However, I probably realize that this anger towards them is irrational and try not to act on it.",5,6,5,3,3,2,0.00
78541,"Someone is probably angry with me because I left things unsaid or didn't communicate well. I think that is something I really don't like about myself and struggle with, and I know other people in my life have felt frustrated with me about that too. I have trouble having hard/vulnerable conversations with people, and sometimes just push away instead of having them, which makes the situation even worse.",6,6,5,2,3,2,0.00
48848,"Someone is angry with me because I let them down or had to cancel a plan. I tend to do too many things at once and cannot fit everything into my schedule that I think I can. I am trying to work on balance and saying no. It makes me feel extremely upset because I am trying to do everything and be there for everyone, but there is not enough time.",5,5,5,3,3,3,0.00
75835,"I'm going to use a situation that is similar to what I've been experiencing lately. I likely have someone angry with me because I have a position of ""power"" and they don't, or I'm not doing what they would like me to do. The person either wants to have the power that I have in my leadership position or they think that they would do something different than what I'm doing. This makes me feel upset, for I'm doing my best to do my best for the given organization.",3,5,3,5,5,5,0.00
63965,"I'm not sure why they would be angry with me in this scenario. If the intent is to think of reasons why someone is usually angry with me, I would say it is because I can be a little overly timid and/or nervous in some situations, and it can be annoying for others. I would probably feel a little nervous about the other person being angry with me, but it would probably depend on the specific situation. Without a more specific scenario, I'm not sure I could really expect how I would feel other than a little nervous/apprehensive.",5,5,6,3,2,3,0.00
10965,"They are angry with me for prioritizing my school and work over the rest of my life. I try to keep things balanced, but from time to time I slip. When this happens, I can get really stressed out and anxious and that can effect the space between me and the other people in my life.",6,5,6,2,2,2,0.00
13624,"Someone is angry with me because I called them out on not doing their fair share of dishes. They used many plates, bowls, cups, and utensils, and didn't have the courtesy to clean them off and put them in the dish washer. So, I gave them a reminder, which may not be the friendliest, and they would get defensive and attempt to justify their laziness. I don't feel great about the situation, especially since it was over such a relatively small thing like dishes, which I could have easily done myself.",3,4,3,5,5,5,0.00
73177,"They are angry with me for not truthfully communicating my feelings. This has happened to me in the past, in multiple situations, where I try to appease a situation and I end up making it worse. The other person is angry because I will not open up to them and I end up pushing them away. In this situation, I feel sad because in my attempt to do something I thought was good and avoiding a difficult conversation, I made the situation worse and upset the other person. I feel guilty and angry with myself for making the other person mad.",5,6,5,3,3,3,0.00
94204,"I think they are angry with me because I am not taking my responsibility of my work. This can happen if the work I am doing is not interesting to me. In this case, I tend to be very lazy. I would feel embarrassed and keep finding excuses.",5,5,5,3,3,3,0.00
94842,If someone is angry with me it is most likely because I acted distant or passive aggressive. If there's a quarrel or a negative situation usually I would withdraw and because of that might lead them to be passive aggressive. It would make me regret the situation and how I handled it.,5,6,5,3,3,2,0.00
95113,"Most of the time when people are angry with me, it is because of my lack of communication. For example, I often pull away in stressful situations and block out the person I love. This usually leads to them being angry although, those who really know/love me most do not approach situations like this with anger. My feelings in response to this is always bad; I am unaware when I am doing it so once someone expresses anger I feel very apologetic, guilty, and overall depressed.",6,5,6,2,2,2,0.00
13663,"Someone is angry with me because it is hard for me to prioritize things in my life, whether it be friends, school, family, etc. They are angry with me because of this because I've spent too much time not having my priorities in line that I have neglected one, or many aspects of my life to nurture another. I can understand this situation and I am also angry at myself because of this",5,5,5,3,3,3,0.00
96553,"I think the times people become most angry with are when I hold to strongly to certain beliefs, and I come off as stubborn an unyielding. It is possible that I chose to do a specific thing, such as work, rather than do something that the other person wanted, which upset them. I am often overwhelmed in situations like this because I can only do what I believe is right and there is only so much time to fill with all of the things you care about. Thinking about this situation is making me stressed.",5,5,6,3,2,3,0.00
21424,"I am unsure why they are angry with me, likely because I assumed something incorrectly or misspoke. I likely said something in a way that didn't come out correctly in tone or using the right phrasing and didn't pause to think before I did or said. I very much dislike when people are angry at me because I feel sad and like I have let someone down. It makes me angry at myself that I couldn't have mitigated the situation.",6,5,6,2,2,2,0.00
52699,"They are angry at me for ignoring them or for not being able to hang out with them. When I get busy or overwhelmed with life I have the tendency to cut out my social life and instead focus on finishing my work. But, the people who are upset with me don't know this pattern instead think of me as ignoring them and not prioritizing them. This in turn makes me feel awful as I should focus on them as well as work and try to find a healthy balance between the two.",5,5,5,3,3,3,0.00
36045,"Having someone be angry at me is one of my worst nightmares, so I spend a lot of time trying to avoid people being mad at me. If anything, the one thing I do that I know annoys people is being late. I'm late to a lot of stuff, always on accident, but no matter what I do, I can't seem to help it. I'd imagine they're mad at me for being late to social events with them on multiple occasions.",5,5,5,3,3,3,0.00
88285,"The person is angry with me because they misunderstood my intentions in an interaction we had. I did some sort of action that in my mind was showing respect for the person or simply living my life in the way that I do, and it was misinterpreted as having malicious intent or being exclusionary. I would feel very sad about this and partially offended for not receiving the benefit of the doubt from the person. I would be unsure about how to move forward in the relationship with the person for fear of re-occurrence of the situation.",5,5,5,3,3,3,0.00
92655,"They're probably angry because they feel as though something I have done or said to them has disrupted and devalued them in some way. I was upset with something else when they were talking to me, and because of that I said something to them that I would have otherwise not said. I feel guilty and ashamed because I lashed out at someone, and wasn't able to control my emotions. I don't like lashing out at people who haven't done anything to me, but are just there at the wrong time.",5,6,5,3,3,3,0.00
79764,"A reason someone could be angry with me is because of how I am easy to be negatively influenced by situations around me. When something unfortunate happens, I oftentimes will act to the stressor and become agitated or annoyed as well and this could cause anger from others as my mood would negatively affect them as well. I feel that they are justified to be angry about how I am reacting and so I will let myself calm down first and apologize or talk it out accordingly.",6,6,5,2,3,2,0.00
18458,"If someone is angry with me it is probably because I made a mistake. Maybe I forgot their birthday or didn't call them when I said that I was going to. I feel upset about the situation, both because I messed up and because they're upset with me. Overall, I'd probably think that some anger was justified, but if it was really intense, I'd say that's an overreaction",5,5,5,3,3,3,0.00
29417,They're angry with me because I committed to something and then didn't follow through. I said I would go to an event for a period of time and I forgot about it. They're angry because they were counting on me and I didn't show up. I feel ashamed and regretful.,5,5,6,3,2,3,0.00
47755,The first thing i thought of was my boyfriend or one of my roommates being mad at me. In the scenario in my head they are mad at me because I either said something mean or something I said was taken out of context. I feel really guilt about the situation because I know I'm in the wrong and even though i don't want to hurt anyone's feelings I still manage to do it. I never want to hurt anyone and its hard knowing I'm capable of that. Its even worse if I'm being honest about something that's bothering me and it ends up hurting the other person.,5,5,6,3,2,3,0.00
63198,"They would probably be angry with me because I did something to offend them or said something that were hurtful. Usually when people are angry at me, it is because I said something that was offensive or revealing of something regarding their personal life that they didn't want me to say. Sometimes, people also get mad at me because I'm not performing optimally in either my studies or in another task. If they are angry at me because I said something wrong or under performed, I would understand where they're coming from and work to improve myself so that I wouldn't make the same mistake again.",5,5,5,3,3,3,0.00
21550,"Someone is angry with me because they don't agree with me on a topic. I am bold and can speak my mind when something really bothers me or when i am asked, i will share. Society takes great offense at those that don't agree and don't love through it. I'm upset because i still gave them love when i didn't agree with their view.",3,4,3,5,5,5,0.00
85037,"I do not like conflict or confrontation. I usually avoid doing things that make people angry with me, so I am not typically in this situation. However, my mom does get angry with me when I get a piercing or tattoo, even though I only have one small one. This does not make me regret getting them, it just makes me frustrated with her that she can't understand that I am just trying to be myself. It makes me feel like she wants me to be myself in her terms and make her happy before I make myself happy.",3,5,3,5,5,5,0.00
