pid,response,hum1,hum2,hum3,hum4,hum5,hum6,standardized
54361,"They are angry with me because we are disagreeing on a subject. They are angry because they believe that they are only correct and do not want to hear what I have to say. They see me talking to them as ""talking back"" rather than a simple conversation. I feel upset and frustrated, but not angry because in order for me to still be in the right, I need to stay calm and collected to not heighten the situation.",3,4,2,5,6,4,0.00
60806,"My friend is angry with me because I pointed out a flaw in their actions. They always poke fun at me but when I do it, suddenly they're the victim and I am this bad person. I feel that they should treat others the way they would like to be treated. If you blow fire at someone, expect them to blow fire back.",3,4,3,5,5,5,0.00
16886,They are probably angry at me because I am very stubborn. I do not like to stand down when it comes to my views. my stubbornness and arguing I try not to fight with others but I can be very hard headed about things and views.,3,4,3,5,5,5,0.00
75098,"When someone is angry with me, I imagine it is because I did something dishonest. I do not think I hurt them on purpose but I should have been more considerate to how my actions affected them. Or perhaps another reason someone is angry with me is because I am not taking care of myself and they want to see me succeed. Overall, I would feel sad and guilty about the situation and it would be tough for me to function.",6,6,5,2,3,2,0.00
22497,Someone would be angry with me for not giving them my undivided attention. I tend to wander off in my own thoughts or stay locked in on what I am doing instead of listening intently to others very often. They could feel unimportant and worthless. I feel horrible about this now but in the moment I don't tend to see the other person's point of view or feel for them.,5,5,5,3,3,3,0.00
30531,I am not the best with consistent communication and tend to be hyper fixated on the relationships in front of me. I have run into old friendships where people feel as if I am not pursuing them. I would feel bad but also frustrated by the situation. Sometimes people have different needs and wants with a relationship in their lives. I would hope that they know I am a call away and it does not matter how long we've talked; it should just feel as if no time has passed.,5,5,5,3,3,3,0.00
58523,"In my imagination, this person is my dad, and he is angry because I did not do the dishes. He was led to be angry because he was expecting me to do the dishes. I feel annoyed with the situation, because this was always a common occurrence at home. My dad would not say anything but would expect me sometimes to do the dishes, and so when I did not do them he would get mad even though I was not aware I was supposed to do the dishes.",3,4,3,5,5,5,0.00
84547,"They are anger at me for not spending enough time with them. What led them to being angry with me is that I had a lot going on mentally, and I just wasn't able to put as much effort in as usually. I feel sadden by the situation. I try my best to make everyone happy; however, most of the time it leaves me never making myself happy.",5,5,5,3,3,3,0.00
30877,"Someone is angry with me because my mind was elsewhere while they were talking to me about something important to them. They became angry with me after reading nonverbal cues that I was not engaged in the conversation, and my inability to recall what they have just told me. I feel horrible about the situation, and I completely understand their feelings about it.",5,5,5,3,3,3,0.00
59790,"I would be very concerned about why they were angry with me, I would be wanting to ask them, and hear them out on why and what caused them to be angry with me. I would want to know this so that I could fix the situation and apologize. It would be beneficial because it would make our relationship stronger so I could work on the things that were bothering them, or that made them angry in the first place. I would feel as though it is important to be calm and to truly hear them out.",5,5,5,3,3,3,0.00
75774,"They are angry with me because of something I might have said or done that upset them that I was not aware of. I am deeply sorry and wish that I could take back that action or those words, even if I wasn't aware that I hurt them. I will probably carry this with me for a while even after they forgive me. I have had this happen to me before.",5,5,5,3,3,3,0.00
72680,"People typically get angry with me because I have a hard time admitting when I am wrong. Though, I am able to apologize for it later on, in the moment I struggle with not letting my pride get in the way. I even know in the moment that I need to take a step back and calm down in order to see clearly the issue at hand, but it is difficult to take that time to calm down sometimes.",6,6,5,2,3,2,0.00
73341,"I'd imagine maybe my girlfriend could get angry at me, maybe for forgetting to do something important. Maybe it's forgetting an anniversary, forgetting to make dinner reservations, etc. I'd probably feel embarrassed, frustrated, disappointed with myself for forgetting the important thing, and maybe some reciprocal anger at my girlfriend for being so upset with me. I'd feel like I failed in my role and that I could have done better.",6,5,6,2,2,2,0.00
50197,"If someone is angry with me it would most likely be because I was not a good friend. For example, if I told my roommate I would come home and hang out with her, but then spend the night at my significant other's. I understand why my roommate would be angry with me in this situation, because it sucks to get your hopes up and be disappointed by someone you really care about. However, I would be apologetic (stemming from feelings of guilt) and work to resolve the anger.",5,5,5,3,3,3,0.00
48525,They are angry with me either because I did not get something done that they wanted or because I got hurt by something they said/did and I want to discuss it further. I feel bothered/insecure about the situation because I just want clarification or the idea of someone I care about being upset at me makes me stressed or upset that I am making them more angry.,5,5,5,3,3,3,0.00
35865,I probably did something wrong or dissapointed them in some way. Or maybe they just perceive that I did something wrong. I probably am wrestling with the want to defend myself and frustration at them as well as guilt and the want to make things right.,5,5,6,3,2,3,0.00
57713,"If someone is angry at me I almost always think that i am at fault for it, I know that there are times when people can be angry at others because they've had a bad day or they're in a mood but I cant help but put myself in their shoes, when I am upset for external reasons i don't take my anger out on other people so i cant imagine others doing it either. I imagine i might've said or done something to upset them and I always feel guilty even after apologizing.",5,6,5,3,3,3,0.00
91343,They are angry at me because I didn't communicate well enough with them. They are angry because they feel like I don't put the same energy and effort that they put into me. I feel confused and concerned. I feel confused because I feel like I have done nothing wrong and I am already stressed out as it is trying to make them happy. I feel concerned because I wonder if other people feel this way.,5,5,5,3,3,3,0.00
23806,"Someone is angry at me because I embarrassed them in front of their friends and family. I was just making a joke, but I did not know that they would feel this way about what I was saying. I tried to apologize to them but they would not accept it or even talk to me. I feel embarrassed as well because of this.",5,5,6,3,2,3,0.00
41724,They are likely angry at me because I did something that they did not want me to do. I probably felt the need to act on something for personal gain but they asked me not to. I feel like I had to do it because it was the right thing but they don't see that yet.,3,5,3,5,5,5,0.00
63420,If someone was angry with me it would probably be because I said the wrong thing to them about something they might have been sensitive about. I often feel like I do not always know the exact right thing to say to someone about something they are dealing with and so I might turn to humor. They might not believe that my attempt at humor was appropriate causing them to be angry with me. I would feel absolutely terrible about the situation where I would remember what it was that I did to make them so angry and make sure I never repeated those actions to anyone.,5,6,5,3,3,3,0.00
34927,I am not sure why someone would be angry with me. I don't think I have been mean or unjust to anyone recently. But if one was angry with me I would want to diffuse the situation and figure out why they are upset. Then we could talk it out and come to a solution,5,5,5,3,3,3,0.00
21973,"Someone is angry at me for not having time to help them with something. I had too much in my schedule to drive them to the grocery store and now they are upset with me. I feel very guilty and apologize profusely, but this doesn't make it up to them. I tell them I will take them next week.",5,5,5,3,3,3,0.00
75837,"I would feel guilty if the reason they are mad is my fault. If I had done something to make them angry, like if I had teased them too harshly, and maybe they took it personally, i would feel apologetic and try to make them feel better. However, if their anger is unjustified, like if they suddenly stopped talking to me one day with no explanation, I would feel confused and also maybe a little bit guilty as well.",5,5,5,3,3,3,0.00
74765,"People being angry with me is an exceptionally difficult situation for me - anxiety things and a rough upbringing, I suppose. I usually assume that they are mad at me and it is my fault, even if it has little to do with me or if I didn't do anything wrong. It could be something I said that upset them even if I didn't mean to do so, or it could be something that ordinarily wouldn't make them upset that I was unaware of.",5,5,5,3,3,3,0.00
84456,"I'm imagining my friend being angry with me, for not telling him that I know that another one of our friends likes him. Although I feel bad, I feel justified in my supposed action, since it's not my place to tell him someone else's feelings. I feel like he's less angry at me, and more angry at himself for not realizing himself for so long.",5,5,5,3,3,3,0.00
12753,"They're angry with me because I did something without letting them know before, like taking their clothes or going out without permission. The lack of communication and trust between each other is probably what led them to be angry with me. Since we have a close bond, they are angry that I broke their trust. I would feel somewhat guilty but if it's something they do to me too, I would feel that it's unfair and hypocritical of them to be angry with me when I rarely get as mad at them for the same thing.",5,5,5,3,3,3,0.00
83773,"They are probably angry at me over something I did that upset them, or there is another reason that I can't think of. This could have been from a lack of communication, as my communication skills are lacking a lot of the time. I feel very badly about the situation, and I want to do all I can to help remedy the situation.",6,6,5,2,3,2,0.00
61226,"Someone might be angry with me because I tried to control a situation too much. I would feel frustrated because that was completely not my intention.Growing up having 3 younger siblings, I have always taken care of everyone around me but sometimes I need to let people figure out things for themselves.",5,5,5,3,3,3,0.00
13682,"I imagine that someone is angry with me about something I said. Perhaps they took my words the wrong way and that caused them to be angry with me. I don't say things to make others intentionally angry at me, so I would feel upset and sad if they were angry with me. I'd want to do what I can to work through the problem and make it up to them.",6,5,6,2,2,2,0.00
43639,Someone might be angry with me because I began to argue about what I believed to be right. This could lead them to be angry because I was frustrated with them and had a slight attitude. It could also lead them to be angry because they don't want to admit that they are wrong. This situation makes me feel small because I am getting in trouble for expressing my idea and then being told it was wrong.,3,4,3,5,5,5,0.00
73099,"They are angry at me because of something I did to hurt them. I may have done it unknowingly, but I still did it and I have to own up to it. If i did something similar before, it might even lead them to be even more angry with me. I would feel disappointed in myself for messing up again, but I would also feel disappointed in the other person and they would refuse to fix the situation.",6,5,6,2,2,2,0.00
73445,"They are angry with me because I forgot about something important to them. I tend to write down all of my assignments for a given day, but for some reason I forgot about theirs. They are angry because it seemed to them as if I did not care about them. I feel horrible after standing them up and apologize profusely. In the future I plan on doing small things that I know they love to make it up to them and let them know that I do care about them.",5,5,6,3,2,3,0.00
26940,"I think they could be angry at me for a multitude of things. I try to never intentionally make someone angry, but you never know what may upset someone even if it was just a small comment. Maybe I did not clean up my dishes and my roommates were mad at me for it, rightfully so, I would feel bad at first. After this feeling, I would promise to never leave dirty dishes around again and really try to clean up everytime I was in the kitchen. Sometimes I feel a little attacked when a lot of people say they are angry at me, but with this scenario, I think I would just feel sorry and apologize.",6,6,5,2,3,2,0.00
55797,They're probably angry because I was a little too blunt or let an internal thought slip out that I probably should not have. They're angry because I said something about their younger brother without taking into consideration that he is still their family no matter how I feel about them. I wish he was better but he isn't he's quite horrible and mean.,5,5,5,3,3,3,0.00
64325,I tend to be a pretty condescending person as in my family that is just the way we all talk to each other. Perhaps I said something to someone in a condescending tone which they cared about therefore making me insensitive. I do feel bad and have taken steps to decrease how condescending I am towards people. I would apologize to them and try to mend the relationship.,5,5,5,3,3,3,0.00
82545,"If someone is angry at me it could be because of something I did or said. I would say maybe I wasn't thinking all that much into what I was saying so maybe it came out weird or wrong. I know that sometimes I do have trouble with that. I would feel very anxious about the situation, I usually don't like it when someone is angry with me and it gets me pretty on edge.",6,6,5,2,3,2,0.00
49048,"If someone is angry with me, that person may be one of my parents (my mother maybe). She may be angry with me since we have different opinions regarding one issue and I don't want to listen to her advice and she thinks that what I did was wrong. That issue can be how to dealing with the relationship with others such as my best friends or just a classmate. I will feel very sad when she doesn't agree with me since from my point of view, I think my solution is ""perfect"", and I also will feel that she is not a good listener and isn't respectful to my opinions.",3,4,3,5,5,5,0.00
27010,"they may be angry with me because i am not being an active listener, or i have in some way failed to demonstrate a lack of care or respect. while my intention may not have been negative, i still emotionally impacted said person and it is my thoughtlessness that leads to their anger or more accurately, their hurt. i tend to feel extreme guilt that affects my day-to-day life. especially when the person who is angry at me is someone who i hold to a high regard and they are important in my life, i tend to feel very upset and uneasy.",6,6,5,2,3,2,0.00
87649,"If someone is angry with me it is probably because I have done a poor job at keeping up with communication with them. I would feel extremely upset about this situation and would like to do everything I can to connect it again, especially if it is a close friend of mine. I have never enjoyed when people are angry or upset with me. I try my best to keep up with all my obligations, but sometimes at the cost of a friendship.",6,5,6,2,2,2,0.00
46725,Likely it would be a miscommunication in language. Language doesn't necessarily represent the world in the same way to different people. Often times we bring in past experiences into language. So I may have said something that the other person thought was rude. I would feel bad an apologize.,5,5,5,3,3,3,0.00
26314,"They are angry at me because I told someone something I wasn't supposed to, or meddled in a situaton I wasn't involved with. I feel terrible about it and guilty, I didn't mean it maliciously",5,5,5,3,3,3,0.00
63374,"If someone is angry with me, they are probably angry because of something I did. Whatever I did to make them angry probably resulted from me experiencing feelings of anger or sadness myself. I would probably feel upset by their anger, especially if I feel like it is unwarranted. When dealing with situations like that, I tend to just sort of shut down and don't really work to solve the issue.",6,5,6,2,2,2,0.00
96383,"They are angry with me because they know I have been distant from them the past week. They think that I got bothered by them being a certain way at one point but I am not talking about it. They are probably angry at how I deal with such situations at times---not talking and pretending that things are ok. I don't know how to feel about it. I think ultimately it would be ok. The time will help with both of us feeling that there may not be any specific thing that should be resolved through explicit conversations. I just know that it will be ok eventually. If it really gets in the way, I will initiate a conversation and I am pretty sure that it will go well enough.",5,5,5,3,3,3,0.00
49909,"When people are mostly angry with me, it is usually because I am unable to communicate directly how I feel. These people are usually close to me because I am afraid how they perceive me and the expectations that they have of me. I do not want them to feel disapointed and discouraged regarding the things that I do. I feel frustrated about the situation because I also want to be able to express how I feel.",5,5,5,3,3,3,0.00
27926,"They are angry with me because sometimes I am hard-headed and stubborn. When my engine gets running I have a difficult time understanding and visualizing other viewpoints and ideas. At the time, I probably feel indignant that I am in the right, however, afterwards I am sorry and feel terrible about the entire encounter. To grow as a human, to learn.",5,5,5,3,3,3,0.00
21016,One could be angry with me because of my actions towards them. I could have hurt their feelings or crossed a boundary that they expect to be respected. They also could be angry because of the way in which I choose to live life. I don't like when other are mad at me. I try to remedy these situations.,5,5,5,3,3,3,0.00
17850,"They are probably angry with me because I did not feel the same way that they do about a certain topic. I tend to be very argumentative in issues that I feel strongly about and would express it openly. As such, it is not easy for others to persuade me to think in their perspectives about certain things, which can be a source of confrontation. If the other person is also not agreeable, there's a high chance that both of us would be angry at each other.",3,4,3,5,5,5,0.00
11349,Maybe someone would be angry at me if I treated them badly. Sometimes I kind of shut people out randomly for no apparent reason. it would make sense that they are angry with me because they probably think i don't care about them whihc usually isn't the truth. For some reason i tend to not put effort in some things and it hurts my relationships sometimes. I feel a bit angry at myself at times when i do this because the other person doesn't deserve that.,5,5,6,3,2,3,0.00
56694,"They are angry at me because I said something insenstive. Sometimes I hurt others' feelings and dont realize it till after the fact. I like to say Im good at reading people, but im not perfect and sometimes make people upset. I feel guilty for upsetting them and dont want it to happen ever again.",5,6,5,3,3,2,0.00
35198,"They maybe angry with me because I'm in my own world a lot of the time and forget about what's around me. I probably have had to cancel plans or don't reach out because i'm hyper focus on a few things. I feel bad about the situation because i care about the person, but not sure how to communicate. I want to improve.",5,5,6,3,2,3,0.00
29109,"I most likely annoyed them or did something they did not approve of, which I feel like happens often. I would feel like I was not doing anything wrong until I noticed they were mad at me, then I would watch every move that I make and try my best to stay out of their way. I would feel ashamed of myself for making someone upset.",6,5,6,2,2,2,0.00
55758,The individual is most likely angry at me because I said or did something without thinking through the consequences. I find myself jumping to actions quickly without taking time to think through what they will lead to. I do not like when people are angry with me and feel very insecure when this occurs. I will do my best to reconcile with them and take accountability.,6,6,5,2,3,2,0.00
56150,Someone is angry with me because I didn't tell them the entire truth. I tend to leave parts of stories out that may be relevant and when someone finds out about something I didn't tell them they get angry. I feel bad about the situation but at the same time I'm not required to tell someone every detail about everything.,5,5,3,3,5,3,0.00
39808,"For me, the first thought is my mom was being angry at me when I was small. She is being angry because I did something disappointing to her. And I failed to meet her expectation. My mom is much different from the one she was before. She is kind, agreeable and wise. But I still can remember the feelings of the shame and sadness back in the days.",5,5,5,3,3,3,0.00
40239,"Someone may be angry with me because they envy my personality or ability to speak to others. I am an extremely kind and easy going person, and not everyone likes that. I usually make friends easily wherever I go, which can lead to some people being mad. I do not feel angry back or share the emotion they feel towards me, because at the end of the day I can't control any people besides myself.",3,4,3,5,5,5,0.00
84674,A person would be angry that I didn't follow up with them or take the time to respond in a super timely manner. I would feel guilty for not setting aside time to fully focus my attention on responding to a text or specific email.,6,6,5,2,3,2,0.00
88691,"I am a person that is very easygoing, and I tend to avoid conflict if at all possible. I also tend to be the first to apologize and take the blame in these kinds of situations. If someone were to be angry at me, I would start my reflecting on my actions and behaviors, and communicating with them to see if I harmed them in any way. If not I would attempt to communicate my perspective. I would probably be relatively uncomfortable in this situation.",5,5,6,3,2,3,0.00
60956,"They are angry with me because I didn't take them seriously. I imagine someone tell me about their misfortunes but I didn't reply, or I just say they're okay. I sometimes tend to do that because you can't really tell how bad the situation the other is experiencing. I will probably feel bad if I know they are really not happy and experiencing something worse than I thought.",3,5,3,5,5,5,0.00
79470,"I probably did/said something wrong, probably politically or made a joke, that they either took the wrong way or were offended by. I often say things without thinking. I get very nervous and worried about people being angry at me for saying or doing stupid things. I also put a lot of pressure on myself to get things right and make others comfortable so I will probably fall into self-loathing.",5,5,5,3,3,3,0.00
35567,"They may be angry with me about my lack of communication. This lack of communication may have been from me getting caught up in stressful tasks such as school work and other activities that take up my time. I have a tendency to almost forget to reply to others over the phone and at times forget how this makes them feel. I feel that even though it hurts to admit, I often let my emotions block my communication with others and it is something that I should work towards.",6,6,5,2,3,2,0.00
89992,"One of my friends is angry with me because I accidentally stood them up. We planned to meet up for lunch, but I was so preoccupied with other tasks that I forgot. They are especially mad because I promised them. I feel very apologetic and wish that I could turn back time.",5,5,5,3,3,3,0.00
68324,"If someone is angry with me, it is probably to do with my carelessness or lack of discipline. What led them to be angry is probably me losing something important or me completely forgetting about an event or an important task I needed to complete.. I feel really bad about this because though I tend to be careless, it isn't intentional. I do want to change this behavior.",6,6,5,2,3,2,0.00
