pid,dream,dejavu,conflict,award
66044,"I think there is a lot to be said about spirituality. Even though I am not religious, I believe we are all connected in spirit and this event is entirely possible. I would think that this happened because if they knew they were going to die, they would have wished to impart this wisdom on me.",I have experienced this several times with people and when I do it feels like our energies were made for each other. I think meeting someone on the same wavelength as you and who gives off the same vibes makes it feel like an age old connection almost instantly. One of my closest friends and I had this experience when meeting each other a few years ago where we hit it off immediately and could have deep conversations that most would only consider having with life long friends. I think it has to do a lot with personal values and connection to your spirituality and others around you.,"I imagine this person is angry with me because I had said something about them behind their back. I do not do this often unless I feel really comfortable with the person I am disclosing this information to, but if they had gone on to tell the person I was talking about what I had said I could see that leading to someone being angry. I would feel horrible about it, because i never feel good talking about someone behind their back, but when I do it is usually out of necessity because I feel I could not talk to the person outright without ruining our relationship. ","One of my biggest dreams is to win the nobel prize in chemistry so I am going to pretend that is the award I have just one. I would have won it after several years of daily research and a constant fascination with one topic. It would require an unimaginable amount of work to get there, but I would have given my all every day to do it. I would feel like everything I had lived for had come to be, I would feel like i would have a completely fulfilled life. "
33874,"I think that sometimes people have certain feelings or inclinations about life and things that might happen next. I don't think that there's any particular reason why, maybe some other being gives us this feeling so that we get the chance to say goodbye and make sure certain people know how we feel about them. Obviously, not everyone gets this opportunity to say goodbye or speak to their loved one before they pass away, but I think that it happens sometimes because of an odd feeling that they get, either from just a sixth sense or from a Godly being. ","I don't have any inclinations for any particular religion or belief but I like to think that some type of reincarnation is possible. The idea of your spirit or essence being reincarnated after you pass away is a really relieving thought to have. I think it's even possible for just a part of your spirit or essence to be continued elsewhere. I'm not sure why this happens, maybe because some parts of people are so unique and beautiful, the universe can't possible part with it and somehow that essence is continued in another being. ",Someone is angry with me because I wasn't 100% listening to them and they're frustrated with me and I'm frustrated with them. Perhaps we're having a serious conversation and I'm not listening to them fully and they're frustrated over the fact that I'm not understanding what they're trying to tell me because I'm not listening fully. I'm upset at the situation because I'm frustrated because they're upset with me and I want to try and solve the problem by hearing them out and engaging with them fully. ,"I received an award for an amazing scientific discovery that has changed the world. (I'm in an environmental science class right now, so my mind immediately jumps to some scientific discovery to help the environmental crisis). I worked tirelessly for years and years with an amazing team to receive this award. There are a lot of ups and downs and many obstacles that we had to jump through to accomplish this goal. I feel accomplished and proud of my self and the team that I had to work with to get there. Most of all I feel grateful for the opportunities that I was able to experience to get me to that point and for the people that were there for me during all of it. "
94972,"I think the most likely explanation for this is that it's a coincidence. I would like to think that there's a larger connection at play or a deeper meaning, but I can't fully wrap my mind around what that would be. I feel like I have heard stories like this from people who have lost a loved one and were extremely convinced that their loved one's spirit was with them in some way. While I enjoy hearing these stories and hope that I might have a similar meaningful experience one day, I still always land on the idea that it must be a coincidence or a ""false memory"" that the person created unknowingly.","I think the other person and I likely share a lot of common interests, hobbies, personality traits, etc. So while we have not actually known each other for decades or anywhere close to that, it feels like we have because of our similarities. I do not believe that it's possible we knew each other in a previous life or anything along those lines. ","They are angry with me for being too picky and anal about meaningless things in my life. I struggle with obsessive-compulsive disorder and as a result I can't relax or even function when things are not exactly as my brain wants them to be. This applies primarily to my home life, where I insist that every single item is perfectly in its place and free of dust (among other habits). This is often frustrating for people I interact with because they feel like they're walking on eggshells when I'm constantly obsessing over things being perfect. I also sometimes lash out at people if they're not meeting my OCD expectations. I feel self-conscious about this and I understand why they'd be angry about it, but I also recognize that I can't help it and it's something that I'm working on but will take a lot of time.","I received the award for academic performance (likely in a chemistry class). I always have been an over-achiever, which is both one of my biggest strengths and simultaneously one of my biggest weaknesses (because of the toll it takes on my mental health). I was able to earn the award purely by working hard and putting in the hours to study/practice material. I feel very validated and proud of myself upon receiving it."
53878,"This happened because that person had to tell me something before they left. It was a sign that they were present in my dream. Some type of outside force allowed this to happen, or it might have just been simple coincidence. I would not be able to pinpoint exactly why it happened but would be happy that I had that moment with them. ",This happens when people have personalities that work with each other. We might have been destined to meet each other. Or perhaps we met each other in another life. It is also possible that we just match each other's energies and are compatible. ,"They are angry at me because I said something mean to them that I shouldn't have said. I called them something as a joke, but they got offended. I feel guilty about the situation and wish I could take back my words. ",I received an award for my scientific research. I worked on my research project for several months and made significant findings that have a huge impact on medicine. I feel proud of myself for receiving this award. I also feel accomplished as I have always wanted to be recognized for my work. 
48958,This situation may happen if you believe in a connectivity among people in the world or that someone has a sense of awareness of their loved ones. I would likely believe that it was a happy coincidence that I had such a perfectly timed dream and glad that I could be with them through that experience. I am unsure what I believe surrounding the afterlife and connection among individuals on a deeper level at this moment.,I think that meeting someone and feeling like you have known them forever happens when you are meant to be close to someone. Having similar personalities or same sense of humor is usually a characteristic of a relationship that forms quickly. I feel as if these situations are rare because rarely do personalities mesh in a way that makes you feel this sense of connectivity.,"If someone were angry with me, it could be related to an action that I did that was maybe thinking of just myself. Considering only myself would be harmful to others and may make them feel left out, sad, angry, confused, etc. I would feel very sad and guilty if someone were angry at me and would want to do whatever I could to fix it.","I would hope to receive a reward in some way for caring for other people. I imagine this would most likely happen within my career path as I am going into what is known as a ""helping profession."" I would feel very honored if I won an award for this because I would truly be making an impact on other people's lives. I think that it would also be gratifying to know that my hard work to get to that point in my life would have paid off."
28512,"This happened because they made sure that before they died, they said goodbye. I am not a very superstitious person but I do believe that within each person is a spirit and although our bodies may pass away, our spirits never do. Their spirit is what visited me in my dream to say goodbye and give some wisdom. I think it also shows that love transcends the physical world.","If I meet someone for the first time and share an uncanny sense that we've known each other for decades, I would feel some confusion. I am not sure how and why this happened but it certainly is an interesting coincidence. I would take it as fate and try to strike up some conversation with this person and establish a relationship. If we felt like we've known each other, then chances are that we were meant to know each other.",Someone is angry with me right now so I will just describe this situation. My best friend is angry with me for reaching out to her ex-boyfriend. I reached out to him because I was worried about her and knew that a lot of her sadness stemmed from him. I feel that it is a dumb reason to be angry with me because I had her best interests at heart and I came forward and told her instead of keeping it a secret.,"I received an award for care. I tend to gravitate towards opportunities where I get to show concern and care for others. If I were to receive an award, it would probably be for something that I am dedicated to like caring for others. While I quite like being accomplished, I do not like receiving awards because I equate awards with an unhealthy sense of pride."
56571,"I would probably be very upset at the fact that happened, and would take it very seriously. If there was a reason that this happened, it would probably be that it felt like they needed to talk to me and tell me something that I would have never been able to figure out on my own. I would be confused as to why I was the one they chose to talk to, which would make me feel bad if there was someone else that was closer to this person that did not have this dream. Honestly if I think about it like that then it seems like the dream was something that was supposed to happen, which would confuse me more.","I would have probably met this person while I was doing something that I found uncomfortable or funny and another person was too, so that I could see someone being vulnerable while I was. I think that that kind of situation would help me trust someone enough to talk to them and feel like I have known them for a long time. If they immediately start talking to me about their feelings it would make me more likely to feel comfortable around them and express my opinions too.","If someone were angry with me, it would probably be because I crossed a boundary with them, like if I said something about someone that I didn't realize was harmful to another person and they found out about it. I try really hard to prevent situations like this so it would make me very nervous. I would feel very guilty and upset, and if the situation were serious enough, I would probably feel scared about talking with that person again.","If this were in the future after I graduated and started a career in something I wanted, like chemistry or some other science, then the award would probably be some sort of scientific achievement award to celebrate something that I discovered. I would be incredibly happy with myself and would feel very content with my life and career if this were to happen. I would probably want to immediately tell my family and friends about it. I would feel a little bit sad that my mom couldn't see me getting this award, but it would help me appreciate spending time with the rest of my family and friends celebrating."
55214,"I guess that might happen if the loved one felt there was something important we were never able to discuss, or if they felt they needed to speak to me to help me understand and cope with the loss better. I do have people close enough to me that if they were to die suddenly, I don't know that I could recover from such a loss. ","I would probably feel this way if the person related to lots of specific interests of mine, or observed something about me that I felt only someone very close to me would pick up on. I tend to feel that it takes time and experience for people to get to know me, so if a person could note a specific trait of mine, it would make me feel like we knew each other well. In terms of interests, if we shared lots of prior experiences, likes/dislikes that take time and experience to draw out.","Ugh my boss is angry that I don't have research results or I am not completing tasks quick enough or well enough. My boss has been pretty disappointed with my research performance since I began this job, as I've never been able to get an experiment to reflect the expected results well. I'm really disappointed in myself for this too, especially since becoming lab manager and feeling like my research has taken a back seat to the needs of my co-workers and administrative work. ","I imagine I've achieved ""Lab Manager of the Month"" recognition or something like that. My coworkers would have nominated me for it. I achieved it by being a reliable, helpful, and pleasant lab manager to my cor-workers. My boss also acknowledges what a big help I am!"
24883,"This has actually happened, though not in the exact way described, to several people in my family. I'm not superstitious in the traditional American sense (black cats are lovely, mirrors break sometimes, it doesn't meant anything), but I do believe that... even if we don't have a traditional 'spirit', there's something beyond just our brainwaves. The world is too strange to just be what we perceive. So people visiting loved ones before they die, or when they're dying, as a way of saying goodbye - I'll believe it.","I don't think this has ever happened to me. I'm pretty good at playing at confidence in social interactions, so I can act familiar when I'm really not being. But I don't go around spilling inner thoughts until I've known someone for several months or even longer, and even then its conditional. I can't imagine meeting someone and sharing that instant ""love at first sight"" -like sense... at most just feeling that someone has a good vibe? Maybe it's just their vibes that are like mine.","I guess my responses to this would differ based on if this is a strong tie or a weak tie. If its a weak tie I'd feel bad, but I probably wouldn't notice they're angry at me unless they say it. Strong ties are easier to notice; my mom is constantly angry at me if I don't act in an 'appropriate' way or say things which are not conductive to acting in an appropriate way. Usually I feel annoyed because when  I say things in private, its not because I mean to act on them, I just want an outlet for irritation. 

In short, unless someone tells me they're angry, I won't know why they're angry, and will probably feel a bit awkward but not care too much unless I'm really in the wrong.","I would love to receive an award for something I've created, especially if its something that goes on to live in posterity. I just love making something new and being praised about it (shameless, but true). I think an award doesn't really mean that much in the grand scheme of things, but its still a nice recognition - a little sign that says, hey, we really liked this! It's been a long time since I won anything so it would feel nice."
64326,"I think people we are close to are connected with us on some spiritual level, so sometimes we can tell if something happens to them before actually knowing. I would incredibly saddened if this happened to be, but also grateful to know that we had such a close connection. That dream would forever be considered one of my last memories of / with them.","I would feel like I am in a movie because even though that sense would be amazing, I would immediately become suspicious and proceed with caution. I like to think that people are good, but this is not always the case so when something seems too good to be true, I carefully access the other person and monitor my own words and actions.",Someone would be angry with me for going out of my way to do something. People who are close to me always warn me of this. It makes me re-assess my thinking but ultimately proceeding with more caution in the future. I would continue to do the same actions but with heightened awareness.,I believe I would win an award for being a caring person. I always try to help people in any way that I can and have done so purely based on internal drive. I would feel happy yet awkward receiving a reward for doing something a lot of people do on a daily basis. 
28441,"I think subconsciously you know that you hadn't spoken with them very often or felt as if you don't tell them you love them as much as you should. However, since this person has just passed, their spirit is still out there. Their spirit is what came to visit you and tell you that it's okay and that they still love you because they know they didn't say it that often either. They want you to know that will always care for you though. ","I think this kind of ties into the ideas of soulmates. You can either have a romantic soulmate, a platonic soulmate, or maybe even just someone that's supposed to come into your life for a reason. In another lifetime, you and this other person has promised each other that you will come back and find each other again and you have, but of course it's a new lifetime so you won't actually ever know. You've been given the chance to keep making bonds with this person over and over because you just match. ","If someone was angry at me, I feel like it would be because I didn't word something right way. I also think I might've upset their feelings by being passive aggressive or something of the sorts because sometimes I don't realize that I am being that. I don't think it would have been something I did but rather something I said because I can be emotional when talking sometimes and maybe say something I don't mean. If someone is angry with me, then I would hate being in that situation and feel angry with myself as well. ","I would like to think if I just received an award, it would be for gymnastics or cheerleading. I have a meet coming up and I'm also currently deciding whether or not to join club cheer which has a nationals. Either way, hard work and determination has brought me the award because of how hard I have worked in either sport. I would feel amazing for getting it and accomplished as well. "
97263,"I think this happens because when life comes to a close people do not want to have regrets and want to be remembered in a positive way. There is also a short amount of time left for them to say what they haven't yet to a loved one. Moreover, someone is most likely to carry that advice along with them when it is the last memory of someone important to them. ","I think this would happen because a sense of familiarity, whether it be physical appearances or simply a personality trait. We often attach to what we feel most comfortable with and when someone may have that specific thing, it can create a false connection. Lack of remembrance of a different, but supposedly similar, person may also cause this mistake.","They are angry at me because of something I said to offend them. A remark I made was taken personally and that led them to be angry with me. This makes me feel incredibly guilty because I did not intentionally say something to hurt their feelings, oftentimes it has nothing to do with them. Until, they mention their feelings being hurt I have no idea that they took it personally.",I received the award for class participation and leadership. I was able to achieve this award by being attentive and actively involved in the classroom setting individually and in groups. I am proud and ecstatic about being recognized for the award.
20932,"I think there are certain things that your brain processes faster than you do and some truths that you subconsiously know in your heart. I am not religious at all but I am slightly spiritual and while I almost always need evidence to believe things, things like this I can accept without a logical reasoning. ",Maybe I know someone who they remind me of. Their mannerism and characterists could be exactly like a close friend of mine's. Or maybe this person and I are similar in unexplicable ways and that is something that we both subconsiously catch onto.,They are angry with me because I messed up and didn't consider all the factors in a particular situation. I was caught up in my plans in the moment and didn't think of what they're really going through. I feel really bad and can't believe that I didn't react in a more empathetic manner because this feels unlike me,I received an Olympic award for long jump. i was able to achieve it thanks to my coach and the time that I spent practicing. I feel great about getting it and it feels like my hard work has finally paid off.
26204,"I would think that this would happen through some strange and very complicated machinations of the universe. I think that this experience could be explained by psychology, although I wouldn't discount the idea of a supernatural force either. In terms of psychology, I would think that I would be more likely to dream about a person if I knew they were in poor health, and would therefore be more likely to have a dream about someone who was about to die.","I would think that this probably occurs because we grew up in similar households and/or situations. This similar experience could result in making us two very similar people, or it could just mean that we saw each other in people we were surrounded by growing up. For example, maybe this other person doesn't remind me of myself very much, but they remind me of my best friend from childhood. ","Someone is angry at me either because I either showed up late, forgot to do something, or neglected to do something. They are angry because they think that I am disrespecting them and do not value their time. I feel upset at myself for messing up, and probably a little angry at them too because I want to deflect some of the negative emotions I am feeling about myself onto them. However, I probably realize that this anger towards them is irrational and try not to act on it. ","I have received an award for being an exceptional student in some aspect. I was able to achieve the award by being hard-working and a little obsessive about something. I feel proud and happy for getting it, although I also probably feel a little embarrassed about. I am probably excited to put the award on my resume."
78541,"I would probably think that they somehow communicated to me through the dream. I'm Catholic so I'm not entirely sure what the Church says about this, but I sort of think that it could be a way that they might be communicating their love to me while they are in the afterlife. Or maybe it was because I was thinking of them and had some knowledge that something was wrong with them. ","I think if this were to happen, it would be more likely to happen in a situation where I don't know anyone else too. For example, I feel like I am often more open to people that I don't know anything about compared to people who I might have mutual friends with or might be acquaintances with. I guess it is because I am less likely to have preconceived notions about the person and am less likely to believe that they have preconceived notions about me, so I am more open to talking vulnerably and deeply to this person, allowing us to discover that we feel like we have known each other for decades.","Someone is probably angry with me because I left things unsaid or didn't communicate well. I think that is something I really don't like about myself and struggle with, and I know other people in my life have felt frustrated with me about that too. I have trouble having hard/vulnerable conversations with people, and sometimes just push away instead of having them, which makes the situation even worse.","I probably received either an academic or an athletic award, since those are the two main things that I've gotten awards for in the past. I probably spent a lot of hours of hard work working on whatever I got the award for, and worked with the specific goal in mind of achieving that award. I get a lot of satisfaction through achievement/success, so I'm sure I would be really happy and feel a sense of pride."
