pid,dream,dejavu,conflict,award
51962,"I think there's a lot that we as humans don't understand about consciousness and ourselves. People do have these things happen to them and I think there might be a unique gift that these people have. The people I've known who've had this experience have both had a lot going on with them mentally, so maybe some mental/ behavioral health challenges aren't disorders at all and are just indicative of something we don't understand. ","I don't know if I believe in past lives, but maybe if the connection were really strong I would. My more logical answer would be that we had many of the same past experiences (emotionally & mentally) that shaped us. ","Someone would probably be angry with me for switching my mind or opinion or thoughts on something, if they were to be angry with me. I'm happy that I'm an open-minded person but definitely get angry with myself for not being firm in my thoughts and beliefs and telling white lies when I'm uncomfortable.  ",I would like to receive an award for some kind of mental health advocacy work. I would have achieved the award by working hard and using my struggle for good. I'd feel really happy and fulfilled. 
53727,"I am not a very strong believer in God, but I do feel as thought there is some higher power out there in the universe. It often shows itself through acts like this. I would not consider this a coincidence, or a random occurrence. Something of this magnitude has to have been curated somehow, I don't think that luck or chance can lead to this.","This actually happened to me last year. I think we felt that way because we actually had a lot in common, and we were able to discern that fairly quickly. We had a nearly identical cultural background, similar life experiences, and similar worldviews. However, I still think that I could meet someone that is wildly different than me and share that uncanny sense that we've known each other forever. If you really get to know each other, not just on a surface-level basis, and you find a sense of trust and understanding which usually takes years to develop, then you've found that sense.","They are angry with me probably because I said something I shouldn't have said and it was insulting towards them. There are times where I don't have a filter, so I say stupid things that hurt people's feelings. In those cases, I feel a sense of shame and regret for having said something that I perceived as innocent but that made someone else feel bad. I would do whatever I could to make them feel better, but it's not always easy, as I am the one who made them angry in the first place.","I probably received an award for one of my passions, whether it be competitive ballroom dancing, academics, are something within my religious youth group. I achieved whatever it is the award is for through hard work. I am not naturally talented at many things, so this award would have been received through diligent and consistent work. I feel honored to be recognized. But, at the same time, I feel as though I haven't done enough and that others deserve to be recognize more than I do. I have never been a fan of awards. "
74662,"I can't think of a reason why the loved one's death and the dream would be connected, or how the death of the loved one would cause me to have a dream; I think the only reason I would have a dream in this case is purely because of coincidence. However, I may have had such a dream because I was thinking a lot about this loved one recently, and perhaps things they told me in the past were freshly in my mind. I don't think there is any extra-physical/spiritual connection between people, and as far as I know the only motivator for dreams is your mental activity, both conscious and subconscious. Thus, the only way I think this could have happened is that I was thinking a lot about this loved one and they just happened to die during that particular night.","I don't think there is any reason why this would happen other than that we both had similar upbringings, life experiences, and personality traits. In other words, I think the only way this could have happened is if we have similar ways of thinking and experienced similar things in life, which would result in us being quite similar to each other. This could perhaps result in us feeling like we have known each other for a long time. I don't believe there is any spiritual connection or anything like that that could have connected us; we would merely have been prepared by our lives to be very similar. This isn't dependent upon fate or gods or anything spiritual; it only relies on random chance.","They are probably angry with me because I didn't understand or wasn't able to empathize with some trouble they were going through. I led them to be angry with me by showing that I didn't empathize with them or being oblivious to their hurt. I would probably feel confused, frustrated, and a bit annoyed that they are angry with me, because I strongly believe that you should solve your own problems and that complaining to others/getting others to feel sorry for you is counterproductive and a waste of time. In general, I believe logical thinking, pragmatic approaches to problems, and detachment from emotion is quite important in solving issues effectively, but I do realize that this will probably alienate me from many people or result in people being angry with me.","I received the award for technical innovation and excellence in a specific field. I achieved this award by working hard, teaching myself, dedicating a majority of my life to whatever I won the award for, and by being creative and thinking outside the box. I would feel very happy and fulfilled for getting this award, because it shows that what I am doing is valuable and that I am contributing to that field. In general, I would only be happy to receive an award if I felt I had worked hard enough to earn it."
48025,"I think somehow they wanted to send me a message, to tell me they loved me or grant me some wisdom one last time. There isn't really an explanation for it. I am a Christian, so I do believe that those who believe in Christ will achieve everlasting life. In some ways, I think God sends those to comfort us, to show us that we have an angel looking out for us. Sometimes it might come in a form of a dream, other times its other signs in the world around us, like a certain animal, sound, scent or other cue that meant a lot to that person. Somehow, somewhere that person is able to show us that they are ok, and to remind us that they love us. ","I think our souls knew each other before, or just sense a familiar soul. I am not quite sure how our souls know each other, as it is very weird to think about it and attempt to figure out how that happened. On the other hand, I do also just think sometimes that people's personalities are just the right mix to get along so perfectly, its just the right mix of the right traits that make them fit right in with each other and feel as if they have known each other for a long time. Maybe they even remind them of someone they once knew and/or loved.","I'm not sure why they are angry with me, as I am usually too shy to ask why, although it is probably because I didn't go along with the plan or do what they thought I would do. I feel very anxious about approaching and dealing with the situation, although I do have a lot of other feelings about things. I feel angry as well, and probably upset that someone is angry with me.They probably became angry with me because I get very emotional when dealing with certain situations, which usually escalates certain situations very quickly.","I received the award for some new scientific breakthrough. I was able to achieve this award through lots of hard work, many mistakes (learning from them as I went), and working with a team of other individuals, who bring different skills than I to the table. I feel absolutely amazing about getting this reward, as if this was what I was meant to do, as if it was my life's calling."
41639,"I don't personally have a strong stance on the afterlife or the supernatural, so I'm not sure how or why that would happen. It could be that the dream was influenced by thinking about that person if they are in a situation in which they aren't doing well. I know that some people believe that they are visited by their loved one after death, which I wouldn't rule out. In general, I'm not sure.","I think there are certain things about other people that make it easy to connect with them and to identify certain things that you have in common. Some people just click and get along really well. Sometimes there's just an innate understanding and mutual connection. I don't necessarily think that this has anything to do with past lives, although I also wouldn't rule out that possibility.","The first thing that came to my mind is that someone in my family is angry with me for disagreeing with them about politics or religion. We often have very heated discussions that lead to both sides getting upset. I'm sad that these discussions so often go this way. I wish it would be possible to discuss these things without them getting angry, or to avoid the subjects altogether. ","I would imagine that I received the award for writing a book, which is a dream of mine. I was able to achieve this by spending a significant period of time writing and editing a book, and then going through the difficult publication process. I imagine that I would feel really excited. I would also be grateful to be recognized for something that I've always wanted to do."
98971,"Well, that would be terrifying. Though I'm naturally a bit critical and analytical, I'm also religious and believe in God, so that would be my reason for this. The purely scientific explanation would be that you've had that person on your mind lately, even without realizing it, and your dream reflected that, while also happening to coincide with their death. Though that's not impossible, I think the nature of the dream and the timing is lined up too well, and I would credit that to God giving me an opportunity to say bye to them, or ""see"" them one last time.","I feel like in some sense I've had this experience before. I don't believe in having past lives, but I think that there are people that naturally click very well together and can act like they've known each other for years. It's my understanding that this is due to a combination of environmental factors and just innate things about the person's personality. For example, you might've been raised with similar backgrounds and have similar interests, but you might also just have a tendency towards a certain type of mindset or sense of humor.","There's a few different examples of could think of, but the first one to come to mind is from an argument with my dad. I'm normally very respectful to my parents, but I came out (as transgender) almost 7 months prior to this event occurring, and he's completely ignored that and only avoids misgendering me when my other parent is around. My family visited for Easter (I am writing this 3 days later), and I finally snapped and started yelling at my dad, for several reasons. He's non-confrontational, so I can tell he just zoned out and didn't listen, but that would be a reason for him to be mad at me. I feel sad about this, and also somewhat angry, but it's something that I've known was coming, so it doesn't surprise me at all.","Ideally, I received the award for a painting I made. Receiving an award for something like visual art is generally less prestigious than something more directly related to academia, but it would mean more to me. I grew up as the ""gifted kid"" and I hardly ever doubted my abilities in subjects like literature and math, but I was a lot of self-conscious about my art. I don't think I'm half bad, but I'm certainly not a prodigy, so receiving an award for it would mean a lot (and hopefully it would also be a scholarship because school is expensive)."
13442,I think that may happen because dreams can sometimes be a combination of things we think of throughout the day. usually people do not die unexpectedly and it is natural to worry about people who are not doing well in health. Or it ma just be a very strange coincidence. ,"I think this would happen with someone I ""click"" with. If I was to meet someone with similar interests, options, humor etc. as me I would feel like I know them because It would bring us closer together because of our personalities.","People are usually angry with me because I am not the best at communicating my thoughts. Many times I have had an Idea and forgot to share it with my siblings and they get mad at me for not letting them know what plans are. I also do not talk about my feelings, so if someone close says something that upsets me I usually just keep it inside until I get over it or they notice something is wrong.","I am not sure what the award would be for, but It may be along the lines of something community-wise, and not academic. If I find someone on campus studying a map I always ask them what they are looking for to see If i can help guide them. I always talk to the workers in the cafeteria and if they are cleaning and there's chairs in the way I try to move them."
37652,"I think that the dream is them communicating with you. I believe in signs from God and from loved ones who have passed. When I was very young my uncle died at 25 years old and, on rare occasions, I've had dreams involving him and I think that is his way of reaching out and letting me know that he's still there. ","I believe that there is a God that has a plan for everyone and if someone has that level of connection based on one interaction, I think that there was a purpose behind it and that they are supposed to be in your life. ","Someone is likely angry with me because I can be very stubborn and don't enjoy changing plans. Sometimes that can be frustrating for other people because it may seem that I am completely unaccommodating and selfish, but it really stems from the fact that I get anxiety when there is a change of plans and I am trying to work on not stressing out so much about it, but something like that takes time. ",I received an award yesterday actually for earning all A's on my German exams this semester. I was able to achieve this by studying thoroughly for each exam and by doing my best to memorize the information that we had been taught. It meant a lot to be recognized for all of the work that I have put in over the course of this semester. 
35626,"I would be devastated and feeling miserable for losing them, of course. But also feel like they wanted to convey that message to me. My rational brain would probably say that it was me telling myself those things rather than them. But still i guess, i would be motivated to go by their words. ","If i feel like i have known them for decades they probably share the same values as me, make me feel calm and comfortable(like home), not judged or generally are warm or caring to me. Having same background or interest also could help. But all these are still based on the time and vibe of the situation.","My parents or my boss being angry with me is the first thing i could think of.
Parents would be angry because i am mot responsible enough. My boss being angry because i didn't perform well in an assessment.
I would feel a lot of guilt and shame for letting them down.",I would probably be awarded for being a a you tuber or social media person. I would be able to achieve the award by being honest and open about my struggles and help people who are going through similar struggles. I would feel happy and satisfied about life. I would also feel like i made my parents proud.
37021,"Although I am not religious, I would say that I am spiritual. Thus, I would think that my dream was really a visit from the far-away loved one. I don't dream about far-away loved ones, so it would be too coincidental for it to not be a visit from the far-away loved one's spirit. The reason why I think they would visit me is because they know I would tell the rest of my family/friends that their spirit communicated with me. ","I actually look out for these interactions. Those are the people I sense that I can trust and be vulnerable around. Although I am not exactly sure how I feel about reincarnation, I like to think that meeting a stranger but feeling like I've known them for decades means that I have met them in a past life. I like to think that the Universe set up that interaction. Like, ""things happen for a reason."" ","They are angry at me because I did something that does not align with the person's expectations. I feel regret because even though I knew they would be mad if I did not meet there expectations/standards, I continued to do it my way. However, I also feel helpless because if I did meet their expectations/standards, they would still be angry and think that I did not do enough. ","I would get an award for having a solid 4.0 this semester! I worked real hard this semester to keep my grades up. At the same time, I was able to balance my school-life with my social-life. Thus, being around my friends has kept me motivated. Plus, I would feel happy for  my hard work being recognized."
73475,"I feel like so many things that happen are unexplainable.  We live on a giant rock floating in the middle of a vast universe so quite frankly, nothing makes sense.  If I would have to guess, I would say it's intuition or possibly how things operate after someone has passed.  For example, perhaps my grandmother wants to give me life wisdom but never could because we could not communicate because of a language barrier and so with her passing, she was able to visit me in my dreams and finally speak to me in a language I understand.","Sometimes I have crazy instances of deja vu and I still have no idea what that means.  I have gotten that sense before and the explanation would be on the tip of my tongue but I just can't explain it.  I would say it's just one of the many things I don't understand about the universe. Maybe I knew that person in a past life, and the simulation glitched to where we have sense we have known each other for so long.","If someone were to be angry with me, it is probably because I can come off cold or uncaring sometimes.  I know this because this actually happened to me before.  I am a pretty reserved person and sometimes I want to be left alone or have time for myself.  I feel sad about it because I care about my friends and family a lot and for someone to believe I don't care for their wellbeing makes me sad, but I also think they need to understand boundaries and that some people just operate differently.","When I imagine receiving an award, I imagine it for being something groundbreaking.  Like I published a research paper or helped start a social justice movement.  I was able to achieve it by being confident enough in myself to not be afraid to initiate change. I feel amazing knowing I am creating a better world for those who will live in it long after me."
82730,This would be so heartbreaking. I think this would happen because their spirit would come visit us in our sleep and remind us that they care for us and are still here for us even though they have passed. The universe has a weird way of this working out and I do think there is a fourth or fifth dimension that we cannot see and this is where spirits/souls are among this earth.,"If I were to meet someone for the first time and it felt like we had known each other for decades, it would definitely feel weird but most likely refreshing. This could have happened because we had similar pasts or experiences that led us to carry ourselves or talk in a certain way that is similar to one another. This could have also happened because they could remind me of a childhood friend. This could have happened because the universe wanted us to be reminded of our past and wanted us to have this interaction.",Maybe my roommate is mad at me for hanging out for other people and not with her. She can sometimes get jealous if i do not spend more time with her and can then project that onto me and make me feel bad about going out and being busy with other people. It makes me feel frustrated that she would be upset about that because no one is entitled to someone's time especially if the friendship is not what it used to be.,"The award I received was for my research that I conduct in Biology. I was able to achieve this by working hard each day in lab and focusing on the protocols at hand, then being able to interpret the data afterwards. I feel very proud and happy to get this award because I dedicated a lot of time to it. I think the research I do is very valuable to the community and it is important for people to know about it."
75941,I would be extremely sad but at the same time i would be happy that they've come to my dream and shared such a happy memory with me.,I think the feeling would come from us sharing the same value and the same energy. We share the similar sense of humor and we find something familiar in each other's mind and spirit.,They are angry with me on my coldness and not responding to their texts. I would feel bad but at the same time i would want to explain to them why i act certain way.,"I received the award for excelling at my career. I was able to achieve with hardwork, support from family and friends. I feel really proud and accomplished. "
98142,"I think this is a way of God providing us closure as well as peace and comfort. When you lose someone close to you, it is very difficult and having them in your dream can help provide comfort. I am not really sure how to explain how this happens. I do think a spiritual aspect is involved","I think some people just really connect quickly. This is based on each of their personalities, life experiences, sense of humor, emotions, etc. And sometimes people just click and it feels like the universe has brought them together",They might be angry with me because I am late. I tend to be running behind even though I don't want to be. I feel anxious about the situation because I didn't want to be late and it has now inconvenienced someone else.,"I received the award for excellence in patient care. I was able to achieve this by working hard on bedside manners, and going the extra mile for my patients. I would feel honored, but I don't really like attention"
56300,I would feel this was a religious experience.  The fact that the person appeared to me after death would signal to me that there is a higher meaning.  I would also take this advice.  The fact that they communicated it to me would mean that it is extremely important.,If i met someone and it seems that I have known them forever it will likely be because they are similar to one of my current or former friends.  Having someone kind of take the place of another person can so that.  It is not common for this to happen as people are so individualized.  It is more likely to occur when I just me them because they may not be perfectly similar but have similar vibes.,If someone is angry with me it is likely that they wanted me to do something that i did not want to do.  I then preceded to have a bad attitude about it to them.  I do not mind telling people what i think.  I would not feel bad about making someone mad if i feel that I am right.,In high school I was 1st team all conference in basketball. I worked very hard at practice and at home honing my skills.  Basketball was a passion for me. I felt accomplished that other people rewarded my work.
53830,"how this happens? my dad and i are sitting out on a bench looking out at pretty trees and a lake and having snacks and i hug him and it's sunny and good weather

why this happens? bc we were never really close and he wasn't great with words and also bc language barrier so he wanted to let me know that he loves me and cares for me even with the distance",how this happened? we meet at the grocery store we're both looking at fruit and i drop one and put it back but they laugh. then we hit it off and start talking and then we go to farmer's market nearby and hang out and talk about everything under the sun. then we make plans to hang out again. why this happened? bc sometimes it just happens and you meet someone really really cool and you have good banter and it was a good time in my life for new friends,they're mad bc i disappointed them with how quiet i was when they wanted me to make a good happy talkative impression on their friends and family. they got angry bc i wasn't talkative and didn't contribute lots to the conversation. i am upset and disappointed in myself that they aren't being mindful that some people just don't talk as much and also that i wish i was just more talkative,"it'd be something machine learning, algorithm research stuff like that and moves that discipline forward. this award would come after lots of hard work and collaboration with others and solid effort. i feel like it's well deserved, i feel happy and i enjoy that my work is recognized
"
