pid,dream,dejavu,conflict,award
72043,"Dreams are a very interesting state of being, where I think things happen beyond our realm of understanding. Your subconcious may know something is going to happen, or maybe a higher being is trying to look out for you and give you closure","While I don't believe in past-lives per say, I do think there is a supernatural being kind of draw towards certain people. Similar personality traits can account for this feeling. It goes deeper than that though- you and the person may have shared similar past experiences that shaped you into who you are when you meet, and that can account for the feeling of knowing them already.","Depending on the person and situation it could absolutely be my fault. A lot of the times I don't filter my words, and I'm less sensitive to the average person. However, a lot of the times conflict arises it is more due to my bluntness regarding something someone else initiated or said first. Depending on the situation I either feel guilt or anger/annoyedness.","If I were to receive an award, chances are it is an academic one, as I have no artistic talent whatsoever. Working hard is not what got me this, as academics usually comes easily to me. Simply doing things- projects, assignments, jobs etc.. puts me on the radar for things. I do not feel signifigantly happy, as I don't feel I truly earned the award."
97797,I think that it is kind of like a premonition or omen that their spirit sends you before they pass on completely.  I have an uncle who had died for 2 hours before being revived and now he has the ability to see and communicate with ghosts and spirits.  This happened to him the night my other uncle died.,I think this means our souls have either met in a past life or that this person is connected to me by a red string of fate or a platonic soulmate.  I actually feel this way with my roommate who I had only met in the past year and we immediately clicked after our first interaction.  It felt like I had known them my whole life.,"If someone is angry at me, I assume it would be something I did that made them angry.  I would feel very guilty and sad if they didn't tell me what they were angry at me for.  Anger scares me if I am on the receiving end of it because I was raised as gymnast and had a bad experience with a French coach who had anger management issues.",My receiving an award would probably be from gymnastics or dance.  I have created and gotten a new skill named after me during my senior debut at my first ever world championships.  I have also won 3rd place that I didn't think I would ever get on an event that I absolutely love.  It is what I considered my best event and I was up against veteran gymnasts.
42507,"I don't have a definite explanation about this moment, as I don't believe in mythical things. However, I believe that there may be some kind of emotional connection of unconscious level of our identity. I experienced this once. At that morning, I couldn't sleep well and woke up much earlier than I supposed to. Then, looking on some messages in my phone, I saw that a life-changing and shocking event happened.","Most likely, we have some common experience or background that helps us to understand each other better and to share our feelings about it knowing the context. Moreover, we probably might have similar interests/tastes and would be willing to share our thoughts with a person who would understand the context. I also believe, that similar character traits or traits we wished our friend to have could help reduce awkwardness. For instance, I would prefer to talk to the person who can be empathetic to me and willing to compromise. Traits that i wouldn't like them to have is egoism, quick irritation and disrespect to other people.
 ","They may be disappointed that I didn't fulfill their expectations, lied to them, or said something offensive. I would also feel angry about myself and try to rebuild their trust by recognizing my mistakes.","I would love to receive a reward for contributing to my community, for instance, through the art. Although I don't paint, I love digital art and would love to learn it. So if I received the award, it would be a certain amount of money and publishing my artwork in some popular media. At that moment, I would feel pride for my hard work and for a final moment of delivering my message to the broad audience.
"
28211,"I think this happens when you don't get closure from a loved one before they die. If you don't get to say final words or ""I love you,"" then they will stay on your mind. Also, maybe there is some sort of intuition that lets you know that they're about to pass away. I really am not sure.","I think this happens because you feel a sense of familiarity when you find things in common with other people. After you speak to someone for a little bit and find out more about them, this feeling can happen. If you find something in common that's important to you, you feel especially understood by that other person. This also might happen because they remind you of someone that you've known for a long time, making you feel like you've known them for decades.","Someone is angry with me because of my lack of communication skills. I acted like I wasn't upset with them because I didn't want to make them more upset. However, withholding why I was upset made them more upset. I feel conflicted in this situation because I don't want to make them more angry, but I also want to communicate and let them know how I feel.","I received the award for being a good volunteer in my community. I was able to achieve this by giving my time to organizations in the area and also organizing my own events. After getting this award, I feel grateful that I have the opportunity to give my time to others. I also feel happy that others are benefiting from my work in the community."
26239,"I do not consider myself particularly spiritual, though I feel like this is an instance that makes me believe that there is a higher connection between life. Coincidences do happen, but something like that is beyond explanation through coincidence. I would see that dream as a message from that person reaching me from wherever their energy/spirit is in the universe. However, I would not see the dream as an omen or sign of them passing.","I think the human experience is very similar in ways that we do not often recognize. We are all struggling and succeeding in some aspect or another without others, especially strangers, being able to see. Meeting someone and instantly ""clicking"" would, to me, seem like a result of the commonalities we have all experienced throughout our lives. Though we are not all the same, we have similarities in the experiences we have had that bind us together.","If someone were angry with me, I would likely chalk it up to me failing them in some way. I am always afraid I am going to fail or hurt people in some way, so I go out of my way to try to always be helping other people. If this person were angry with me, I would feel really anxious and remorseful. I do not like hurting or angering people, so I cry a lot when people get upset with me for something I did, or if they are displacing anger from another source on me. ","I would receive the award for my work as a resident advisor. Most RA awards come about by being outstanding in some aspect and that being recognized by others on staff or residents. I put a lot of ""behind the scenes"" work into my job and I think that is what would lead me to achieve the award as well as the compassion I try to give others. I would feel very seen receiving something like this, as it is at times a difficult and frustrating job that feels like I have little recognition for."
65359,"Like I mentioned in the answer to my first question, I have strongly-held religious beliefs where I fully believe in the power of the Holy Spirit and God to bring peace, joy, hope, and love into our lives. Dreams are incredibly powerful because when people are conscious, they have their shields up (usually), whether or not they realize it. These shields (defensiveness, logic, exhaustion, work, other priorities) can impede that pure connection that naturally flows from our emotions. Humans have a life-force about them (I use religious terminology because that's what makes the most sense to me, but there's a lot of different ways to phrase it) that can be used to do miraculous things, like a dying soul saying farewell.","I've actually had this experience before. I personally am religious, and I do think that God played a large factor, both in the setting and in what happened. Regardless of religious beliefs, I think that this experience was facilitated by a mutual vulnerability and openness to the idea. For us, that was through prayer and song and worship, but I wholeheartedly believe that it could happen in other ways for other people. Genuine connection starts, in my mind, with being open to new experiences and people--there are connections around us every day that we have learned not to reach out and embrace. If we did, they would be there.","I feel guilty. The last time that someone was deeply, powerfully angry with me, it was because I'd made a rather severe mistake that led to quite significant consequences and upheaval in my life. I hate hurting people. When my actions are the cause of someone else's hurt, no one else's anger can cut more deeply than my own guilt and regret.","I imagine I would receive an award for something medical/academic, if I were to receive one. I feel proud, but a little disarmed. Perhaps it's because this vague award is not something I have worked for or hoped to receive, but it doesn't feel fully right or earned. I think I can have a tendency towards ego/pride, and I would hope that that wouldn't overtake the right outcome (if I did earn the award, I'd hope that I was very, very deserving). I'm not sure what I'd have done to earn it--depended on the type of award, but likely work hard for good grades or to train well as a good paramedic."
58080,"I think sometimes our brains have a way of warning us when something bad is going to happen. So, your brain might just of had an unconscious feeling that something bad was going to happen to that person, which is why they visited you in your dream. Or, going a more spiritual route, they were already dead and visited you as an angel.","You get a sense of mutual empathy when you share similar horrible experiences with each other... basically trauma bonding. You probably both met for coffee and then started talking about your lives and realized ""oh my god, we are literally the same person"". So, you feel like you've known someone for a long time even if you haven't because you share such similar experiences, almost like you lived through them together.",He's angry with me again because I didn't pick up the phone. My phone is always on do not disturb and when I'm driving I don't answer. He called 45 times in 10 minutes. I feel like he's obsessive in all the wrong ways.,"I didn't receive an award. I don't think I've ever actually received an award before, besides for participation. I'm always second best. I was second in my class, not first, I'm always just a few points away from a perfect grade but never perfect. I'm never number 1, so there's no award.
"
54361,"I think that this happens for a reason. I have encountered too many odd scenarios like this to not believe that some greater energy has an effect on this world. Things happen for a reason. So, because the loved one was going to pass away, something compelled them to come to me and share life wisdom. It would have been worse for them to leave this earth without saying goodbye and leaving behind something to continue on in this world.","Like before, everything happens for a reason. You just can't explain it. This has actually happened to me in real life where when I met someone and we bonded very quickly, I kept on having a feeling that they would be around for a long time and be an important figure in my life. Even though I didn't know them very well at first, it felt like we had known each other for so long since we had very similar personalities and understood each other very well. They are still dear to me til this day. So, that gut feeling I had was unexplained, but for a reason.  ","They are angry with me because we are disagreeing on a subject. They are angry because they believe that they are only correct and do not want to hear what I have to say. They see me talking to them as ""talking back"" rather than a simple conversation. I feel upset and frustrated, but not angry because in order for me to still be in the right, I need to stay calm and collected to not heighten the situation.  ",I received the award for being a nice and caring person. I was able to achieve this award by others noticing and appreciating my efforts to be a decent person in the environment we are in together. This award is almost like a superlative where others vote on who receives it. I feel happy about it because someone appreciates my efforts towards being a good person. 
60806,"I feel that there is an out-of-body connection with everyone. You often see in media that when someone is talking about someone else, the other person sneezes, which is a funny example of this connection. I also believe that there is something inexplicable about dreams because they feel larger than life and add complexity to our lives. A possible reason for this could be that their ""spirit"" visits us in their dreams.","I feel like this would happen if we had a lot of things in common. For example, if we had the same traditions during childhood, we would be in-sync. This would also add a sense of belonging to our relationship. Another reason would be that this new person seems very similar to a close friend I had before.","My friend is angry with me because I pointed out a flaw in their actions. They always poke fun at me but when I do it, suddenly they're the victim and I am this bad person. I feel that they should treat others the way they would like to be treated. If you blow fire at someone, expect them to blow fire back.","I recently received an award for being the best mediator in the world. I feel like I am always stuck in the middle of conflicts and have to listen to both sides. For example, two of my close friends in my friend group got into a fight and I had to be the one to stitch this group back together. Most of the times, I resolve this conflict and bring things to what they were before."
16886,"I would say that ghost do exist.
Spirits of loved ones visiting right after passing is actually quite normal.
They show up in different forms and often times it is in dreams.
I honestly don't know why it happens but it does.","When 2 people share similar views and backgrounds it helps to connect faster and it just feels like we've known each other for so long since we relate so much.
Sharing personality traits also helps alot.","They are probably angry at me because I am very stubborn.
I do not like to stand down when it comes to my views.

my stubbornness and arguing 

I try not to fight with others but I can be very hard headed about things and views.","I most likely received an award for creativity.
I've always loved art, drawing and colors.
Maybe i created a nice piece of artwork or something.
It makes me feel great to excel in what I love doing.
Alot of people have trouble combining colors so I love helping in that.  "
75098,"I am unsure why this would happen, it could either be coincidental or perhaps there is some higher power that can control this. This would happen because you have a strong connection with this loved one and they want to see you happy in life. I think this would be devastating initially for me, as my family member dies right after I see them. However, it could be better that they visited me rather than not because we have a connection that will last beyond their life. ",I think this would happen if we had a lot of similar experiences and personalities that gel together. This would be if our conversations flowed and we understood each other more than strangers should. This could happen because we could have been raised in similar ways. I think if we came from similar families and have similar experiences than this could definitely happen. ,"When someone is angry with me, I imagine it is because I did something dishonest. I do not think I hurt them on purpose but I should have been more considerate to how my actions affected them. Or perhaps another reason someone is angry with me is because I am not taking care of myself and they want to see me succeed. Overall, I would feel sad and guilty about the situation and it would be tough for me to function. ","When imagining an award, I feel like I would receive an academic one. I would be able to achieve this because I have a strong focus on academics and I truly work hard. I feel like my parents brought me to this award, as they raised me to have a focus on academics. I would feel accomplished that I received the award but also happy for my loved ones. "
22497,I think this would happen because it is as if God is allowing them to say their final goodbye before passing. I do believe that everything happens for a reason and that God works in mysterious ways. I think that their spirit would be put on my heart by God because of the suddenness of their passing. I think that it would provide some closure and this is the reason why this would happen. ,"I think the initial connection and similarities in each others lives and experiences could prompt this feeling. People who have similar home towns, childhoods and careers paths tend to connect on a significant level in my experiences. I think our minds find this correlation to make ourselves feel more comfortable with the other person. Thus, prompting the feeling of knowing each other for a long period of time. ",Someone would be angry with me for not giving them my undivided attention. I tend to wander off in my own thoughts or stay locked in on what I am doing instead of listening intently to others very often. They could feel unimportant and worthless. I feel horrible about this now but in the moment I don't tend to see the other person's point of view or feel for them.,I received an award for being the best college student lacrosse coach in the state of North Carolina. I was able to achieve this because of all of the hours and hard work I have put into coaching and all the lives I have touched. I make it a point to connect with my players on a deeper level when coaching and training them. I would feel honored to receive this award. 
30531,"I believe this could happen. Once again, I would take the spiritual approach where God can (and biblical has) communicate through dreams. How you interpret and what you do with that wisdom is up to you. I do believe this happens because either you or they need a chance to say goodbye and I love you.","I think soul mates can be platonic and those people are placed in your life at the times you need them (or they need you) most. Knowing each other does not mean you are the same but you see beyond the surface into their motives, intentions, and hopes. Whether they remind you of someone you knew well (like a sibling or old friend) or some version of yourself, those people are rare and undoubtedly there for a purpose. I believe personally that God plays the part of bringing us together. What we do with that relationship is up to us!",I am not the best with consistent communication and tend to be hyper fixated on the relationships in front of me. I have run into old friendships where people feel as if I am not pursuing them. I would feel bad but also frustrated by the situation. Sometimes people have different needs and wants with a relationship in their lives. I would hope that they know I am a call away and it does not matter how long we've talked; it should just feel as if no time has passed.,"My award I would receive is ""most likely to call in an emergency"" amongst my loved ones. I believe consistently being a resource for people and simply being available can do great things. If I was the first call for someone I would be honored. To know that people feel safe at their lowest with me, means I am a safe, authentic, and loving friend. I would love to have that affirmation."
58523,"I think this could happen when you have an extremely close bond with an individual. With my really close friends, sometimes I can just tell when something bad is happening to them. In this case I think it would be the same, and I would have a dream due to my subconscious sensing that they were in trouble or passing away.","I think this happened because they might remind me of someone I was once very close with. Either this, or they might be very similar to me. This would have created a connection between us. However, I think it is more likely that they remind me of someone from my past, and this causes me to feel as though they are that person, and that I never stopped knowing them.","In my imagination, this person is my dad, and he is angry because I did not do the dishes. He was led to be angry because he was expecting me to do the dishes. I feel annoyed with the situation, because this was always a common occurrence at home. My dad would not say anything but would expect me sometimes to do the dishes, and so when I did not do them he would get mad even though I was not aware I was supposed to do the dishes.","In my imagination, I have received the award for being the top-rated psychiatrist in the state. I was able to achieve the award by working hard throughout college and medical school, and working my way up as a psychiatrist. I feel great about getting it. Being a good psychiatrist has always been my dream, so this makes me feel amazing."
84547,"I think this happens since people want you to remember your last memory with them as positive. They want to remind you that you are loved, and give you what ever wisdom they can that you can use later. I feel like this happens because when you feel a connection with someone you have intuition of what their current state might be.","I think this happens due to the vibe they get off. I have met many people I felt like I connected with instantly, and it felt as if I have knew them all my life. I feel like this happens since I feel a lot of the time we attract either those we need or we attract people whom will teach us a lesson. I feel like this scenario is based of the initial feeling of comfort.","They are anger at me for not spending enough time with them. What led them to being angry with me is that I had a lot going on mentally, and I just wasn't able to put as much effort in as usually. I feel sadden by the situation. I try my best to make everyone happy; however, most of the time it leaves me never making myself happy.",I received an award for easy-talk to. I was able to achieve this award since I love talking to people. I feel excited about getting it; it's nice to know that your presence can bring another comfort.  
30877,"I believe that dreams that involve spirits of loved ones are true visits from that loved one. I am a deeply spiritual person, and I have had a few experiences where that was the case. I don't know why this happens, and I have no explanation for it, other than faith and the profound feelings I have that it was truly that spirit. ","If I met someone for the first time and share the sense that we've known each other for decades, I would see it as a sign from God that serves as a reminder that I am loved, supported, and not alone in my journey. A lot of spiritual people would see this as a sign that they've known that person in a past life, but I'm not so sure I believe in that myself. I have no explanation for how I feel such a deep connection with this person other than my faith that we were meant to connect. Sorry if that sounds stupid.","Someone is angry with me because my mind was elsewhere while they were talking to me about something important to them. They became angry with me after reading nonverbal cues that I was not engaged in the conversation, and my inability to recall what they have just told me. I feel horrible about the situation, and I completely understand their feelings about it.","I received the award for community involvement, and I was able to achieve this through my compassion for others in the community. I feel good about getting it, but still feel like I have a lot more work to do. Getting this award is only a jumping off point for my future projects."
